IDDIST,Distrito,numeros,cold_wave_exposure
"131202","La Libertad, Virú, distrito: Chao",0.000,0.000
"131203","La Libertad, Virú, distrito: Guadalupito",0.000,0.000
"130106","La Libertad, Trujillo, distrito: Laredo",0.000,0.000
"130902","La Libertad, Sánchez Carrión, distrito: Chugay",1350.000,0.135
"130903","La Libertad, Sánchez Carrión, distrito: Cochorco",0.000,0.000
"130904","La Libertad, Sánchez Carrión, distrito: Curgos",0.000,0.000
"130807","La Libertad, Pataz, distrito: Ongon",0.000,0.000
"130808","La Libertad, Pataz, distrito: Parcoy",0.000,0.000
"130809","La Libertad, Pataz, distrito: Pataz",0.000,0.000
"130810","La Libertad, Pataz, distrito: Pias",0.000,0.000
"130811","La Libertad, Pataz, distrito: Santiago de Challas",0.000,0.000
"130812","La Libertad, Pataz, distrito: Taurija",0.000,0.000
"130813","La Libertad, Pataz, distrito: Urpay",0.000,0.000
"130901","La Libertad, Sánchez Carrión, distrito: Huamachuco",1233.000,0.123
"130905","La Libertad, Sánchez Carrión, distrito: Marcabal",0.000,0.000
"130906","La Libertad, Sánchez Carrión, distrito: Sanagoran",0.000,0.000
"131001","La Libertad, Santiago de Chuco, distrito: Santiago de Chuco",8709.000,0.871
"250201","Ucayali, Atalaya, distrito: Raymondi",0.000,0.000
"250401","Ucayali, Purús, distrito: Purús",0.000,0.000
"250203","Ucayali, Atalaya, distrito: Tahuania",0.000,0.000
"250204","Ucayali, Atalaya, distrito: Yurua",0.000,0.000
"250103","Ucayali, Coronel Portillo, distrito: Iparia",0.000,0.000
"250301","Ucayali, Padre Abad, distrito: Padre Abad",0.000,0.000
"250305","Ucayali, Padre Abad, distrito: Alexander Von Humboldt",0.000,0.000
"250302","Ucayali, Padre Abad, distrito: Irazola",0.000,0.000
"250104","Ucayali, Coronel Portillo, distrito: Masisea",0.000,0.000
"250304","Ucayali, Padre Abad, distrito: Neshuya",0.000,0.000
"250303","Ucayali, Padre Abad, distrito: Curimana",0.000,0.000
"250107","Ucayali, Coronel Portillo, distrito: Manantay",0.000,0.000
"250102","Ucayali, Coronel Portillo, distrito: Campoverde",0.000,0.000
"250106","Ucayali, Coronel Portillo, distrito: Nueva Requena",0.000,0.000
"250105","Ucayali, Coronel Portillo, distrito: Yarinacocha",0.000,0.000
"250101","Ucayali, Coronel Portillo, distrito: Calleria",0.000,0.000
"061001","Cajamarca, San Marcos, distrito: Pedro Gálvez",0.000,0.000
"061004","Cajamarca, San Marcos, distrito: Gregorio Pita",0.000,0.000
"061005","Cajamarca, San Marcos, distrito: Ichocan",0.000,0.000
"061006","Cajamarca, San Marcos, distrito: José Manuel Quiroz",0.000,0.000
"060102","Cajamarca, Cajamarca, distrito: Asunción",0.000,0.000
"060105","Cajamarca, Cajamarca, distrito: Encañada",0.000,0.000
"060202","Cajamarca, Cajabamba, distrito: Cachachi",0.000,0.000
"060203","Cajamarca, Cajabamba, distrito: Condebamba",0.000,0.000
"060204","Cajamarca, Cajabamba, distrito: Sitacocha",0.000,0.000
"060306","Cajamarca, Celendín, distrito: José Galvez",0.000,0.000
"060308","Cajamarca, Celendín, distrito: Oxamarca",0.000,0.000
"060309","Cajamarca, Celendín, distrito: Sorochuco",0.000,0.000
"060504","Cajamarca, Contumazá, distrito: Guzmango",0.000,0.000
"061105","Cajamarca, San Miguel, distrito: El Prado",0.000,0.000
"061109","Cajamarca, San Miguel, distrito: Niepos",0.000,0.000
"061110","Cajamarca, San Miguel, distrito: San Gregorio",0.000,0.000
"061203","Cajamarca, San Pablo, distrito: San Luis",0.000,0.000
"140103","Lambayeque, Chiclayo, distrito: Eten",0.000,0.000
"140106","Lambayeque, Chiclayo, distrito: La Victoria",0.000,0.000
"140107","Lambayeque, Chiclayo, distrito: Lagunas",0.000,0.000
"140108","Lambayeque, Chiclayo, distrito: Monsefu",0.000,0.000
"140109","Lambayeque, Chiclayo, distrito: Nueva Arica",0.000,0.000
"140113","Lambayeque, Chiclayo, distrito: Reque",200.000,0.020
"140114","Lambayeque, Chiclayo, distrito: Santa Rosa",0.000,0.000
"140115","Lambayeque, Chiclayo, distrito: Saña",0.000,0.000
"140116","Lambayeque, Chiclayo, distrito: Cayalti",0.000,0.000
"150201","Lima, Barranca, distrito: Barranca",50.000,0.005
"150806","Lima, Huaura, distrito: Huaura",0.000,0.000
"150902","Lima, Oyón, distrito: Andajes",428.000,0.043
"150903","Lima, Oyón, distrito: Caujul",376.000,0.038
"150904","Lima, Oyón, distrito: Cochamarca",34.000,0.003
"150905","Lima, Oyón, distrito: Navan",246.000,0.025
"150202","Lima, Barranca, distrito: Paramonga",0.000,0.000
"150204","Lima, Barranca, distrito: Supe",0.000,0.000
"150205","Lima, Barranca, distrito: Supe Puerto",0.000,0.000
"020301","Áncash, Antonio Raymondi, distrito: Llamellin",0.000,0.000
"021206","Áncash, Huaylas, distrito: Pamparomas",0.000,0.000
"020502","Áncash, Bolognesi, distrito: Abelardo Pardo Lezameta",0.000,0.000
"020503","Áncash, Bolognesi, distrito: Antonio Raymondi",0.000,0.000
"020505","Áncash, Bolognesi, distrito: Cajacay",0.000,0.000
"020506","Áncash, Bolognesi, distrito: Canis",0.000,0.000
"020507","Áncash, Bolognesi, distrito: Colquioc",0.000,0.000
"020511","Áncash, Bolognesi, distrito: La Primavera",0.000,0.000
"020512","Áncash, Bolognesi, distrito: Mangas",0.000,0.000
"020513","Áncash, Bolognesi, distrito: Pacllon",0.000,0.000
"020514","Áncash, Bolognesi, distrito: San Miguel de Corpanqui",0.000,0.000
"020515","Áncash, Bolognesi, distrito: Ticllos",0.000,0.000
"020105","Áncash, Huaraz, distrito: Independencia",0.000,0.000
"020305","Áncash, Antonio Raymondi, distrito: Mirgas",0.000,0.000
"021809","Áncash, Santa, distrito: Nuevo Chimbote",0.000,0.000
"020901","Áncash, Corongo, distrito: Corongo",0.000,0.000
"020902","Áncash, Corongo, distrito: Aco",0.000,0.000
"020903","Áncash, Corongo, distrito: Bambas",0.000,0.000
"020904","Áncash, Corongo, distrito: Cusca",0.000,0.000
"020905","Áncash, Corongo, distrito: La Pampa",0.000,0.000
"020906","Áncash, Corongo, distrito: Yanac",0.000,0.000
"020907","Áncash, Corongo, distrito: Yupan",0.000,0.000
"021405","Áncash, Ocros, distrito: Cochas",0.000,0.000
"060103","Cajamarca, Cajamarca, distrito: Chetilla",0.000,0.000
"060104","Cajamarca, Cajamarca, distrito: Cospan",0.000,0.000
"060503","Cajamarca, Contumazá, distrito: Cupisnique",0.000,0.000
"060505","Cajamarca, Contumazá, distrito: San Benito",0.000,0.000
"020205","Áncash, Aija, distrito: Succha",0.000,0.000
"021008","Áncash, Huari, distrito: Huantar",0.000,0.000
"021009","Áncash, Huari, distrito: Masin",0.000,0.000
"021010","Áncash, Huari, distrito: Paucas",0.000,0.000
"021011","Áncash, Huari, distrito: Ponto",0.000,0.000
"021012","Áncash, Huari, distrito: Rahuapampa",0.000,0.000
"021013","Áncash, Huari, distrito: Rapayan",0.000,0.000
"021014","Áncash, Huari, distrito: San Marcos",0.000,0.000
"021015","Áncash, Huari, distrito: San Pedro de Chana",0.000,0.000
"021016","Áncash, Huari, distrito: Uco",0.000,0.000
"021101","Áncash, Huarmey, distrito: Huarmey",0.000,0.000
"021102","Áncash, Huarmey, distrito: Cochapeti",0.000,0.000
"021103","Áncash, Huarmey, distrito: Culebras",0.000,0.000
"021104","Áncash, Huarmey, distrito: Huayan",0.000,0.000
"021105","Áncash, Huarmey, distrito: Malvas",0.000,0.000
"021201","Áncash, Huaylas, distrito: Caraz",0.000,0.000
"021207","Áncash, Huaylas, distrito: Pueblo Libre",0.000,0.000
"020204","Áncash, Aija, distrito: La Merced",0.000,0.000
"020302","Áncash, Antonio Raymondi, distrito: Aczo",0.000,0.000
"020303","Áncash, Antonio Raymondi, distrito: Chaccho",0.000,0.000
"020304","Áncash, Antonio Raymondi, distrito: Chingas",0.000,0.000
"020804","Áncash, Casma, distrito: Yautan",0.000,0.000
"020501","Áncash, Bolognesi, distrito: Chiquian",0.000,0.000
"020504","Áncash, Bolognesi, distrito: Aquia",0.000,0.000
"020508","Áncash, Bolognesi, distrito: Huallanca",0.000,0.000
"020509","Áncash, Bolognesi, distrito: Huasta",0.000,0.000
"020510","Áncash, Bolognesi, distrito: Huayllacayan",0.000,0.000
"020601","Áncash, Carhuaz, distrito: Carhuaz",0.000,0.000
"020602","Áncash, Carhuaz, distrito: Acopampa",0.000,0.000
"020603","Áncash, Carhuaz, distrito: Amashca",0.000,0.000
"020604","Áncash, Carhuaz, distrito: Anta",0.000,0.000
"020605","Áncash, Carhuaz, distrito: Ataquero",0.000,0.000
"020606","Áncash, Carhuaz, distrito: Marcara",0.000,0.000
"020607","Áncash, Carhuaz, distrito: Pariahuanca",0.000,0.000
"020101","Áncash, Huaraz, distrito: Huaraz",0.000,0.000
"020102","Áncash, Huaraz, distrito: Cochabamba",0.000,0.000
"020104","Áncash, Huaraz, distrito: Huanchay",0.000,0.000
"020106","Áncash, Huaraz, distrito: Jangas",0.000,0.000
"020107","Áncash, Huaraz, distrito: La Libertad",0.000,0.000
"020108","Áncash, Huaraz, distrito: Olleros",0.000,0.000
"020109","Áncash, Huaraz, distrito: Pampas Grande",0.000,0.000
"020110","Áncash, Huaraz, distrito: Pariacoto",0.000,0.000
"020111","Áncash, Huaraz, distrito: Pira",0.000,0.000
"020112","Áncash, Huaraz, distrito: Tarica",0.000,0.000
"020201","Áncash, Aija, distrito: Aija",0.000,0.000
"020202","Áncash, Aija, distrito: Coris",0.000,0.000
"020203","Áncash, Aija, distrito: Huacllan",0.000,0.000
"020306","Áncash, Antonio Raymondi, distrito: San Juan de Rontoy",0.000,0.000
"020401","Áncash, Asunción, distrito: Chacas",0.000,0.000
"020402","Áncash, Asunción, distrito: Acochaca",0.000,0.000
"020701","Áncash, Carlos Fermín Fitzcarrald, distrito: San Luis",0.000,0.000
"020801","Áncash, Casma, distrito: Casma",0.000,0.000
"020802","Áncash, Casma, distrito: Buena Vista Alta",0.000,0.000
"021409","Áncash, Ocros, distrito: San Pedro",0.000,0.000
"021410","Áncash, Ocros, distrito: Santiago de Chilcas",0.000,0.000
"021701","Áncash, Recuay, distrito: Recuay",0.000,0.000
"021702","Áncash, Recuay, distrito: Catac",0.000,0.000
"021703","Áncash, Recuay, distrito: Cotaparaco",0.000,0.000
"021704","Áncash, Recuay, distrito: Huayllapampa",0.000,0.000
"021705","Áncash, Recuay, distrito: Llacllin",0.000,0.000
"021706","Áncash, Recuay, distrito: Marca",0.000,0.000
"021707","Áncash, Recuay, distrito: Pampas Chico",0.000,0.000
"021708","Áncash, Recuay, distrito: Pararin",0.000,0.000
"021709","Áncash, Recuay, distrito: Tapacocha",0.000,0.000
"021710","Áncash, Recuay, distrito: Ticapampa",0.000,0.000
"021805","Áncash, Santa, distrito: Moro",0.000,0.000
"021806","Áncash, Santa, distrito: Nepeña",0.000,0.000
"021807","Áncash, Santa, distrito: Samanco",0.000,0.000
"022001","Áncash, Yungay, distrito: Yungay",0.000,0.000
"022002","Áncash, Yungay, distrito: Cascapara",0.000,0.000
"022003","Áncash, Yungay, distrito: Mancos",0.000,0.000
"022004","Áncash, Yungay, distrito: Matacoto",0.000,0.000
"022005","Áncash, Yungay, distrito: Quillo",0.000,0.000
"022006","Áncash, Yungay, distrito: Ranrahirca",0.000,0.000
"022007","Áncash, Yungay, distrito: Shupluy",0.000,0.000
"022008","Áncash, Yungay, distrito: Yanama",0.000,0.000
"020103","Áncash, Huaraz, distrito: Colcabamba",0.000,0.000
"021202","Áncash, Huaylas, distrito: Huallanca",0.000,0.000
"021203","Áncash, Huaylas, distrito: Huata",0.000,0.000
"021204","Áncash, Huaylas, distrito: Huaylas",0.000,0.000
"021205","Áncash, Huaylas, distrito: Mato",0.000,0.000
"020702","Áncash, Carlos Fermín Fitzcarrald, distrito: San Nicolás",0.000,0.000
"020703","Áncash, Carlos Fermín Fitzcarrald, distrito: Yauya",0.000,0.000
"021208","Áncash, Huaylas, distrito: Santa Cruz",0.000,0.000
"021209","Áncash, Huaylas, distrito: Santo Toribio",0.000,0.000
"021210","Áncash, Huaylas, distrito: Yuracmarca",0.000,0.000
"021301","Áncash, Mariscal Luzuriaga, distrito: Piscobamba",0.000,0.000
"021302","Áncash, Mariscal Luzuriaga, distrito: Casca",0.000,0.000
"021303","Áncash, Mariscal Luzuriaga, distrito: Eleazar Guzmán Barron",0.000,0.000
"021304","Áncash, Mariscal Luzuriaga, distrito: Fidel Olivas Escudero",0.000,0.000
"021305","Áncash, Mariscal Luzuriaga, distrito: Llama",0.000,0.000
"021306","Áncash, Mariscal Luzuriaga, distrito: Llumpa",0.000,0.000
"021307","Áncash, Mariscal Luzuriaga, distrito: Lucma",0.000,0.000
"021308","Áncash, Mariscal Luzuriaga, distrito: Musga",0.000,0.000
"021501","Áncash, Pallasca, distrito: Cabana",0.000,0.000
"021502","Áncash, Pallasca, distrito: Bolognesi",0.000,0.000
"020803","Áncash, Casma, distrito: Comandante Noel",0.000,0.000
"020608","Áncash, Carhuaz, distrito: San Miguel de Aco",0.000,0.000
"020609","Áncash, Carhuaz, distrito: Shilla",0.000,0.000
"020610","Áncash, Carhuaz, distrito: Tinco",0.000,0.000
"020611","Áncash, Carhuaz, distrito: Yungar",0.000,0.000
"021001","Áncash, Huari, distrito: Huari",0.000,0.000
"021002","Áncash, Huari, distrito: Anra",0.000,0.000
"021003","Áncash, Huari, distrito: Cajay",0.000,0.000
"021004","Áncash, Huari, distrito: Chavin de Huantar",0.000,0.000
"021005","Áncash, Huari, distrito: Huacachi",0.000,0.000
"021006","Áncash, Huari, distrito: Huacchis",0.000,0.000
"021007","Áncash, Huari, distrito: Huachis",0.000,0.000
"021401","Áncash, Ocros, distrito: Ocros",0.000,0.000
"021402","Áncash, Ocros, distrito: Acas",0.000,0.000
"021403","Áncash, Ocros, distrito: Cajamarquilla",0.000,0.000
"021404","Áncash, Ocros, distrito: Carhuapampa",0.000,0.000
"021406","Áncash, Ocros, distrito: Congas",0.000,0.000
"021407","Áncash, Ocros, distrito: Llipa",0.000,0.000
"021408","Áncash, Ocros, distrito: San Cristóbal de Rajan",0.000,0.000
"021503","Áncash, Pallasca, distrito: Conchucos",0.000,0.000
"021504","Áncash, Pallasca, distrito: Huacaschuque",0.000,0.000
"021505","Áncash, Pallasca, distrito: Huandoval",0.000,0.000
"021506","Áncash, Pallasca, distrito: Lacabamba",0.000,0.000
"021507","Áncash, Pallasca, distrito: Llapo",0.000,0.000
"021508","Áncash, Pallasca, distrito: Pallasca",0.000,0.000
"021509","Áncash, Pallasca, distrito: Pampas",0.000,0.000
"021510","Áncash, Pallasca, distrito: Santa Rosa",0.000,0.000
"021511","Áncash, Pallasca, distrito: Tauca",0.000,0.000
"021601","Áncash, Pomabamba, distrito: Pomabamba",0.000,0.000
"021602","Áncash, Pomabamba, distrito: Huayllan",0.000,0.000
"021603","Áncash, Pomabamba, distrito: Parobamba",0.000,0.000
"021604","Áncash, Pomabamba, distrito: Quinuabamba",0.000,0.000
"021801","Áncash, Santa, distrito: Chimbote",0.000,0.000
"021802","Áncash, Santa, distrito: Cáceres del Perú",0.000,0.000
"021804","Áncash, Santa, distrito: Macate",0.000,0.000
"021808","Áncash, Santa, distrito: Santa",0.000,0.000
"021901","Áncash, Sihuas, distrito: Sihuas",0.000,0.000
"021902","Áncash, Sihuas, distrito: Acobamba",0.000,0.000
"021903","Áncash, Sihuas, distrito: Alfonso Ugarte",0.000,0.000
"021904","Áncash, Sihuas, distrito: Cashapampa",0.000,0.000
"021905","Áncash, Sihuas, distrito: Chingalpo",0.000,0.000
"021906","Áncash, Sihuas, distrito: Huayllabamba",0.000,0.000
"021907","Áncash, Sihuas, distrito: Quiches",0.000,0.000
"021908","Áncash, Sihuas, distrito: Ragash",0.000,0.000
"021909","Áncash, Sihuas, distrito: San Juan",0.000,0.000
"021910","Áncash, Sihuas, distrito: Sicsibamba",0.000,0.000
"150304","Lima, Cajatambo, distrito: Huancapon",260.000,0.026
"150305","Lima, Cajatambo, distrito: Manas",0.000,0.000
"150802","Lima, Huaura, distrito: Ambar",313.000,0.031
"150804","Lima, Huaura, distrito: Checras",688.000,0.069
"150808","Lima, Huaura, distrito: Paccho",320.000,0.032
"150809","Lima, Huaura, distrito: Santa Leonor",111.000,0.011
"150811","Lima, Huaura, distrito: Sayan",169.000,0.017
"150812","Lima, Huaura, distrito: Vegueta",0.000,0.000
"150901","Lima, Oyón, distrito: Oyón",198.000,0.020
"150906","Lima, Oyón, distrito: Pachangara",43.000,0.004
"150203","Lima, Barranca, distrito: Pativilca",0.000,0.000
"150301","Lima, Cajatambo, distrito: Cajatambo",376.000,0.038
"150302","Lima, Cajatambo, distrito: Copa",323.000,0.032
"150303","Lima, Cajatambo, distrito: Gorgor",0.000,0.000
"130102","La Libertad, Trujillo, distrito: El Porvenir",0.000,0.000
"060101","Cajamarca, Cajamarca, distrito: Cajamarca",0.000,0.000
"140104","Lambayeque, Chiclayo, distrito: Eten Puerto",0.000,0.000
"130103","La Libertad, Trujillo, distrito: Florencia de Mora",0.000,0.000
"130105","La Libertad, Trujillo, distrito: La Esperanza",0.000,0.000
"021803","Áncash, Santa, distrito: Coishco",0.000,0.000
"160804","Loreto, Putumayo, distrito: Yaguas",0.000,0.000
"160802","Loreto, Putumayo, distrito: Rosa Panduro",0.000,0.000
"010703","Amazonas, Utcubamba, distrito: Cumba",0.000,0.000
"010701","Amazonas, Utcubamba, distrito: Bagua Grande",0.000,0.000
"010702","Amazonas, Utcubamba, distrito: Cajaruro",0.000,0.000
"010401","Amazonas, Condorcanqui, distrito: Nieva",0.000,0.000
"010103","Amazonas, Chachapoyas, distrito: Balsas",0.000,0.000
"010110","Amazonas, Chachapoyas, distrito: Leimebamba",0.000,0.000
"010113","Amazonas, Chachapoyas, distrito: Mariscal Castilla",0.000,0.000
"010115","Amazonas, Chachapoyas, distrito: Montevideo",0.000,0.000
"010517","Amazonas, Luya, distrito: San Francisco del Yeso",0.000,0.000
"010521","Amazonas, Luya, distrito: Santo Tomas",0.000,0.000
"010503","Amazonas, Luya, distrito: Cocabamba",0.000,0.000
"010602","Amazonas, Rodríguez de Mendoza, distrito: Chirimoto",0.000,0.000
"010109","Amazonas, Chachapoyas, distrito: La Jalca",0.000,0.000
"010608","Amazonas, Rodríguez de Mendoza, distrito: Milpuc",0.000,0.000
"010514","Amazonas, Luya, distrito: Pisuquia",0.000,0.000
"010519","Amazonas, Luya, distrito: San Juan de Lopecancha",0.000,0.000
"010605","Amazonas, Rodríguez de Mendoza, distrito: Limabamba",0.000,0.000
"010511","Amazonas, Luya, distrito: María",0.000,0.000
"010604","Amazonas, Rodríguez de Mendoza, distrito: Huambo",0.000,0.000
"010112","Amazonas, Chachapoyas, distrito: Magdalena",0.000,0.000
"010507","Amazonas, Luya, distrito: Longuita",0.000,0.000
"010601","Amazonas, Rodríguez de Mendoza, distrito: San Nicolás",0.000,0.000
"010522","Amazonas, Luya, distrito: Tingo",0.000,0.000
"010606","Amazonas, Rodríguez de Mendoza, distrito: Longar",0.000,0.000
"010119","Amazonas, Chachapoyas, distrito: San Isidro de Maino",0.000,0.000
"010611","Amazonas, Rodríguez de Mendoza, distrito: Totora",0.000,0.000
"010609","Amazonas, Rodríguez de Mendoza, distrito: Omia",0.000,0.000
"010610","Amazonas, Rodríguez de Mendoza, distrito: Santa Rosa",0.000,0.000
"010111","Amazonas, Chachapoyas, distrito: Levanto",0.000,0.000
"010603","Amazonas, Rodríguez de Mendoza, distrito: Cochamal",0.000,0.000
"010504","Amazonas, Luya, distrito: Colcamar",0.000,0.000
"010513","Amazonas, Luya, distrito: Ocumal",0.000,0.000
"010515","Amazonas, Luya, distrito: Providencia",0.000,0.000
"010120","Amazonas, Chachapoyas, distrito: Soloco",0.000,0.000
"010104","Amazonas, Chachapoyas, distrito: Cheto",0.000,0.000
"010506","Amazonas, Luya, distrito: Inguilpata",0.000,0.000
"010118","Amazonas, Chachapoyas, distrito: San Francisco de Daguas",0.000,0.000
"010502","Amazonas, Luya, distrito: Camporredondo",0.000,0.000
"010607","Amazonas, Rodríguez de Mendoza, distrito: Mariscal Benavides",0.000,0.000
"010508","Amazonas, Luya, distrito: Lonya Chico",0.000,0.000
"010101","Amazonas, Chachapoyas, distrito: Chachapoyas",0.000,0.000
"010509","Amazonas, Luya, distrito: Luya",0.000,0.000
"010523","Amazonas, Luya, distrito: Trita",0.000,0.000
"010512","Amazonas, Luya, distrito: Ocalli",0.000,0.000
"010114","Amazonas, Chachapoyas, distrito: Molinopampa",0.000,0.000
"010121","Amazonas, Chachapoyas, distrito: Sonche",0.000,0.000
"010108","Amazonas, Chachapoyas, distrito: Huancas",0.000,0.000
"010505","Amazonas, Luya, distrito: Conila",0.000,0.000
"010501","Amazonas, Luya, distrito: Lamud",0.000,0.000
"010117","Amazonas, Chachapoyas, distrito: Quinjalca",0.000,0.000
"010516","Amazonas, Luya, distrito: San Cristobal",0.000,0.000
"010107","Amazonas, Chachapoyas, distrito: Granada",0.000,0.000
"010311","Amazonas, Bongara, distrito: Valera",0.000,0.000
"010105","Amazonas, Chachapoyas, distrito: Chiliquin",0.000,0.000
"010520","Amazonas, Luya, distrito: Santa Catalina",0.000,0.000
"010706","Amazonas, Utcubamba, distrito: Lonya Grande",0.000,0.000
"010510","Amazonas, Luya, distrito: Luya Viejo",0.000,0.000
"010612","Amazonas, Rodríguez de Mendoza, distrito: Vista Alegre",0.000,0.000
"010303","Amazonas, Bongara, distrito: Churuja",0.000,0.000
"010518","Amazonas, Luya, distrito: San Jerónimo",0.000,0.000
"010309","Amazonas, Bongara, distrito: San Carlos",0.000,0.000
"010102","Amazonas, Chachapoyas, distrito: Asunción",0.000,0.000
"010116","Amazonas, Chachapoyas, distrito: Olleros",0.000,0.000
"010307","Amazonas, Bongara, distrito: Jazan",0.000,0.000
"010308","Amazonas, Bongara, distrito: Recta",0.000,0.000
"010301","Amazonas, Bongara, distrito: Jumbilla",0.000,0.000
"010305","Amazonas, Bongara, distrito: Cuispes",0.000,0.000
"010310","Amazonas, Bongara, distrito: Shipasbamba",0.000,0.000
"010302","Amazonas, Bongara, distrito: Chisquilla",0.000,0.000
"010306","Amazonas, Bongara, distrito: Florida",0.000,0.000
"010304","Amazonas, Bongara, distrito: Corosha",0.000,0.000
"010312","Amazonas, Bongara, distrito: Yambrasbamba",0.000,0.000
"010707","Amazonas, Utcubamba, distrito: Yamon",0.000,0.000
"010705","Amazonas, Utcubamba, distrito: Jamalca",0.000,0.000
"010203","Amazonas, Bagua, distrito: Copallin",0.000,0.000
"010704","Amazonas, Utcubamba, distrito: El Milagro",0.000,0.000
"010204","Amazonas, Bagua, distrito: El Parco",0.000,0.000
"010201","Amazonas, Bagua, distrito: Bagua",0.000,0.000
"010206","Amazonas, Bagua, distrito: La Peca",0.000,0.000
"010202","Amazonas, Bagua, distrito: Aramango",0.000,0.000
"010205","Amazonas, Bagua, distrito: Imaza",0.000,0.000
"010402","Amazonas, Condorcanqui, distrito: El Cenepa",0.000,0.000
"010403","Amazonas, Condorcanqui, distrito: Rio Santiago",0.000,0.000
"160502","Loreto, Requena, distrito: Alto Tapiche",0.000,0.000
"160503","Loreto, Requena, distrito: Capelo",0.000,0.000
"160504","Loreto, Requena, distrito: Emilio San Martín",0.000,0.000
"160505","Loreto, Requena, distrito: Maquia",0.000,0.000
"160506","Loreto, Requena, distrito: Puinahua",0.000,0.000
"160507","Loreto, Requena, distrito: Saquena",0.000,0.000
"160508","Loreto, Requena, distrito: Soplin",0.000,0.000
"160101","Loreto, Maynas, distrito: Iquitos",0.000,0.000
"160102","Loreto, Maynas, distrito: Alto Nanay",0.000,0.000
"160103","Loreto, Maynas, distrito: Fernando Lores",0.000,0.000
"160104","Loreto, Maynas, distrito: Indiana",0.000,0.000
"160105","Loreto, Maynas, distrito: Las Amazonas",0.000,0.000
"160106","Loreto, Maynas, distrito: Mazan",0.000,0.000
"160107","Loreto, Maynas, distrito: Napo",0.000,0.000
"160202","Loreto, Alto Amazonas, distrito: Balsapuerto",0.000,0.000
"160205","Loreto, Alto Amazonas, distrito: Jeberos",0.000,0.000
"160206","Loreto, Alto Amazonas, distrito: Lagunas",0.000,0.000
"160210","Loreto, Alto Amazonas, distrito: Santa Cruz",0.000,0.000
"160211","Loreto, Alto Amazonas, distrito: Teniente Cesar López Rojas",0.000,0.000
"160301","Loreto, Loreto, distrito: Nauta",0.000,0.000
"160302","Loreto, Loreto, distrito: Parinari",0.000,0.000
"160303","Loreto, Loreto, distrito: Tigre",0.000,0.000
"160304","Loreto, Loreto, distrito: Trompeteros",0.000,0.000
"160305","Loreto, Loreto, distrito: Urarinas",0.000,0.000
"160401","Loreto, Mariscal Ramón Castilla, distrito: Ramón Castilla",0.000,0.000
"160402","Loreto, Mariscal Ramón Castilla, distrito: Pebas",0.000,0.000
"160403","Loreto, Mariscal Ramón Castilla, distrito: Yavari",0.000,0.000
"160404","Loreto, Mariscal Ramón Castilla, distrito: San Pablo",0.000,0.000
"160501","Loreto, Requena, distrito: Requena",0.000,0.000
"160509","Loreto, Requena, distrito: Tapiche",0.000,0.000
"160510","Loreto, Requena, distrito: Jenaro Herrera",0.000,0.000
"160511","Loreto, Requena, distrito: Yaquerana",0.000,0.000
"160605","Loreto, Ucayali, distrito: Sarayacu",0.000,0.000
"160606","Loreto, Ucayali, distrito: Vargas Guerra",0.000,0.000
"160701","Loreto, Datem del Marañón, distrito: Barranca",0.000,0.000
"160702","Loreto, Datem del Marañón, distrito: Cahuapanas",0.000,0.000
"160703","Loreto, Datem del Marañón, distrito: Manseriche",0.000,0.000
"160704","Loreto, Datem del Marañón, distrito: Morona",0.000,0.000
"160705","Loreto, Datem del Marañón, distrito: Pastaza",0.000,0.000
"160108","Loreto, Maynas, distrito: Punchana",0.000,0.000
"160801","Loreto, Putumayo, distrito: Putumayo",0.000,0.000
"160110","Loreto, Maynas, distrito: Torres Causana",0.000,0.000
"160112","Loreto, Maynas, distrito: Belén",0.000,0.000
"160113","Loreto, Maynas, distrito: San Juan Bautista",0.000,0.000
"160803","Loreto, Putumayo, distrito: Teniente Manuel Clavero",0.000,0.000
"160201","Loreto, Alto Amazonas, distrito: Yurimaguas",0.000,0.000
"160706","Loreto, Datem del Marañón, distrito: Andoas",0.000,0.000
"220603","San Martín, Mariscal Cáceres, distrito: Huicungo",0.000,0.000
"220604","San Martín, Mariscal Cáceres, distrito: Pachiza",0.000,0.000
"220401","San Martín, Huallaga, distrito: Saposoa",0.000,0.000
"220912","San Martín, San Martín, distrito: San Antonio",0.000,0.000
"220103","San Martín, Moyobamba, distrito: Habana",0.000,0.000
"220705","San Martín, Picota, distrito: Pucacaca",0.000,0.000
"220205","San Martín, Bellavista, distrito: San Pablo",0.000,0.000
"220704","San Martín, Picota, distrito: Pilluana",0.000,0.000
"220710","San Martín, Picota, distrito: Tres Unidos",0.000,0.000
"220304","San Martín, El Dorado, distrito: Santa Rosa",0.000,0.000
"220702","San Martín, Picota, distrito: Buenos Aires",0.000,0.000
"220913","San Martín, San Martín, distrito: Sauce",0.000,0.000
"220902","San Martín, San Martín, distrito: Alberto Leveau",0.000,0.000
"220302","San Martín, El Dorado, distrito: Agua Blanca",0.000,0.000
"220301","San Martín, El Dorado, distrito: San José de Sisa",0.000,0.000
"220908","San Martín, San Martín, distrito: Juan Guerra",0.000,0.000
"220511","San Martín, Lamas, distrito: Zapatero",0.000,0.000
"220305","San Martín, El Dorado, distrito: Shatoja",0.000,0.000
"220914","San Martín, San Martín, distrito: Shapaja",0.000,0.000
"220505","San Martín, Lamas, distrito: Cuñumbuqui",0.000,0.000
"220904","San Martín, San Martín, distrito: Chazuta",0.000,0.000
"220402","San Martín, Huallaga, distrito: Alto Saposoa",0.000,0.000
