IDDIST,Distrito,numeros,cold_wave_exposure
"030220","Apurímac, Andahuaylas, distrito: José María Arguedas",0.000,0.000
"030415","Apurímac, Aymaraes, distrito: Tintay",0.000,0.000
"030409","Apurímac, Aymaraes, distrito: Lucre",0.000,0.000
"030214","Apurímac, Andahuaylas, distrito: San Miguel de Chaccrampa",0.000,0.000
"030206","Apurímac, Andahuaylas, distrito: Huayana",0.000,0.000
"030404","Apurímac, Aymaraes, distrito: Chapimarca",0.000,0.000
"030405","Apurímac, Aymaraes, distrito: Colcabamba",0.000,0.000
"030304","Apurímac, Antabamba, distrito: Juan Espinoza Medrano",0.000,0.000
"030406","Apurímac, Aymaraes, distrito: Cotaruse",0.000,0.000
"030301","Apurímac, Antabamba, distrito: Antabamba",0.000,0.000
"030403","Apurímac, Aymaraes, distrito: Caraybamba",0.000,0.000
"030303","Apurímac, Antabamba, distrito: Huaquirca",0.000,0.000
"030307","Apurímac, Antabamba, distrito: Sabaino",0.000,0.000
"030713","Apurímac, Grau, distrito: Virundo",0.000,0.000
"030401","Apurímac, Aymaraes, distrito: Chalhuanca",0.000,0.000
"030410","Apurímac, Aymaraes, distrito: Pocohuanca",0.000,0.000
"030305","Apurímac, Antabamba, distrito: Oropesa",0.000,0.000
"030417","Apurímac, Aymaraes, distrito: Yanaca",0.000,0.000
"030504","Apurímac, Cotabambas, distrito: Haquira",0.000,0.000
"030705","Apurímac, Grau, distrito: Mamara",0.000,0.000
"030711","Apurímac, Grau, distrito: Turpay",0.000,0.000
"030709","Apurímac, Grau, distrito: San Antonio",0.000,0.000
"030707","Apurímac, Grau, distrito: Pataypampa",0.000,0.000
"030412","Apurímac, Aymaraes, distrito: Sañayca",0.000,0.000
"030306","Apurímac, Antabamba, distrito: Pachaconas",0.000,0.000
"030413","Apurímac, Aymaraes, distrito: Soraya",0.000,0.000
"030710","Apurímac, Grau, distrito: Santa Rosa",0.000,0.000
"030506","Apurímac, Cotabambas, distrito: Challhuahuacho",0.000,0.000
"030210","Apurímac, Andahuaylas, distrito: Pampachiri",0.000,0.000
"030302","Apurímac, Antabamba, distrito: El Oro",0.000,0.000
"030701","Apurímac, Grau, distrito: Chuquibambilla",0.000,0.000
"030414","Apurímac, Aymaraes, distrito: Tapairihua",0.000,0.000
"030402","Apurímac, Aymaraes, distrito: Capaya",0.000,0.000
"030712","Apurímac, Grau, distrito: Vilcabamba",0.000,0.000
"030706","Apurímac, Grau, distrito: Micaela Bastidas",0.000,0.000
"030211","Apurímac, Andahuaylas, distrito: Pomacocha",0.000,0.000
"030505","Apurímac, Cotabambas, distrito: Mara",0.000,0.000
"030217","Apurímac, Andahuaylas, distrito: Tumay Huaraca",0.000,0.000
"030407","Apurímac, Aymaraes, distrito: Ihuayllo",0.000,0.000
"030408","Apurímac, Aymaraes, distrito: Justo Apu Sahuaraura",0.000,0.000
"030708","Apurímac, Grau, distrito: Progreso",0.000,0.000
"030714","Apurímac, Grau, distrito: Curasco",0.000,0.000
"030702","Apurímac, Grau, distrito: Curpahuasi",0.000,0.000
"030416","Apurímac, Aymaraes, distrito: Toraya",0.000,0.000
"030704","Apurímac, Grau, distrito: Huayllati",0.000,0.000
"030102","Apurímac, Abancay, distrito: Chacoche",0.000,0.000
"030107","Apurímac, Abancay, distrito: Pichirhua",0.000,0.000
"030203","Apurímac, Andahuaylas, distrito: Chiara",0.000,0.000
"030501","Apurímac, Cotabambas, distrito: Tambobamba",0.000,0.000
"030503","Apurímac, Cotabambas, distrito: Coyllurqui",0.000,0.000
"030411","Apurímac, Aymaraes, distrito: San Juan de Chacña",0.000,0.000
"030106","Apurímac, Abancay, distrito: Lambrama",0.000,0.000
"030703","Apurímac, Grau, distrito: Gamarra",0.000,0.000
"030103","Apurímac, Abancay, distrito: Circa",0.000,0.000
"030218","Apurímac, Andahuaylas, distrito: Turpo",0.000,0.000
"030205","Apurímac, Andahuaylas, distrito: Huancaray",0.000,0.000
"030212","Apurímac, Andahuaylas, distrito: San Antonio de Cachi",0.000,0.000
"030502","Apurímac, Cotabambas, distrito: Cotabambas",0.000,0.000
"030607","Apurímac, Chincheros, distrito: Uranmarca",0.000,0.000
"030207","Apurímac, Andahuaylas, distrito: Kishuara",0.000,0.000
"030213","Apurímac, Andahuaylas, distrito: San Jerónimo",0.000,0.000
"030204","Apurímac, Andahuaylas, distrito: Huancarama",0.000,0.000
"030201","Apurímac, Andahuaylas, distrito: Andahuaylas",0.000,0.000
"030209","Apurímac, Andahuaylas, distrito: Pacucha",0.000,0.000
"030215","Apurímac, Andahuaylas, distrito: Santa María de Chicmo",0.000,0.000
"030603","Apurímac, Chincheros, distrito: Cocharcas",0.000,0.000
"030109","Apurímac, Abancay, distrito: Tamburco",0.000,0.000
"030101","Apurímac, Abancay, distrito: Abancay",0.000,0.000
"080702","Cusco, Chumbivilcas, distrito: Capacmarca",0.000,0.000
"080703","Cusco, Chumbivilcas, distrito: Chamaca",0.000,0.000
"081003","Cusco, Paruro, distrito: Ccapi",0.000,0.000
"081005","Cusco, Paruro, distrito: Huanoquite",0.000,0.000
"081006","Cusco, Paruro, distrito: Omacha",0.000,0.000
"080704","Cusco, Chumbivilcas, distrito: Colquemarca",0.000,0.000
"080705","Cusco, Chumbivilcas, distrito: Livitaca",0.000,0.000
"080706","Cusco, Chumbivilcas, distrito: Llusco",0.000,0.000
"080707","Cusco, Chumbivilcas, distrito: Quiñota",0.000,0.000
"080503","Cusco, Canas, distrito: Kunturkanki",0.000,0.000
"080504","Cusco, Canas, distrito: Langui",0.000,0.000
"080505","Cusco, Canas, distrito: Layo",0.000,0.000
"080508","Cusco, Canas, distrito: Tupac Amaru",0.000,0.000
"080602","Cusco, Canchis, distrito: Checacupe",0.000,0.000
"081201","Cusco, Quispicanchi, distrito: Urcos",0.000,0.000
"081202","Cusco, Quispicanchi, distrito: Andahuaylillas",0.000,0.000
"080102","Cusco, Cusco, distrito: Ccorca",0.000,0.000
"080106","Cusco, Cusco, distrito: Santiago",0.000,0.000
"080201","Cusco, Acomayo, distrito: Acomayo",0.000,0.000
"080202","Cusco, Acomayo, distrito: Acopia",0.000,0.000
"080204","Cusco, Acomayo, distrito: Mosoc Llacta",0.000,0.000
"080205","Cusco, Acomayo, distrito: Pomacanchi",0.000,0.000
"080206","Cusco, Acomayo, distrito: Rondocan",0.000,0.000
"080207","Cusco, Acomayo, distrito: Sangarara",0.000,0.000
"080203","Cusco, Acomayo, distrito: Acos",0.000,0.000
"080701","Cusco, Chumbivilcas, distrito: Santo Tomas",0.000,0.000
"050609","Ayacucho, Lucanas, distrito: Leoncio Prado",0.000,0.000
"050803","Ayacucho, Páucar del Sara Sara, distrito: Corculla",0.000,0.000
"050810","Ayacucho, Páucar del Sara Sara, distrito: Sara Sara",0.000,0.000
"050801","Ayacucho, Páucar del Sara Sara, distrito: Pausa",0.000,0.000
"050809","Ayacucho, Páucar del Sara Sara, distrito: San José de Ushua",0.000,0.000
"050807","Ayacucho, Páucar del Sara Sara, distrito: Pararca",0.000,0.000
"050706","Ayacucho, Parinacochas, distrito: Puyusca",0.000,0.000
"050806","Ayacucho, Páucar del Sara Sara, distrito: Oyolo",0.000,0.000
"050705","Ayacucho, Parinacochas, distrito: Pullo",0.000,0.000
"050804","Ayacucho, Páucar del Sara Sara, distrito: Lampa",0.000,0.000
"050802","Ayacucho, Páucar del Sara Sara, distrito: Colta",0.000,0.000
"050702","Ayacucho, Parinacochas, distrito: Chumpi",0.000,0.000
"050808","Ayacucho, Páucar del Sara Sara, distrito: San Javier de Alpabamba",0.000,0.000
"050805","Ayacucho, Páucar del Sara Sara, distrito: Marcabamba",0.000,0.000
"050619","Ayacucho, Lucanas, distrito: Sancos",0.000,0.000
"050701","Ayacucho, Parinacochas, distrito: Coracora",0.000,0.000
"050707","Ayacucho, Parinacochas, distrito: San Francisco de Ravacayco",0.000,0.000
"050605","Ayacucho, Lucanas, distrito: Chaviña",0.000,0.000
"050303","Ayacucho, Huanca Sancos, distrito: Sacsamarca",0.000,0.000
"050909","Ayacucho, Sucre, distrito: San Salvador de Quije",0.000,0.000
"051005","Ayacucho, Víctor Fajardo, distrito: Canaria",0.000,0.000
"050704","Ayacucho, Parinacochas, distrito: Pacapausa",0.000,0.000
"050621","Ayacucho, Lucanas, distrito: Santa Lucia",0.000,0.000
"050708","Ayacucho, Parinacochas, distrito: Upahuacho",0.000,0.000
"050614","Ayacucho, Lucanas, distrito: Saisa",0.000,0.000
"050617","Ayacucho, Lucanas, distrito: San Pedro",0.000,0.000
"050615","Ayacucho, Lucanas, distrito: San Cristobal",0.000,0.000
"050703","Ayacucho, Parinacochas, distrito: Coronel Castañeda",0.000,0.000
"050601","Ayacucho, Lucanas, distrito: Puquio",0.000,0.000
"050616","Ayacucho, Lucanas, distrito: San Juan",0.000,0.000
"050611","Ayacucho, Lucanas, distrito: Lucanas",0.000,0.000
"050613","Ayacucho, Lucanas, distrito: Otoca",0.000,0.000
"050612","Ayacucho, Lucanas, distrito: Ocaña",0.000,0.000
"050604","Ayacucho, Lucanas, distrito: Carmen Salcedo",0.000,0.000
"050606","Ayacucho, Lucanas, distrito: Chipao",0.000,0.000
"050603","Ayacucho, Lucanas, distrito: Cabana",0.000,0.000
"050608","Ayacucho, Lucanas, distrito: Laramate",0.000,0.000
"050618","Ayacucho, Lucanas, distrito: San Pedro de Palco",0.000,0.000
"050610","Ayacucho, Lucanas, distrito: Llauta",0.000,0.000
"050620","Ayacucho, Lucanas, distrito: Santa Ana de HuaycAHUACHO",0.000,0.000
"050908","Ayacucho, Sucre, distrito: San Pedro de Larcay",0.000,0.000
"050905","Ayacucho, Sucre, distrito: Huacaña",0.000,0.000
"050602","Ayacucho, Lucanas, distrito: Aucara",0.000,0.000
"050911","Ayacucho, Sucre, distrito: Soras",0.000,0.000
"050607","Ayacucho, Lucanas, distrito: Huac-Huas",0.000,0.000
"050906","Ayacucho, Sucre, distrito: Morcolla",0.000,0.000
"050910","Ayacucho, Sucre, distrito: Santiago de Paucaray",0.000,0.000
"051004","Ayacucho, Víctor Fajardo, distrito: Asquipata",0.000,0.000
"051003","Ayacucho, Víctor Fajardo, distrito: Apongo",0.000,0.000
"050901","Ayacucho, Sucre, distrito: Querobamba",0.000,0.000
"050907","Ayacucho, Sucre, distrito: Paico",0.000,0.000
"050904","Ayacucho, Sucre, distrito: Chilcayoc",0.000,0.000
"050301","Ayacucho, Huanca Sancos, distrito: Sancos",0.000,0.000
"051106","Ayacucho, Vilcas Huamán, distrito: Independencia",0.000,0.000
"050304","Ayacucho, Huanca Sancos, distrito: Santiago de Lucanamarca",0.000,0.000
"050903","Ayacucho, Sucre, distrito: Chalcos",0.000,0.000
"051010","Ayacucho, Víctor Fajardo, distrito: Hualla",0.000,0.000
"051006","Ayacucho, Víctor Fajardo, distrito: Cayara",0.000,0.000
"051102","Ayacucho, Vilcas Huamán, distrito: Accomarca",0.000,0.000
"050902","Ayacucho, Sucre, distrito: Belén",0.000,0.000
"050302","Ayacucho, Huanca Sancos, distrito: Carapo",0.000,0.000
"051105","Ayacucho, Vilcas Huamán, distrito: Huambalpa",0.000,0.000
"051008","Ayacucho, Víctor Fajardo, distrito: Huamanquiquia",0.000,0.000
"051001","Ayacucho, Víctor Fajardo, distrito: Huancapi",0.000,0.000
"051103","Ayacucho, Vilcas Huamán, distrito: Carhuanca",0.000,0.000
"051009","Ayacucho, Víctor Fajardo, distrito: Huancaraylla",0.000,0.000
"051007","Ayacucho, Víctor Fajardo, distrito: Colca",0.000,0.000
"051107","Ayacucho, Vilcas Huamán, distrito: Saurama",0.000,0.000
"051101","Ayacucho, Vilcas Huamán, distrito: Vilcas Huamán",0.000,0.000
"051002","Ayacucho, Víctor Fajardo, distrito: Alcamenca",0.000,0.000
"051011","Ayacucho, Víctor Fajardo, distrito: Sarhua",0.000,0.000
"051012","Ayacucho, Víctor Fajardo, distrito: Vilcanchos",0.000,0.000
"081007","Cusco, Paruro, distrito: Paccaritambo",0.000,0.000
"081008","Cusco, Paruro, distrito: Pillpinto",0.000,0.000
"081009","Cusco, Paruro, distrito: Yaurisque",0.000,0.000
"081001","Cusco, Paruro, distrito: Paruro",0.000,0.000
"081002","Cusco, Paruro, distrito: Accha",0.000,0.000
"081004","Cusco, Paruro, distrito: Colcha",0.000,0.000
"080708","Cusco, Chumbivilcas, distrito: Velille",0.000,0.000
"080802","Cusco, Espinar, distrito: Condoroma",0.000,0.000
"080501","Cusco, Canas, distrito: Yanaoca",0.000,0.000
"080502","Cusco, Canas, distrito: Checca",0.000,0.000
"080506","Cusco, Canas, distrito: Pampamarca",0.000,0.000
"080507","Cusco, Canas, distrito: Quehue",0.000,0.000
"080601","Cusco, Canchis, distrito: Sicuani",0.000,0.000
"080603","Cusco, Canchis, distrito: Combapata",0.000,0.000
"080604","Cusco, Canchis, distrito: Marangani",0.000,0.000
"080605","Cusco, Canchis, distrito: Pitumarca",0.000,0.000
"081206","Cusco, Quispicanchi, distrito: Cusipata",0.000,0.000
"081207","Cusco, Quispicanchi, distrito: Huaro",0.000,0.000
"081208","Cusco, Quispicanchi, distrito: Lucre",0.000,0.000
"081212","Cusco, Quispicanchi, distrito: Quiquijana",0.000,0.000
"080606","Cusco, Canchis, distrito: San Pablo",0.000,0.000
"080607","Cusco, Canchis, distrito: San Pedro",0.000,0.000
"080608","Cusco, Canchis, distrito: Tinta",0.000,0.000
"080806","Cusco, Espinar, distrito: Pichigua",0.000,0.000
"080807","Cusco, Espinar, distrito: Suyckutambo",0.000,0.000
"080808","Cusco, Espinar, distrito: Alto Pichigua",0.000,0.000
"080801","Cusco, Espinar, distrito: Espinar",0.000,0.000
"080803","Cusco, Espinar, distrito: Coporaque",0.000,0.000
"080804","Cusco, Espinar, distrito: Ocoruro",0.000,0.000
"080805","Cusco, Espinar, distrito: Pallpata",0.000,0.000
"090612","Huancavelica, Huaytará, distrito: San Isidro",0.000,0.000
"090614","Huancavelica, Huaytará, distrito: Santiago de Quirahuara",0.000,0.000
"090606","Huancavelica, Huaytará, distrito: Ocoyo",0.000,0.000
"090603","Huancavelica, Huaytará, distrito: Cordova",0.000,0.000
"090608","Huancavelica, Huaytará, distrito: Querco",0.000,0.000
"090605","Huancavelica, Huaytará, distrito: Laramarca",0.000,0.000
"090613","Huancavelica, Huaytará, distrito: Santiago de Chocorvos",0.000,0.000
"090611","Huancavelica, Huaytará, distrito: San Francisco de Sangayaico",0.000,0.000
"090615","Huancavelica, Huaytará, distrito: Santo Domingo de Capillas",0.000,0.000
"090602","Huancavelica, Huaytará, distrito: Ayavi",0.000,0.000
"090604","Huancavelica, Huaytará, distrito: Huayacundo Arma",0.000,0.000
"110301","Ica, Nasca, distrito: Nasca",250.000,0.025
"110302","Ica, Nasca, distrito: Changuillo",0.000,0.000
"110303","Ica, Nasca, distrito: El Ingenio",0.000,0.000
"110304","Ica, Nasca, distrito: Marcona",0.000,0.000
"110305","Ica, Nasca, distrito: Vista Alegre",0.000,0.000
"110401","Ica, Palpa, distrito: Palpa",0.000,0.000
"110402","Ica, Palpa, distrito: Llipata",0.000,0.000
"110403","Ica, Palpa, distrito: Río Grande",0.000,0.000
"110405","Ica, Palpa, distrito: Tibillo",625.000,0.063
"110501","Ica, Pisco, distrito: Pisco",0.000,0.000
"110404","Ica, Palpa, distrito: Santa Cruz",0.000,0.000
"110102","Ica, Ica, distrito: La Tinguiña",0.000,0.000
"110103","Ica, Ica, distrito: Los Aquijes",0.000,0.000
"110104","Ica, Ica, distrito: Ocucaje",0.000,0.000
"110105","Ica, Ica, distrito: Pachacutec",0.000,0.000
"110106","Ica, Ica, distrito: Parcona",0.000,0.000
"110107","Ica, Ica, distrito: Pueblo Nuevo",0.000,0.000
"110108","Ica, Ica, distrito: Salas",0.000,0.000
"110109","Ica, Ica, distrito: San José de Los Molinos",0.000,0.000
"110110","Ica, Ica, distrito: San Juan Bautista",0.000,0.000
"110111","Ica, Ica, distrito: Santiago",0.000,0.000
"110112","Ica, Ica, distrito: Subtanjalla",0.000,0.000
"110113","Ica, Ica, distrito: Tate",0.000,0.000
"110114","Ica, Ica, distrito: Yauca del Rosario",720.000,0.072
"110101","Ica, Ica, distrito: Ica",0.000,0.000
"110503","Ica, Pisco, distrito: Humay",0.000,0.000
"110504","Ica, Pisco, distrito: Independencia",0.000,0.000
"110505","Ica, Pisco, distrito: Paracas",0.000,0.000
"110506","Ica, Pisco, distrito: San Andrés",0.000,0.000
"110507","Ica, Pisco, distrito: San Clemente",0.000,0.000
"110508","Ica, Pisco, distrito: Tupac Amaru Inca",0.000,0.000
"230101","Tacna, Tacna, distrito: Tacna",0.000,0.000
"230103","Tacna, Tacna, distrito: Calana",0.000,0.000
"230301","Tacna, Jorge Basadre, distrito: Locumba",0.000,0.000
"230302","Tacna, Jorge Basadre, distrito: Ilabaya",953.000,0.095
"230303","Tacna, Jorge Basadre, distrito: Ite",0.000,0.000
"180101","Moquegua, Mariscal Nieto, distrito: Moquegua",0.000,0.000
"180102","Moquegua, Mariscal Nieto, distrito: Carumas",517.000,0.052
"180103","Moquegua, Mariscal Nieto, distrito: Cuchumbaya",2177.000,0.218
"180104","Moquegua, Mariscal Nieto, distrito: Samegua",0.000,0.000
"180105","Moquegua, Mariscal Nieto, distrito: San Cristóbal",500.000,0.050
"180106","Moquegua, Mariscal Nieto, distrito: Torata",139.000,0.014
"180201","Moquegua, General Sánchez Cerro, distrito: Omate",0.000,0.000
"180202","Moquegua, General Sánchez Cerro, distrito: Chojata",1200.000,0.120
"180203","Moquegua, General Sánchez Cerro, distrito: Coalaque",433.000,0.043
"180204","Moquegua, General Sánchez Cerro, distrito: Ichuña",4483.000,0.448
"180205","Moquegua, General Sánchez Cerro, distrito: La Capilla",978.000,0.098
"180206","Moquegua, General Sánchez Cerro, distrito: Lloque",526.000,0.053
"180207","Moquegua, General Sánchez Cerro, distrito: Matalaque",1150.000,0.115
"180208","Moquegua, General Sánchez Cerro, distrito: Puquina",2421.000,0.242
"180209","Moquegua, General Sánchez Cerro, distrito: Quinistaquillas",0.000,0.000
"180210","Moquegua, General Sánchez Cerro, distrito: Ubinas",2565.000,0.257
"180211","Moquegua, General Sánchez Cerro, distrito: Yunga",1747.000,0.175
"180301","Moquegua, Ilo, distrito: Ilo",1377.000,0.138
"180302","Moquegua, Ilo, distrito: El Algarrobal",0.000,0.000
"180303","Moquegua, Ilo, distrito: Pacocha",1164.000,0.116
"230105","Tacna, Tacna, distrito: Inclan",528.000,0.053
"230106","Tacna, Tacna, distrito: Pachia",931.000,0.093
"230107","Tacna, Tacna, distrito: Palca",1285.000,0.129
"230108","Tacna, Tacna, distrito: Pocollay",0.000,0.000
"230109","Tacna, Tacna, distrito: Sama",528.000,0.053
"230110","Tacna, Tacna, distrito: Coronel Gregorio Albarracin Lanchipa",0.000,0.000
"230201","Tacna, Candarave, distrito: Candarave",2913.000,0.291
"230202","Tacna, Candarave, distrito: Cairani",716.000,0.072
"230203","Tacna, Candarave, distrito: Camilaca",1112.000,0.111
"230204","Tacna, Candarave, distrito: Curibaya",122.000,0.012
"230205","Tacna, Candarave, distrito: Huanuara",493.000,0.049
"230206","Tacna, Candarave, distrito: Quilahuani",700.000,0.070
"230401","Tacna, Tarata, distrito: Tarata",901.000,0.090
"230402","Tacna, Tarata, distrito: Héroes Albarracín",0.000,0.000
"230403","Tacna, Tarata, distrito: Estique",258.000,0.026
"230404","Tacna, Tarata, distrito: Estique-Pampa",148.000,0.015
"230405","Tacna, Tarata, distrito: Sitajara",300.000,0.030
"230406","Tacna, Tarata, distrito: Susapaya",524.000,0.052
"230407","Tacna, Tarata, distrito: Tarucachi",248.000,0.025
"230408","Tacna, Tarata, distrito: Ticaco",624.000,0.062
"230102","Tacna, Tacna, distrito: Alto de la Alianza",0.000,0.000
"230104","Tacna, Tacna, distrito: Ciudad Nueva",0.000,0.000
"040514","Arequipa, Caylloma, distrito: San Antonio de Chuca",0.000,0.000
"040701","Arequipa, Islay, distrito: Mollendo",0.000,0.000
"040702","Arequipa, Islay, distrito: Cocachacra",0.000,0.000
"040502","Arequipa, Caylloma, distrito: Achoma",0.000,0.000
"040105","Arequipa, Arequipa, distrito: Characato",0.000,0.000
"040106","Arequipa, Arequipa, distrito: Chiguata",0.000,0.000
"040108","Arequipa, Arequipa, distrito: La Joya",0.000,0.000
"210502","Puno, El Collao, distrito: Capazo",1705.000,0.171
"210405","Puno, Chucuito, distrito: Pisacoma",3696.000,0.370
"210404","Puno, Chucuito, distrito: Kelluyo",11467.000,1.147
"210504","Puno, El Collao, distrito: Santa Rosa",3832.000,0.383
"210403","Puno, Chucuito, distrito: Huacullani",3561.000,0.356
"210402","Puno, Chucuito, distrito: Desaguadero",2993.000,0.299
"210505","Puno, El Collao, distrito: Conduriri",3493.000,0.349
"210407","Puno, Chucuito, distrito: Zepita",12034.000,1.203
"211303","Puno, Yunguyo, distrito: Copani",600.000,0.060
"211304","Puno, Yunguyo, distrito: Cuturapi",1620.000,0.162
"210406","Puno, Chucuito, distrito: Pomata",12232.000,1.223
"211301","Puno, Yunguyo, distrito: Yunguyo",4346.000,0.435
"211302","Puno, Yunguyo, distrito: Anapia",840.000,0.084
"211307","Puno, Yunguyo, distrito: Unicachi",1700.000,0.170
"210401","Puno, Chucuito, distrito: Juli",2547.000,0.255
"211305","Puno, Yunguyo, distrito: Ollaraya",1500.000,0.150
"211306","Puno, Yunguyo, distrito: Tinicachi",1000.000,0.100
"210111","Puno, Puno, distrito: Pichacani",3582.000,0.358
"210503","Puno, El Collao, distrito: Pilcuyo",3321.000,0.332
"210113","Puno, Puno, distrito: San Antonio",1566.000,0.157
"210501","Puno, El Collao, distrito: Ilave",1237.000,0.124
"210102","Puno, Puno, distrito: Acora",1349.000,0.135
"210112","Puno, Puno, distrito: Plateria",7616.000,0.762
"210106","Puno, Puno, distrito: Chucuito",6645.000,0.665
"210703","Puno, Lampa, distrito: Calapuja",927.000,0.093
"210701","Puno, Lampa, distrito: Lampa",7844.000,0.784
"210202","Puno, Azángaro, distrito: Achaya",2517.000,0.252
"210903","Puno, Moho  , distrito: Huayrapata",2250.000,0.225
"210607","Puno, Huancané, distrito: Taraco",0.000,0.000
"210210","Puno, Azángaro, distrito: Saman",1710.000,0.171
"210205","Puno, Azángaro, distrito: Caminaca",2500.000,0.250
"210808","Puno, Melgar, distrito: Santa Rosa",2528.000,0.253
"210101","Puno, Puno, distrito: Puno",34454.000,3.445
"210114","Puno, Puno, distrito: Tiquillaca",1889.000,0.189
"210109","Puno, Puno, distrito: Mañazo",0.000,0.000
"210110","Puno, Puno, distrito: Paucarcolla",0.000,0.000
"210115","Puno, Puno, distrito: Vilque",0.000,0.000
"210104","Puno, Puno, distrito: Atuncolla",0.000,0.000
"210709","Puno, Lampa, distrito: Santa Lucia",3692.000,0.369
"210103","Puno, Puno, distrito: Amantani",3000.000,0.300
"211102","Puno, San Román, distrito: Cabana",666.000,0.067
"211103","Puno, San Román, distrito: Cabanillas",735.000,0.074
"210108","Puno, Puno, distrito: Huata",600.000,0.060
"211104","Puno, San Román, distrito: Caracoto",0.000,0.000
"210107","Puno, Puno, distrito: Coata",1820.000,0.182
"210105","Puno, Puno, distrito: Capachica",1200.000,0.120
"210904","Puno, Moho  , distrito: Tilali",113.000,0.011
"210702","Puno, Lampa, distrito: Cabanilla",4385.000,0.439
"211101","Puno, San Román, distrito: Juliaca",1417.000,0.142
"210902","Puno, Moho  , distrito: Conima",0.000,0.000
"210707","Puno, Lampa, distrito: Paratia",3423.000,0.342
"210605","Puno, Huancané, distrito: Pusi",0.000,0.000
"210901","Puno, Moho  , distrito: Moho",1338.000,0.134
"210606","Puno, Huancané, distrito: Rosaspata",0.000,0.000
"210601","Puno, Huancané, distrito: Huancané",9041.000,0.904
"210704","Puno, Lampa, distrito: Nicasio",0.000,0.000
"210706","Puno, Lampa, distrito: Palca",1480.000,0.148
"210608","Puno, Huancané, distrito: Vilque Chico",5034.000,0.503
"210710","Puno, Lampa, distrito: Vilavila",1160.000,0.116
"210203","Puno, Azángaro, distrito: Arapa",6592.000,0.659
"210206","Puno, Azángaro, distrito: Chupa",1787.000,0.179
"210214","Puno, Azángaro, distrito: Santiago de Pupuja",3180.000,0.318
"210708","Puno, Lampa, distrito: Pucara",2529.000,0.253
"210705","Puno, Lampa, distrito: Ocuviri",2532.000,0.253
"211003","Puno, San Antonio de Putina, distrito: Pedro Vilca Apaza",1418.000,0.142
"210603","Puno, Huancané, distrito: Huatasani",0.000,0.000
"210207","Puno, Azángaro, distrito: José Domingo Choquehuanca",2456.000,0.246
"210604","Puno, Huancané, distrito: Inchupalla",3269.000,0.327
"210213","Puno, Azángaro, distrito: San Juan de Salinas",250.000,0.025
"210602","Puno, Huancané, distrito: Cojata",3129.000,0.313
"210804","Puno, Melgar, distrito: Llalli",1768.000,0.177
"210215","Puno, Azángaro, distrito: Tirapata",3225.000,0.323
"211004","Puno, San Antonio de Putina, distrito: Quilcapuncu",3285.000,0.329
"210809","Puno, Melgar, distrito: Umachiri",4063.000,0.406
"210803","Puno, Melgar, distrito: Cupi",0.000,0.000
"211001","Puno, San Antonio de Putina, distrito: Putina",0.000,0.000
"210801","Puno, Melgar, distrito: Ayaviri",3081.000,0.308
"210201","Puno, Azángaro, distrito: Azángaro",3964.000,0.396
"210204","Puno, Azángaro, distrito: Asillo",9972.000,0.997
"210805","Puno, Melgar, distrito: Macari",4233.000,0.423
"210208","Puno, Azángaro, distrito: Muñani",2776.000,0.278
"210807","Puno, Melgar, distrito: Orurillo",963.000,0.096
"211002","Puno, San Antonio de Putina, distrito: Ananea",1843.000,0.184
"210211","Puno, Azángaro, distrito: San Anton",1161.000,0.116
"210212","Puno, Azángaro, distrito: San José",4866.000,0.487
"211202","Puno, Sandia, distrito: Cuyocuyo",4707.000,0.471
"210209","Puno, Azángaro, distrito: Potoni",3620.000,0.362
"211204","Puno, Sandia, distrito: Patambuco",0.000,0.000
"210806","Puno, Melgar, distrito: Nuñoa",5871.000,0.587
"211005","Puno, San Antonio de Putina, distrito: Sina",3259.000,0.326
"211201","Puno, Sandia, distrito: Sandia",0.000,0.000
"210802","Puno, Melgar, distrito: Antauta",3150.000,0.315
"211206","Puno, Sandia, distrito: Quiaca",2374.000,0.237
"210306","Puno, Carabaya, distrito: Crucero",1800.000,0.180
"211208","Puno, Sandia, distrito: Yanahuaya",0.000,0.000
"211207","Puno, Sandia, distrito: San Juan del Oro",0.000,0.000
"211205","Puno, Sandia, distrito: Phara",132.000,0.013
"210302","Puno, Carabaya, distrito: Ajoyani",1055.000,0.106
"210301","Puno, Carabaya, distrito: Macusani",2461.000,0.246
"211209","Puno, Sandia, distrito: Alto Inambari",0.000,0.000
"210310","Puno, Carabaya, distrito: Usicayos",1998.000,0.200
"210305","Puno, Carabaya, distrito: Corani",5259.000,0.526
"210307","Puno, Carabaya, distrito: Ituata",1651.000,0.165
"210308","Puno, Carabaya, distrito: Ollachea",2752.000,0.275
"040515","Arequipa, Caylloma, distrito: Sibayo",0.000,0.000
"040516","Arequipa, Caylloma, distrito: Tapay",0.000,0.000
"040517","Arequipa, Caylloma, distrito: Tisco",0.000,0.000
"040518","Arequipa, Caylloma, distrito: Tuti",0.000,0.000
"040519","Arequipa, Caylloma, distrito: Yanque",0.000,0.000
"040520","Arequipa, Caylloma, distrito: Majes",0.000,0.000
"040601","Arequipa, Condesuyos, distrito: Chuquibamba",0.000,0.000
"040602","Arequipa, Condesuyos, distrito: Andaray",0.000,0.000
"040603","Arequipa, Condesuyos, distrito: Cayarani",0.000,0.000
"040604","Arequipa, Condesuyos, distrito: Chichas",0.000,0.000
"040605","Arequipa, Condesuyos, distrito: Iray",0.000,0.000
"040606","Arequipa, Condesuyos, distrito: Río Grande",0.000,0.000
"040607","Arequipa, Condesuyos, distrito: Salamanca",0.000,0.000
"040608","Arequipa, Condesuyos, distrito: Yanaquihua",0.000,0.000
"040703","Arequipa, Islay, distrito: Dean Valdivia",0.000,0.000
"040311","Arequipa, Caravelí, distrito: Lomas",0.000,0.000
"040312","Arequipa, Caravelí, distrito: Quicacha",0.000,0.000
"040313","Arequipa, Caravelí, distrito: Yauca",0.000,0.000
