IDDIST,Distrito,numeros,cold_wave_exposure
"170302","Madre de Dios, Tahuamanu, distrito: Iberia",0.000,0.000
"210304","Puno, Carabaya, distrito: Coasa",200.000,0.020
"211203","Puno, Sandia, distrito: Limbani",925.000,0.093
"211210","Puno, Sandia, distrito: San Pedro de Putina Punco",0.000,0.000
"210303","Puno, Carabaya, distrito: Ayapata",35.000,0.004
"210309","Puno, Carabaya, distrito: San Gaban",0.000,0.000
"150138","Lima, Lima, distrito: Santa María del Mar",0.000,0.000
"151011","Lima, Yauyos, distrito: Colonia",42.000,0.004
"150501","Lima, Cañete, distrito: San Vicente de Cañete",0.000,0.000
"150502","Lima, Cañete, distrito: Asia",0.000,0.000
"150505","Lima, Cañete, distrito: Chilca",0.000,0.000
"150507","Lima, Cañete, distrito: Imperial",0.000,0.000
"150509","Lima, Cañete, distrito: Mala",0.000,0.000
"150512","Lima, Cañete, distrito: Quilmana",0.000,0.000
"150515","Lima, Cañete, distrito: Santa Cruz de Flores",0.000,0.000
"150601","Lima, Huaral, distrito: Huaral",0.000,0.000
"150605","Lima, Huaral, distrito: Chancay",0.000,0.000
"150611","Lima, Huaral, distrito: Sumbilca",420.000,0.042
"150701","Lima, Huarochirí, distrito: Matucana",0.000,0.000
"150702","Lima, Huarochirí, distrito: Antioquia",176.000,0.018
"150703","Lima, Huarochirí, distrito: Callahuanca",230.000,0.023
"150704","Lima, Huarochirí, distrito: Carampoma",145.000,0.015
"150705","Lima, Huarochirí, distrito: Chicla",450.000,0.045
"150706","Lima, Huarochirí, distrito: Cuenca",96.000,0.010
"150707","Lima, Huarochirí, distrito: Huachupampa",460.000,0.046
"150708","Lima, Huarochirí, distrito: Huanza",150.000,0.015
"150709","Lima, Huarochirí, distrito: Huarochirí",350.000,0.035
"150106","Lima, Lima, distrito: Carabayllo",0.000,0.000
"150109","Lima, Lima, distrito: Cieneguilla",0.000,0.000
"150119","Lima, Lima, distrito: Lurin",0.000,0.000
"150123","Lima, Lima, distrito: Pachacamac",0.000,0.000
"150124","Lima, Lima, distrito: Pucusana",0.000,0.000
"150126","Lima, Lima, distrito: Punta Hermosa",0.000,0.000
"150127","Lima, Lima, distrito: Punta Negra",0.000,0.000
"150129","Lima, Lima, distrito: San Bartolo",0.000,0.000
"150710","Lima, Huarochirí, distrito: Lahuaytambo",0.000,0.000
"150711","Lima, Huarochirí, distrito: Langa",120.000,0.012
"150712","Lima, Huarochirí, distrito: San Pedro de Laraos",360.000,0.036
"150713","Lima, Huarochirí, distrito: Mariatana",452.000,0.045
"150714","Lima, Huarochirí, distrito: Ricardo Palma",0.000,0.000
"150715","Lima, Huarochirí, distrito: San Andrés de Tupicocha",22.000,0.002
"150716","Lima, Huarochirí, distrito: San Antonio",1662.000,0.166
"150717","Lima, Huarochirí, distrito: San Bartolomé",0.000,0.000
"150718","Lima, Huarochirí, distrito: San Damian",0.000,0.000
"150719","Lima, Huarochirí, distrito: San Juan de Iris",100.000,0.010
"150720","Lima, Huarochirí, distrito: San Juan de Tantaranche",158.000,0.016
"150721","Lima, Huarochirí, distrito: San Lorenzo de Quinti",270.000,0.027
"150722","Lima, Huarochirí, distrito: San Mateo",0.000,0.000
"150723","Lima, Huarochirí, distrito: San Mateo de Otao",38.000,0.004
"150724","Lima, Huarochirí, distrito: San Pedro de Casta",0.000,0.000
"150725","Lima, Huarochirí, distrito: San Pedro de Huancayre",50.000,0.005
"150726","Lima, Huarochirí, distrito: Sangallaya",165.000,0.017
"150727","Lima, Huarochirí, distrito: Santa Cruz de Cocachacra",0.000,0.000
"150728","Lima, Huarochirí, distrito: Santa Eulalia",0.000,0.000
"150729","Lima, Huarochirí, distrito: Santiago de Anchucaya",122.000,0.012
"150730","Lima, Huarochirí, distrito: Santiago de Tuna",0.000,0.000
"150731","Lima, Huarochirí, distrito: Santo Domingo de los Olleros",0.000,0.000
"150732","Lima, Huarochirí, distrito: Surco",0.000,0.000
"150801","Lima, Huaura, distrito: Huacho",750.000,0.075
"150803","Lima, Huaura, distrito: Caleta de Carquin",0.000,0.000
"150805","Lima, Huaura, distrito: Hualmay",0.000,0.000
"150810","Lima, Huaura, distrito: Santa María",167.000,0.017
"151006","Lima, Yauyos, distrito: Cacra",150.000,0.015
"151008","Lima, Yauyos, distrito: Catahuasi",43.000,0.004
"151009","Lima, Yauyos, distrito: Chocos",496.000,0.050
"151012","Lima, Yauyos, distrito: Hongos",417.000,0.042
"151015","Lima, Yauyos, distrito: Huangascar",300.000,0.030
"151019","Lima, Yauyos, distrito: Lincha",383.000,0.038
"151023","Lima, Yauyos, distrito: Putinza",0.000,0.000
"151031","Lima, Yauyos, distrito: Tupe",192.000,0.019
"151032","Lima, Yauyos, distrito: Viñac",119.000,0.012
"150401","Lima, Canta, distrito: Canta",0.000,0.000
"150402","Lima, Canta, distrito: Arahuay",135.000,0.014
"150403","Lima, Canta, distrito: Huamantanga",0.000,0.000
"150404","Lima, Canta, distrito: Huaros",0.000,0.000
"150405","Lima, Canta, distrito: Lachaqui",612.000,0.061
"150406","Lima, Canta, distrito: San Buenaventura",0.000,0.000
"150407","Lima, Canta, distrito: Santa Rosa de Quives",0.000,0.000
"150503","Lima, Cañete, distrito: Calango",0.000,0.000
"150504","Lima, Cañete, distrito: Cerro Azul",0.000,0.000
"150506","Lima, Cañete, distrito: Coayllo",0.000,0.000
"150508","Lima, Cañete, distrito: Lunahuana",0.000,0.000
"150510","Lima, Cañete, distrito: Nuevo Imperial",0.000,0.000
"150511","Lima, Cañete, distrito: Pacaran",0.000,0.000
"150513","Lima, Cañete, distrito: San Antonio",0.000,0.000
"150514","Lima, Cañete, distrito: San Luis",0.000,0.000
"150516","Lima, Cañete, distrito: Zúñiga",0.000,0.000
"150602","Lima, Huaral, distrito: Atavillos Alto",280.000,0.028
"150603","Lima, Huaral, distrito: Atavillos Bajo",0.000,0.000
"150604","Lima, Huaral, distrito: Aucallama",0.000,0.000
"150606","Lima, Huaral, distrito: Ihuari",0.000,0.000
"150607","Lima, Huaral, distrito: Lampian",0.000,0.000
"150608","Lima, Huaral, distrito: Pacaraos",300.000,0.030
"150609","Lima, Huaral, distrito: San Miguel de Acos",0.000,0.000
"150610","Lima, Huaral, distrito: Santa Cruz de Andamarca",180.000,0.018
"150612","Lima, Huaral, distrito: Veintisiete de Noviembre",0.000,0.000
"150807","Lima, Huaura, distrito: Leoncio Prado",180.000,0.018
"151001","Lima, Yauyos, distrito: Yauyos",150.000,0.015
"151002","Lima, Yauyos, distrito: Alis",0.000,0.000
"151003","Lima, Yauyos, distrito: Allauca",646.000,0.065
"151004","Lima, Yauyos, distrito: Ayaviri",277.000,0.028
"151005","Lima, Yauyos, distrito: Azangaro",223.000,0.022
"151007","Lima, Yauyos, distrito: Carania",200.000,0.020
"151010","Lima, Yauyos, distrito: Cochas",0.000,0.000
"151013","Lima, Yauyos, distrito: Huampara",39.000,0.004
"151014","Lima, Yauyos, distrito: Huancaya",0.000,0.000
"151016","Lima, Yauyos, distrito: Huantan",966.000,0.097
"151017","Lima, Yauyos, distrito: Huañec",492.000,0.049
"151018","Lima, Yauyos, distrito: Laraos",42.000,0.004
"151020","Lima, Yauyos, distrito: Madean",98.000,0.010
"151021","Lima, Yauyos, distrito: Miraflores",8.000,0.001
"151022","Lima, Yauyos, distrito: Omas",0.000,0.000
"151024","Lima, Yauyos, distrito: Quinches",424.000,0.042
"151025","Lima, Yauyos, distrito: Quinocay",30.000,0.003
"151026","Lima, Yauyos, distrito: San Joaquín",0.000,0.000
"151027","Lima, Yauyos, distrito: San Pedro de Pilas",0.000,0.000
"151028","Lima, Yauyos, distrito: Tanta",490.000,0.049
"151029","Lima, Yauyos, distrito: Tauripampa",185.000,0.019
"151030","Lima, Yauyos, distrito: Tomas",120.000,0.012
"151033","Lima, Yauyos, distrito: Vitis",232.000,0.023
"070106","Prov. Constitucional del Callao, distrito: Ventanilla",0.000,0.000
"080105","Cusco, Cusco, distrito: San Sebastian",0.000,0.000
"070104","Prov. Constitucional del Callao, distrito: La Perla",0.000,0.000
"070103","Prov. Constitucional del Callao, distrito: Carmen de la Legua Reynoso",0.000,0.000
"070101","Prov. Constitucional del Callao, distrito: Callao",0.000,0.000
"070102","Prov. Constitucional del Callao, distrito: Bellavista",0.000,0.000
"070105","Prov. Constitucional del Callao, distrito: La Punta",0.000,0.000
"090111","Huancavelica, Huancavelica, distrito: Mariscal Cáceres",0.000,0.000
"110210","Ica, Chincha, distrito: Sunampe",0.000,0.000
"110201","Ica, Chincha, distrito: Chincha Alta",0.000,0.000
"110207","Ica, Chincha, distrito: Pueblo Nuevo",0.000,0.000
"120114","Junín, Huancayo, distrito: El Tambo",540.000,0.054
"120125","Junín, Huancayo, distrito: Pilcomayo",0.000,0.000
"120908","Junín, Chupaca, distrito: Tres de Diciembre",0.000,0.000
"150102","Lima, Lima, distrito: Ancón",0.000,0.000
"150103","Lima, Lima, distrito: Ate",0.000,0.000
"150107","Lima, Lima, distrito: Chaclacayo",0.000,0.000
"150108","Lima, Lima, distrito: Chorrillos",0.000,0.000
"150125","Lima, Lima, distrito: Puente Piedra",0.000,0.000
"150133","Lima, Lima, distrito: San Juan de Miraflores",0.000,0.000
"150140","Lima, Lima, distrito: Santiago de Surco",0.000,0.000
"150142","Lima, Lima, distrito: Villa el Salvador",0.000,0.000
"150143","Lima, Lima, distrito: Villa María del Triunfo",1300.000,0.130
"150135","Lima, Lima, distrito: San Martín de Porres",0.000,0.000
"150110","Lima, Lima, distrito: Comas",0.000,0.000
"150111","Lima, Lima, distrito: El Agustino",0.000,0.000
"150114","Lima, Lima, distrito: La Molina",0.000,0.000
"150117","Lima, Lima, distrito: Los Olivos",0.000,0.000
"150118","Lima, Lima, distrito: Lurigancho",0.000,0.000
"150113","Lima, Lima, distrito: Jesús María",0.000,0.000
"150116","Lima, Lima, distrito: Lince",0.000,0.000
"150122","Lima, Lima, distrito: Miraflores",0.000,0.000
"150120","Lima, Lima, distrito: Magdalena del Mar",0.000,0.000
"150121","Lima, Lima, distrito: Pueblo Libre",0.000,0.000
"150130","Lima, Lima, distrito: San Borja",0.000,0.000
"150134","Lima, Lima, distrito: San Luis",0.000,0.000
"150136","Lima, Lima, distrito: San Miguel",0.000,0.000
"150137","Lima, Lima, distrito: Santa Anita",0.000,0.000
"150141","Lima, Lima, distrito: Surquillo",0.000,0.000
"150105","Lima, Lima, distrito: Breña",0.000,0.000
"150128","Lima, Lima, distrito: Rímac",0.000,0.000
"150112","Lima, Lima, distrito: Independencia",0.000,0.000
"150132","Lima, Lima, distrito: San Juan de Lurigancho",0.000,0.000
"150139","Lima, Lima, distrito: Santa Rosa",0.000,0.000
"150131","Lima, Lima, distrito: San Isidro",0.000,0.000
"150115","Lima, Lima, distrito: La Victoria",0.000,0.000
"150104","Lima, Lima, distrito: Barranco",0.000,0.000
"050116","Ayacucho, Huamanga, distrito: Andrés Avelino Cáceres Dorregaray",0.000,0.000
"120805","Junín, Yauli, distrito: Morococha",772.000,0.077
"070107","Prov. Constitucional del Callao, distrito: Mi Perú",0.000,0.000
"010106","Amazonas, Chachapoyas, distrito: Chuquibamba",0.000,0.000
"100101","Huánuco, Huánuco, distrito: Huánuco",0.000,0.000
"100102","Huánuco, Huánuco, distrito: Amarilis",0.000,0.000
"100110","Huánuco, Huánuco, distrito: Yarumayo",100.000,0.010
"100111","Huánuco, Huánuco, distrito: Pillco Marca",0.000,0.000
"100104","Huánuco, Huánuco, distrito: Churubamba",282.000,0.028
"100106","Huánuco, Huánuco, distrito: Quisqui (Kichki)",286.000,0.029
"100107","Huánuco, Huánuco, distrito: San Francisco de Cayran",1680.000,0.168
"100108","Huánuco, Huánuco, distrito: San Pedro de Chaulan",618.000,0.062
"100112","Huánuco, Huánuco, distrito: Yacus",1233.000,0.123
"100307","Huánuco, Dos de Mayo, distrito: Chuquis",0.000,0.000
"100313","Huánuco, Dos de Mayo, distrito: Pachas",0.000,0.000
"100317","Huánuco, Dos de Mayo, distrito: Ripan",2880.000,0.288
"100321","Huánuco, Dos de Mayo, distrito: Shunqui",0.000,0.000
"100801","Huánuco, Pachitea, distrito: Panao",0.000,0.000
"101102","Huánuco, Yarowilca, distrito: Cahuac",1100.000,0.110
"101103","Huánuco, Yarowilca, distrito: Chacabamba",0.000,0.000
"101104","Huánuco, Yarowilca, distrito: Aparicio Pomares",1100.000,0.110
"101105","Huánuco, Yarowilca, distrito: Jacas Chico",550.000,0.055
"101107","Huánuco, Yarowilca, distrito: Pampamarca",0.000,0.000
"101108","Huánuco, Yarowilca, distrito: Choras",156.000,0.016
"101004","Huánuco, Lauricocha, distrito: Queropalca",1800.000,0.180
"101006","Huánuco, Lauricocha, distrito: San Francisco de Asís",2000.000,0.200
"101007","Huánuco, Lauricocha, distrito: San Miguel de Cauri",2000.000,0.200
"100103","Huánuco, Huánuco, distrito: Chinchao",0.000,0.000
"100323","Huánuco, Dos de Mayo, distrito: Yanas",2500.000,0.250
"100105","Huánuco, Huánuco, distrito: Margos",270.000,0.027
"100802","Huánuco, Pachitea, distrito: Chaglla",0.000,0.000
"100109","Huánuco, Huánuco, distrito: Santa Maria del Valle",1848.000,0.185
"100316","Huánuco, Dos de Mayo, distrito: Quivilla",100.000,0.010
"100510","Huánuco, Huamalíes, distrito: Singa",0.000,0.000
"100601","Huánuco, Leoncio Prado, distrito: Rupa-Rupa",0.000,0.000
"100311","Huánuco, Dos de Mayo, distrito: Marías",0.000,0.000
"100501","Huánuco, Huamalíes, distrito: Llata",0.000,0.000
"100503","Huánuco, Huamalíes, distrito: Chavín de Pariarca",539.000,0.054
"100504","Huánuco, Huamalíes, distrito: Jacas Grande",1422.000,0.142
"100505","Huánuco, Huamalíes, distrito: Jircan",0.000,0.000
"100602","Huánuco, Leoncio Prado, distrito: Daniel Alomía Robles",0.000,0.000
"100502","Huánuco, Huamalíes, distrito: Arancay",0.000,0.000
"100605","Huánuco, Leoncio Prado, distrito: Luyando",0.000,0.000
"100701","Huánuco, Marañón, distrito: Huacrachuco",565.000,0.057
"100703","Huánuco, Marañón, distrito: San Buenaventura",207.000,0.021
"100207","Huánuco, Ambo, distrito: San Rafael",0.000,0.000
"100201","Huánuco, Ambo, distrito: Ambo",0.000,0.000
"100202","Huánuco, Ambo, distrito: Cayna",0.000,0.000
"100203","Huánuco, Ambo, distrito: Colpas",919.000,0.092
"100204","Huánuco, Ambo, distrito: Conchamarca",160.000,0.016
"100205","Huánuco, Ambo, distrito: Huacar",30.000,0.003
"100206","Huánuco, Ambo, distrito: San Francisco",1475.000,0.148
"100208","Huánuco, Ambo, distrito: Tomay Kichwa",1242.000,0.124
"100301","Huánuco, Dos de Mayo, distrito: La Unión",0.000,0.000
"100322","Huánuco, Dos de Mayo, distrito: Sillapata",335.000,0.034
"100803","Huánuco, Pachitea, distrito: Molino",334.000,0.033
"100804","Huánuco, Pachitea, distrito: Umari",625.000,0.063
"101101","Huánuco, Yarowilca, distrito: Chavinillo",238.000,0.024
"101106","Huánuco, Yarowilca, distrito: Obas",550.000,0.055
"101001","Huánuco, Lauricocha, distrito: Jesús",1800.000,0.180
"101002","Huánuco, Lauricocha, distrito: Baños",600.000,0.060
"101003","Huánuco, Lauricocha, distrito: Jivia",2000.000,0.200
"101005","Huánuco, Lauricocha, distrito: Rondos",1600.000,0.160
"100506","Huánuco, Huamalíes, distrito: Miraflores",0.000,0.000
"100507","Huánuco, Huamalíes, distrito: Monzón",0.000,0.000
"100508","Huánuco, Huamalíes, distrito: Punchao",0.000,0.000
"100509","Huánuco, Huamalíes, distrito: Puños",0.000,0.000
"100901","Huánuco, Puerto Inca, distrito: Puerto Inca",0.000,0.000
"100902","Huánuco, Puerto Inca, distrito: Codo del Pozuzo",0.000,0.000
"100511","Huánuco, Huamalíes, distrito: Tantamayo",290.000,0.029
"100606","Huánuco, Leoncio Prado, distrito: Mariano Damaso Beraun",0.000,0.000
"100401","Huánuco, Huacaybamba, distrito: Huacaybamba",1800.000,0.180
"100402","Huánuco, Huacaybamba, distrito: Canchabamba",0.000,0.000
"100403","Huánuco, Huacaybamba, distrito: Cochabamba",100.000,0.010
"100404","Huánuco, Huacaybamba, distrito: Pinra",4747.000,0.475
"100604","Huánuco, Leoncio Prado, distrito: José Crespo y Castillo",0.000,0.000
"100702","Huánuco, Marañón, distrito: Cholon",0.000,0.000
"100903","Huánuco, Puerto Inca, distrito: Honoria",0.000,0.000
"100904","Huánuco, Puerto Inca, distrito: Tournavista",0.000,0.000
"120704","Junín, Tarma, distrito: Huasahuasi",761.000,0.076
"120608","Junín, Satipo, distrito: Río Tambo",0.000,0.000
"120301","Junín, Chanchamayo, distrito: Chanchamayo",0.000,0.000
"120302","Junín, Chanchamayo, distrito: Perene",0.000,0.000
"120303","Junín, Chanchamayo, distrito: Pichanaqui",0.000,0.000
"120304","Junín, Chanchamayo, distrito: San Luis de Shuaro",0.000,0.000
"120502","Junín, Junín, distrito: Carhuamayo",694.000,0.069
"120504","Junín, Junín, distrito: Ulcumayo",1100.000,0.110
"100905","Huánuco, Puerto Inca, distrito: Yuyapichis",0.000,0.000
"160601","Loreto, Ucayali, distrito: Contamana",0.000,0.000
"160602","Loreto, Ucayali, distrito: Inahuaya",0.000,0.000
"160603","Loreto, Ucayali, distrito: Padre Márquez",0.000,0.000
"160604","Loreto, Ucayali, distrito: Pampa Hermosa",0.000,0.000
"220703","San Martín, Picota, distrito: Caspisapa",0.000,0.000
"220202","San Martín, Bellavista, distrito: Alto Biavo",0.000,0.000
"190104","Pasco, Pasco, distrito: Huayllay",1500.000,0.150
"190112","Pasco, Pasco, distrito: Vicco",2215.000,0.222
"190105","Pasco, Pasco, distrito: Ninacaca",2028.000,0.203
"190111","Pasco, Pasco, distrito: Tinyahuarco",1791.000,0.179
"190101","Pasco, Pasco, distrito: Chaupimarca",39.000,0.004
"190107","Pasco, Pasco, distrito: Paucartambo",2157.000,0.216
"190113","Pasco, Pasco, distrito: Yanacancha",0.000,0.000
"190109","Pasco, Pasco, distrito: Simon Bolívar",0.000,0.000
"190110","Pasco, Pasco, distrito: Ticlacayan",2523.000,0.252
"190108","Pasco, Pasco, distrito: San Francisco de Asís de Yarusyacan",3744.000,0.374
"190208","Pasco, Daniel Alcides Carrión, distrito: Vilcabamba",18.000,0.002
"190206","Pasco, Daniel Alcides Carrión, distrito: Santa Ana de Tusi",34.000,0.003
"190201","Pasco, Daniel Alcides Carrión, distrito: Yanahuanca",85.000,0.009
"190203","Pasco, Daniel Alcides Carrión, distrito: Goyllarisquizga",0.000,0.000
"190202","Pasco, Daniel Alcides Carrión, distrito: Chacayan",920.000,0.092
"190103","Pasco, Pasco, distrito: Huariaca",425.000,0.043
"190205","Pasco, Daniel Alcides Carrión, distrito: San Pedro de Pillao",0.000,0.000
"190106","Pasco, Pasco, distrito: Pallanchacra",765.000,0.077
"190207","Pasco, Daniel Alcides Carrión, distrito: Tapuc",500.000,0.050
"190204","Pasco, Daniel Alcides Carrión, distrito: Paucar",279.000,0.028
"221005","San Martín, Tocache, distrito: Uchiza",0.000,0.000
"221002","San Martín, Tocache, distrito: Nuevo Progreso",0.000,0.000
"221004","San Martín, Tocache, distrito: Shunte",0.000,0.000
"221001","San Martín, Tocache, distrito: Tocache",0.000,0.000
"221003","San Martín, Tocache, distrito: Polvora",0.000,0.000
"220602","San Martín, Mariscal Cáceres, distrito: Campanilla",0.000,0.000
"220605","San Martín, Mariscal Cáceres, distrito: Pajarillo",0.000,0.000
"220601","San Martín, Mariscal Cáceres, distrito: Juanjuí",0.000,0.000
"220204","San Martín, Bellavista, distrito: Huallaga",0.000,0.000
"220203","San Martín, Bellavista, distrito: Bajo Biavo",0.000,0.000
"220405","San Martín, Huallaga, distrito: Sacanche",0.000,0.000
"220406","San Martín, Huallaga, distrito: Tingo de Saposoa",0.000,0.000
"220206","San Martín, Bellavista, distrito: San Rafael",0.000,0.000
"220403","San Martín, Huallaga, distrito: El Eslabón",0.000,0.000
"220404","San Martín, Huallaga, distrito: Piscoyacu",0.000,0.000
"220707","San Martín, Picota, distrito: San Hilarión",0.000,0.000
"220201","San Martín, Bellavista, distrito: Bellavista",0.000,0.000
"220706","San Martín, Picota, distrito: San Cristóbal",0.000,0.000
"220708","San Martín, Picota, distrito: Shamboyacu",0.000,0.000
"220709","San Martín, Picota, distrito: Tingo de Ponasa",0.000,0.000
"220701","San Martín, Picota, distrito: Picota",0.000,0.000
"190306","Pasco, Oxapampa, distrito: Puerto Bermúdez",108.000,0.011
"190301","Pasco, Oxapampa, distrito: Oxapampa",400.000,0.040
"190307","Pasco, Oxapampa, distrito: Villa Rica",0.000,0.000
"190302","Pasco, Oxapampa, distrito: Chontabamba",0.000,0.000
"190303","Pasco, Oxapampa, distrito: Huancabamba",350.000,0.035
"190305","Pasco, Oxapampa, distrito: Pozuzo",0.000,0.000
"190308","Pasco, Oxapampa, distrito: Constitución",0.000,0.000
"190304","Pasco, Oxapampa, distrito: Palcazu",350.000,0.035
"190102","Pasco, Pasco, distrito: Huachon",900.000,0.090
"061002","Cajamarca, San Marcos, distrito: Chancay",0.000,0.000
"061003","Cajamarca, San Marcos, distrito: Eduardo Villanueva",0.000,0.000
"061007","Cajamarca, San Marcos, distrito: José Sabogal",0.000,0.000
"060106","Cajamarca, Cajamarca, distrito: Jesús",0.000,0.000
"060107","Cajamarca, Cajamarca, distrito: Llacanora",0.000,0.000
"060108","Cajamarca, Cajamarca, distrito: Los Baños del Inca",0.000,0.000
"060109","Cajamarca, Cajamarca, distrito: Magdalena",0.000,0.000
"060110","Cajamarca, Cajamarca, distrito: Matara",0.000,0.000
"060111","Cajamarca, Cajamarca, distrito: Namora",0.000,0.000
"060112","Cajamarca, Cajamarca, distrito: San Juan",0.000,0.000
"060201","Cajamarca, Cajabamba, distrito: Cajabamba",0.000,0.000
"060305","Cajamarca, Celendín, distrito: Jorge Chávez",0.000,0.000
"060310","Cajamarca, Celendín, distrito: Sucre",0.000,0.000
"060311","Cajamarca, Celendín, distrito: Utco",0.000,0.000
"060501","Cajamarca, Contumazá, distrito: Contumazá",0.000,0.000
"060502","Cajamarca, Contumazá, distrito: Chilete",0.000,0.000
"060506","Cajamarca, Contumazá, distrito: Santa Cruz de Toled",0.000,0.000
"060507","Cajamarca, Contumazá, distrito: Tantarica",0.000,0.000
"060508","Cajamarca, Contumazá, distrito: Yonan",0.000,0.000
"061101","Cajamarca, San Miguel, distrito: San Miguel",0.000,0.000
"061102","Cajamarca, San Miguel, distrito: Bolívar",0.000,0.000
"061103","Cajamarca, San Miguel, distrito: Calquis",0.000,0.000
"061106","Cajamarca, San Miguel, distrito: La Florida",0.000,0.000
"061107","Cajamarca, San Miguel, distrito: Llapa",0.000,0.000
"061108","Cajamarca, San Miguel, distrito: Nanchoc",0.000,0.000
"061111","Cajamarca, San Miguel, distrito: San Silvestre de Cochan",0.000,0.000
"061113","Cajamarca, San Miguel, distrito: Unión Agua Blanca",0.000,0.000
"061201","Cajamarca, San Pablo, distrito: San Pablo",0.000,0.000
"061202","Cajamarca, San Pablo, distrito: San Bernardino",0.000,0.000
"061204","Cajamarca, San Pablo, distrito: Tumbaden",0.000,0.000
"130907","La Libertad, Sánchez Carrión, distrito: Sarin",0.000,0.000
"130908","La Libertad, Sánchez Carrión, distrito: Sartimbamba",0.000,0.000
"130107","La Libertad, Trujillo, distrito: Moche",0.000,0.000
"130108","La Libertad, Trujillo, distrito: Poroto",0.000,0.000
"130101","La Libertad, Trujillo, distrito: Trujillo",0.000,0.000
"130104","La Libertad, Trujillo, distrito: Huanchaco",0.000,0.000
"130109","La Libertad, Trujillo, distrito: Salaverry",0.000,0.000
"130110","La Libertad, Trujillo, distrito: Simbal",0.000,0.000
"130111","La Libertad, Trujillo, distrito: Victor Larco Herrera",0.000,0.000
"130201","La Libertad, Ascope, distrito: Ascope",0.000,0.000
"130202","La Libertad, Ascope, distrito: Chicama",0.000,0.000
"130203","La Libertad, Ascope, distrito: Chocope",0.000,0.000
"130204","La Libertad, Ascope, distrito: Magdalena de Cao",0.000,0.000
"130205","La Libertad, Ascope, distrito: Paijan",0.000,0.000
"130206","La Libertad, Ascope, distrito: Razuri",0.000,0.000
"130301","La Libertad, Bolívar, distrito: Bolívar",64.000,0.006
"130601","La Libertad, Otuzco, distrito: Otuzco",50.000,0.005
"130602","La Libertad, Otuzco, distrito: Agallpampa",150.000,0.015
"130604","La Libertad, Otuzco, distrito: Charat",0.000,0.000
"130605","La Libertad, Otuzco, distrito: Huaranchal",0.000,0.000
"130606","La Libertad, Otuzco, distrito: La Cuesta",0.000,0.000
"130608","La Libertad, Otuzco, distrito: Mache",0.000,0.000
"131101","La Libertad, Gran Chimú, distrito: Cascas",0.000,0.000
"131102","La Libertad, Gran Chimú, distrito: Lucma",0.000,0.000
"131103","La Libertad, Gran Chimú, distrito: Marmot",0.000,0.000
"131104","La Libertad, Gran Chimú, distrito: Sayapullo",0.000,0.000
"131201","La Libertad, Virú, distrito: Virú",0.000,0.000
"131002","La Libertad, Santiago de Chuco, distrito: Angasmarca",0.000,0.000
"131003","La Libertad, Santiago de Chuco, distrito: Cachicadan",3318.000,0.332
"131004","La Libertad, Santiago de Chuco, distrito: Mollebamba",0.000,0.000
"131005","La Libertad, Santiago de Chuco, distrito: Mollepata",0.000,0.000
"131006","La Libertad, Santiago de Chuco, distrito: Quiruvilca",10266.000,1.027
"131007","La Libertad, Santiago de Chuco, distrito: Santa Cruz de Chuca",0.000,0.000
"131008","La Libertad, Santiago de Chuco, distrito: Sitabamba",0.000,0.000
"130501","La Libertad, Julcán, distrito: Julcán",590.000,0.059
"130502","La Libertad, Julcán, distrito: Calamarca",0.000,0.000
"130503","La Libertad, Julcán, distrito: Carabamba",0.000,0.000
"130504","La Libertad, Julcán, distrito: Huaso",0.000,0.000
"130703","La Libertad, Pacasmayo, distrito: Jequetepeque",0.000,0.000
"130704","La Libertad, Pacasmayo, distrito: Pacasmayo",0.000,0.000
"130705","La Libertad, Pacasmayo, distrito: San José",0.000,0.000
"130801","La Libertad, Pataz, distrito: Tayabamba",777.000,0.078
"130802","La Libertad, Pataz, distrito: Buldibuyo",0.000,0.000
"130803","La Libertad, Pataz, distrito: Chillia",0.000,0.000
"130804","La Libertad, Pataz, distrito: Huancaspata",0.000,0.000
"130805","La Libertad, Pataz, distrito: Huaylillas",0.000,0.000
"130806","La Libertad, Pataz, distrito: Huayo",0.000,0.000
"130207","La Libertad, Ascope, distrito: Santiago de Cao",0.000,0.000
"130208","La Libertad, Ascope, distrito: Casa Grande",0.000,0.000
"130302","La Libertad, Bolívar, distrito: Bambamarca",0.000,0.000
"130303","La Libertad, Bolívar, distrito: Condormarca",0.000,0.000
"130304","La Libertad, Bolívar, distrito: Longotea",0.000,0.000
"130305","La Libertad, Bolívar, distrito: Uchumarca",0.000,0.000
"130306","La Libertad, Bolívar, distrito: Ucuncha",0.000,0.000
"130401","La Libertad, Chepén, distrito: Chepén",0.000,0.000
"130402","La Libertad, Chepén, distrito: Pacanga",0.000,0.000
"130403","La Libertad, Chepén, distrito: Pueblo Nuevo",0.000,0.000
"130610","La Libertad, Otuzco, distrito: Paranday",0.000,0.000
"130611","La Libertad, Otuzco, distrito: Salpo",0.000,0.000
"130613","La Libertad, Otuzco, distrito: Sinsicap",0.000,0.000
"130614","La Libertad, Otuzco, distrito: Usquil",80.000,0.008
"130701","La Libertad, Pacasmayo, distrito: San Pedro de Lloc",0.000,0.000
"130702","La Libertad, Pacasmayo, distrito: Guadalupe",0.000,0.000
