IDDIST,AREA_KM2,Distrito,SnConexaInternet,Hogar,without_internet_access
"030220","175.236","Apurímac, Andahuaylas, distrito: José María Arguedas","1083","1142",94.8336
"030415","142.393","Apurímac, Aymaraes, distrito: Tintay","778","850",91.5294
"030409","103.766","Apurímac, Aymaraes, distrito: Lucre","510","523",97.5143
"030214","84.929","Apurímac, Andahuaylas, distrito: San Miguel de Chaccrampa","503","504",99.8016
"030206","95.320","Apurímac, Andahuaylas, distrito: Huayana","259","263",98.4791
"030404","204.060","Apurímac, Aymaraes, distrito: Chapimarca","721","729",98.9026
"030405","91.771","Apurímac, Aymaraes, distrito: Colcabamba","268","269",99.6283
"030304","632.359","Apurímac, Antabamba, distrito: Juan Espinoza Medrano","683","690",98.9855
"030406","1735.304","Apurímac, Aymaraes, distrito: Cotaruse","818","826",99.0315
"030301","602.523","Apurímac, Antabamba, distrito: Antabamba","1040","1054",98.6717
"030403","230.271","Apurímac, Aymaraes, distrito: Caraybamba","368","369",99.7290
"030303","350.743","Apurímac, Antabamba, distrito: Huaquirca","495","504",98.2143
"030307","176.532","Apurímac, Antabamba, distrito: Sabaino","424","425",99.7647
"030713","114.248","Apurímac, Grau, distrito: Virundo","241","243",99.1770
"030401","339.028","Apurímac, Aymaraes, distrito: Chalhuanca","1385","1500",92.3333
"030410","87.573","Apurímac, Aymaraes, distrito: Pocohuanca","419","423",99.0544
"030305","1170.603","Apurímac, Antabamba, distrito: Oropesa","751","756",99.3386
"030417","104.366","Apurímac, Aymaraes, distrito: Yanaca","367","370",99.1892
"030504","484.064","Apurímac, Cotabambas, distrito: Haquira","3203","3302",97.0018
"030705","62.668","Apurímac, Grau, distrito: Mamara","334","340",98.2353
"030711","50.970","Apurímac, Grau, distrito: Turpay","257","266",96.6165
"030709","25.354","Apurímac, Grau, distrito: San Antonio","130","130",100.0000
"030707","146.412","Apurímac, Grau, distrito: Pataypampa","296","296",100.0000
"030412","365.244","Apurímac, Aymaraes, distrito: Sañayca","384","413",92.9782
"030306","229.231","Apurímac, Antabamba, distrito: Pachaconas","390","395",98.7342
"030413","44.385","Apurímac, Aymaraes, distrito: Soraya","265","276",96.0145
"030710","31.042","Apurímac, Grau, distrito: Santa Rosa","234","234",100.0000
"030506","453.501","Apurímac, Cotabambas, distrito: Challhuahuacho","3387","3572",94.8208
"030210","590.658","Apurímac, Andahuaylas, distrito: Pampachiri","724","730",99.1781
"030302","66.604","Apurímac, Antabamba, distrito: El Oro","281","283",99.2933
"030701","425.409","Apurímac, Grau, distrito: Chuquibambilla","1599","1617",98.8868
"030414","158.187","Apurímac, Aymaraes, distrito: Tapairihua","727","732",99.3169
"030402","83.288","Apurímac, Aymaraes, distrito: Capaya","236","238",99.1597
"030712","6.579","Apurímac, Grau, distrito: Vilcabamba","480","488",98.3607
"030706","104.777","Apurímac, Grau, distrito: Micaela Bastidas","307","309",99.3528
"030211","122.859","Apurímac, Andahuaylas, distrito: Pomacocha","298","305",97.7049
"030505","221.923","Apurímac, Cotabambas, distrito: Mara","1815","1829",99.2346
"030217","453.423","Apurímac, Andahuaylas, distrito: Tumay Huaraca","661","661",100.0000
"030407","72.783","Apurímac, Aymaraes, distrito: Ihuayllo","195","195",100.0000
"030408","100.994","Apurímac, Aymaraes, distrito: Justo Apu Sahuaraura","300","302",99.3377
"030708","240.419","Apurímac, Grau, distrito: Progreso","909","921",98.6971
"030714","136.403","Apurímac, Grau, distrito: Curasco","388","390",99.4872
"030702","310.153","Apurímac, Grau, distrito: Curpahuasi","716","718",99.7214
"030416","168.616","Apurímac, Aymaraes, distrito: Toraya","508","521",97.5048
"030704","124.134","Apurímac, Grau, distrito: Huayllati","461","462",99.7835
"030102","176.850","Apurímac, Abancay, distrito: Chacoche","492","499",98.5972
"030107","373.769","Apurímac, Abancay, distrito: Pichirhua","1035","1038",99.7110
"030203","146.730","Apurímac, Andahuaylas, distrito: Chiara","429","430",99.7674
"030501","714.098","Apurímac, Cotabambas, distrito: Tambobamba","3171","3262",97.2103
"030503","418.982","Apurímac, Cotabambas, distrito: Coyllurqui","2114","2141",98.7389
"030411","96.210","Apurímac, Aymaraes, distrito: San Juan de Chacña","246","265",92.8302
"030106","525.594","Apurímac, Abancay, distrito: Lambrama","1213","1236",98.1392
"030703","349.620","Apurímac, Grau, distrito: Gamarra","980","984",99.5935
"030103","634.251","Apurímac, Abancay, distrito: Circa","814","818",99.5110
"030218","123.766","Apurímac, Andahuaylas, distrito: Turpo","1193","1195",99.8326
"030205","111.140","Apurímac, Andahuaylas, distrito: Huancaray","1272","1274",99.8430
"030212","178.561","Apurímac, Andahuaylas, distrito: San Antonio de Cachi","1042","1051",99.1437
"030502","326.959","Apurímac, Cotabambas, distrito: Cotabambas","1252","1274",98.2732
"030607","146.864","Apurímac, Chincheros, distrito: Uranmarca","837","840",99.6429
"030207","309.046","Apurímac, Andahuaylas, distrito: Kishuara","1798","1821",98.7370
"030213","248.614","Apurímac, Andahuaylas, distrito: San Jerónimo","5029","5669",88.7105
"030204","156.295","Apurímac, Andahuaylas, distrito: Huancarama","1600","1634",97.9192
"030201","197.259","Apurímac, Andahuaylas, distrito: Andahuaylas","9887","12261",80.6378
"030209","170.665","Apurímac, Andahuaylas, distrito: Pacucha","2298","2369",97.0030
"030215","156.092","Apurímac, Andahuaylas, distrito: Santa María de Chicmo","2446","2473",98.9082
"030603","108.193","Apurímac, Chincheros, distrito: Cocharcas","582","585",99.4872
"030109","54.569","Apurímac, Abancay, distrito: Tamburco","2627","3304",79.5097
"030101","286.551","Apurímac, Abancay, distrito: Abancay","14882","20567",72.3586
"080702","267.803","Cusco, Chumbivilcas, distrito: Capacmarca","1262","1269",99.4484
"080703","674.067","Cusco, Chumbivilcas, distrito: Chamaca","2024","2054",98.5394
"081003","325.522","Cusco, Paruro, distrito: Ccapi","996","999",99.6997
"081005","361.035","Cusco, Paruro, distrito: Huanoquite","1470","1484",99.0566
"081006","427.279","Cusco, Paruro, distrito: Omacha","1601","1604",99.8130
"080704","452.194","Cusco, Chumbivilcas, distrito: Colquemarca","2315","2347",98.6366
"080705","746.638","Cusco, Chumbivilcas, distrito: Livitaca","3596","3620",99.3370
"080706","314.992","Cusco, Chumbivilcas, distrito: Llusco","1353","1403",96.4362
"080707","226.042","Cusco, Chumbivilcas, distrito: Quiñota","1095","1109",98.7376
"080503","393.761","Cusco, Canas, distrito: Kunturkanki","1610","1619",99.4441
"080504","171.122","Cusco, Canas, distrito: Langui","668","678",98.5251
"080505","425.824","Cusco, Canas, distrito: Layo","1692","1698",99.6466
"080508","115.173","Cusco, Canas, distrito: Tupac Amaru","799","802",99.6259
"080602","936.927","Cusco, Canchis, distrito: Checacupe","1395","1548",90.1163
"081201","140.594","Cusco, Quispicanchi, distrito: Urcos","2678","3121",85.8058
"081202","85.669","Cusco, Quispicanchi, distrito: Andahuaylillas","1540","1611",95.5928
"080102","161.581","Cusco, Cusco, distrito: Ccorca","738","739",99.8647
"080106","59.031","Cusco, Cusco, distrito: Santiago","19402","27100",71.5941
"080201","141.300","Cusco, Acomayo, distrito: Acomayo","1264","1297",97.4557
"080202","71.393","Cusco, Acomayo, distrito: Acopia","808","813",99.3850
"080204","43.871","Cusco, Acomayo, distrito: Mosoc Llacta","443","447",99.1051
"080205","267.277","Cusco, Acomayo, distrito: Pomacanchi","2119","2130",99.4836
"080206","183.004","Cusco, Acomayo, distrito: Rondocan","761","764",99.6073
"080207","86.022","Cusco, Acomayo, distrito: Sangarara","993","1005",98.8060
"080203","137.678","Cusco, Acomayo, distrito: Acos","702","719",97.6356
"080701","1904.779","Cusco, Chumbivilcas, distrito: Santo Tomas","7114","7284",97.6661
"050609","1110.659","Ayacucho, Lucanas, distrito: Leoncio Prado","473","481",98.3368
"050803","100.862","Ayacucho, Páucar del Sara Sara, distrito: Corculla","168","173",97.1098
"050810","85.031","Ayacucho, Páucar del Sara Sara, distrito: Sara Sara","208","209",99.5215
"050801","251.426","Ayacucho, Páucar del Sara Sara, distrito: Pausa","1066","1153",92.4545
"050809","28.415","Ayacucho, Páucar del Sara Sara, distrito: San José de Ushua","88","88",100.0000
"050807","56.662","Ayacucho, Páucar del Sara Sara, distrito: Pararca","167","167",100.0000
"050706","643.279","Ayacucho, Parinacochas, distrito: Puyusca","737","748",98.5294
"050806","793.713","Ayacucho, Páucar del Sara Sara, distrito: Oyolo","328","334",98.2036
"050705","1563.276","Ayacucho, Parinacochas, distrito: Pullo","1789","1911",93.6159
"050804","281.007","Ayacucho, Páucar del Sara Sara, distrito: Lampa","683","701",97.4322
"050802","248.108","Ayacucho, Páucar del Sara Sara, distrito: Colta","167","173",96.5318
"050702","372.212","Ayacucho, Parinacochas, distrito: Chumpi","750","762",98.4252
"050808","117.501","Ayacucho, Páucar del Sara Sara, distrito: San Javier de Alpabamba","127","127",100.0000
"050805","120.358","Ayacucho, Páucar del Sara Sara, distrito: Marcabamba","235","241",97.5104
"050619","1504.093","Ayacucho, Lucanas, distrito: Sancos","1577","1612",97.8288
"050701","1388.399","Ayacucho, Parinacochas, distrito: Coracora","3545","3761",94.2568
"050707","102.981","Ayacucho, Parinacochas, distrito: San Francisco de Ravacayco","197","198",99.4949
"050605","366.939","Ayacucho, Lucanas, distrito: Chaviña","649","652",99.5399
"050303","639.465","Ayacucho, Huanca Sancos, distrito: Sacsamarca","512","517",99.0329
"050909","141.830","Ayacucho, Sucre, distrito: San Salvador de Quije","379","381",99.4751
"051005","265.212","Ayacucho, Víctor Fajardo, distrito: Canaria","1285","1344",95.6101
"050704","147.042","Ayacucho, Parinacochas, distrito: Pacapausa","255","258",98.8372
"050621","1034.046","Ayacucho, Lucanas, distrito: Santa Lucia","435","446",97.5336
"050708","575.666","Ayacucho, Parinacochas, distrito: Upahuacho","446","452",98.6726
"050614","575.655","Ayacucho, Lucanas, distrito: Saisa","195","206",94.6602
"050617","727.490","Ayacucho, Lucanas, distrito: San Pedro","827","831",99.5187
"050615","407.454","Ayacucho, Lucanas, distrito: San Cristobal","498","500",99.6000
"050703","1081.616","Ayacucho, Parinacochas, distrito: Coronel Castañeda","248","252",98.4127
"050601","863.694","Ayacucho, Lucanas, distrito: Puquio","4112","4338",94.7902
"050616","46.855","Ayacucho, Lucanas, distrito: San Juan","453","455",99.5604
"050611","1211.652","Ayacucho, Lucanas, distrito: Lucanas","905","929",97.4166
"050613","716.572","Ayacucho, Lucanas, distrito: Otoca","646","653",98.9280
"050612","859.086","Ayacucho, Lucanas, distrito: Ocaña","851","861",98.8386
"050604","464.117","Ayacucho, Lucanas, distrito: Carmen Salcedo","601","617",97.4068
"050606","1156.175","Ayacucho, Lucanas, distrito: Chipao","1020","1030",99.0291
"050603","405.264","Ayacucho, Lucanas, distrito: Cabana","703","748",93.9840
"050608","779.968","Ayacucho, Lucanas, distrito: Laramate","582","585",99.4872
"050618","520.466","Ayacucho, Lucanas, distrito: San Pedro de Palco","362","364",99.4505
"050610","493.547","Ayacucho, Lucanas, distrito: Llauta","341","345",98.8406
"050620","45.503","Ayacucho, Lucanas, distrito: Santa Ana de HuaycAHUACHO","382","393",97.2010
"050908","314.273","Ayacucho, Sucre, distrito: San Pedro de Larcay","274","281",97.5089
"050905","144.061","Ayacucho, Sucre, distrito: Huacaña","155","157",98.7261
"050602","872.404","Ayacucho, Lucanas, distrito: Aucara","1602","1616",99.1337
"050911","351.818","Ayacucho, Sucre, distrito: Soras","359","361",99.4460
"050607","312.611","Ayacucho, Lucanas, distrito: Huac-Huas","604","608",99.3421
"050906","288.942","Ayacucho, Sucre, distrito: Morcolla","415","419",99.0453
"050910","61.546","Ayacucho, Sucre, distrito: Santiago de Paucaray","245","245",100.0000
"051004","71.362","Ayacucho, Víctor Fajardo, distrito: Asquipata","234","237",98.7342
"051003","175.820","Ayacucho, Víctor Fajardo, distrito: Apongo","321","321",100.0000
"050901","282.124","Ayacucho, Sucre, distrito: Querobamba","768","832",92.3077
"050907","79.324","Ayacucho, Sucre, distrito: Paico","241","242",99.5868
"050904","29.764","Ayacucho, Sucre, distrito: Chilcayoc","196","197",99.4924
"050301","1357.052","Ayacucho, Huanca Sancos, distrito: Sancos","1165","1198",97.2454
"051106","88.109","Ayacucho, Vilcas Huamán, distrito: Independencia","424","426",99.5305
"050304","645.902","Ayacucho, Huanca Sancos, distrito: Santiago de Lucanamarca","719","722",99.5845
"050903","54.891","Ayacucho, Sucre, distrito: Chalcos","176","176",100.0000
"051010","156.701","Ayacucho, Víctor Fajardo, distrito: Hualla","824","828",99.5169
"051006","63.507","Ayacucho, Víctor Fajardo, distrito: Cayara","522","523",99.8088
"051102","86.469","Ayacucho, Vilcas Huamán, distrito: Accomarca","397","398",99.7487
"050902","36.352","Ayacucho, Sucre, distrito: Belén","136","136",100.0000
"050302","196.664","Ayacucho, Huanca Sancos, distrito: Carapo","687","693",99.1342
"051105","162.982","Ayacucho, Vilcas Huamán, distrito: Huambalpa","599","605",99.0083
"051008","72.444","Ayacucho, Víctor Fajardo, distrito: Huamanquiquia","350","366",95.6284
"051001","239.371","Ayacucho, Víctor Fajardo, distrito: Huancapi","640","670",95.5224
"051103","54.285","Ayacucho, Vilcas Huamán, distrito: Carhuanca","348","348",100.0000
"051009","162.205","Ayacucho, Víctor Fajardo, distrito: Huancaraylla","484","486",99.5885
"051007","63.872","Ayacucho, Víctor Fajardo, distrito: Colca","381","386",98.7047
"051107","89.230","Ayacucho, Vilcas Huamán, distrito: Saurama","392","392",100.0000
"051101","220.297","Ayacucho, Vilcas Huamán, distrito: Vilcas Huamán","2163","2197",98.4524
"051002","116.022","Ayacucho, Víctor Fajardo, distrito: Alcamenca","612","613",99.8369
"051011","378.926","Ayacucho, Víctor Fajardo, distrito: Sarhua","775","780",99.3590
"051012","500.008","Ayacucho, Víctor Fajardo, distrito: Vilcanchos","841","862",97.5638
"081007","142.059","Cusco, Paruro, distrito: Paccaritambo","654","665",98.3459
"081008","78.419","Cusco, Paruro, distrito: Pillpinto","431","446",96.6368
"081009","100.838","Cusco, Paruro, distrito: Yaurisque","630","632",99.6835
"081001","152.677","Cusco, Paruro, distrito: Paruro","940","992",94.7581
"081002","238.717","Cusco, Paruro, distrito: Accha","995","998",99.6994
"081004","139.818","Cusco, Paruro, distrito: Colcha","398","398",100.0000
"080708","759.872","Cusco, Chumbivilcas, distrito: Velille","2280","2332",97.7702
"080802","515.217","Cusco, Espinar, distrito: Condoroma","341","357",95.5182
"080501","291.112","Cusco, Canas, distrito: Yanaoca","2714","2763",98.2266
"080502","504.069","Cusco, Canas, distrito: Checca","1731","1737",99.6546
"080506","31.173","Cusco, Canas, distrito: Pampamarca","542","549",98.7250
"080507","148.860","Cusco, Canas, distrito: Quehue","890","894",99.5526
"080601","646.407","Cusco, Canchis, distrito: Sicuani","14214","17503",81.2089
"080603","173.418","Cusco, Canchis, distrito: Combapata","1388","1448",95.8564
"080604","438.745","Cusco, Canchis, distrito: Marangani","2901","3059",94.8349
"080605","1091.066","Cusco, Canchis, distrito: Pitumarca","1679","2451",68.5027
"081206","242.518","Cusco, Quispicanchi, distrito: Cusipata","1242","1292",96.1300
"081207","108.445","Cusco, Quispicanchi, distrito: Huaro","1220","1291",94.5004
"081208","118.033","Cusco, Quispicanchi, distrito: Lucre","1134","1339",84.6901
"081212","364.184","Cusco, Quispicanchi, distrito: Quiquijana","2839","2949",96.2699
"080606","522.959","Cusco, Canchis, distrito: San Pablo","1472","1513",97.2902
"080607","55.980","Cusco, Canchis, distrito: San Pedro","820","906",90.5077
"080608","82.595","Cusco, Canchis, distrito: Tinta","1657","1701",97.4133
"080806","273.929","Cusco, Espinar, distrito: Pichigua","1028","1034",99.4197
"080807","627.786","Cusco, Espinar, distrito: Suyckutambo","651","655",99.3893
"080808","359.526","Cusco, Espinar, distrito: Alto Pichigua","733","739",99.1881
"080801","738.312","Cusco, Espinar, distrito: Espinar","9846","10694",92.0703
"080803","1543.040","Cusco, Espinar, distrito: Coporaque","3642","3652",99.7262
"080804","359.239","Cusco, Espinar, distrito: Ocoruro","478","478",100.0000
"080805","817.204","Cusco, Espinar, distrito: Pallpata","1586","1721",92.1557
"090612","168.752","Huancavelica, Huaytará, distrito: San Isidro","386","387",99.7416
"090614","175.493","Huancavelica, Huaytará, distrito: Santiago de Quirahuara","171","171",100.0000
"090606","168.257","Huancavelica, Huaytará, distrito: Ocoyo","232","237",97.8903
"090603","102.978","Huancavelica, Huaytará, distrito: Cordova","423","424",99.7642
"090608","685.695","Huancavelica, Huaytará, distrito: Querco","424","433",97.9215
"090605","193.322","Huancavelica, Huaytará, distrito: Laramarca","312","315",99.0476
"090613","1144.183","Huancavelica, Huaytará, distrito: Santiago de Chocorvos","691","696",99.2816
"090611","78.513","Huancavelica, Huaytará, distrito: San Francisco de Sangayaico","304","309",98.3819
"090615","255.829","Huancavelica, Huaytará, distrito: Santo Domingo de Capillas","325","325",100.0000
"090602","179.849","Huancavelica, Huaytará, distrito: Ayavi","332","336",98.8095
"090604","37.745","Huancavelica, Huaytará, distrito: Huayacundo Arma","179","180",99.4444
"110301","1144.287","Ica, Nasca, distrito: Nasca","6363","8342",76.2767
"110302","955.421","Ica, Nasca, distrito: Changuillo","731","745",98.1208
"110303","611.811","Ica, Nasca, distrito: El Ingenio","992","1035",95.8454
"110304","1945.394","Ica, Nasca, distrito: Marcona","2985","4897",60.9557
"110305","534.520","Ica, Nasca, distrito: Vista Alegre","5271","6511",80.9553
"110401","131.429","Ica, Palpa, distrito: Palpa","2074","2417",85.8089
"110402","182.642","Ica, Palpa, distrito: Llipata","472","494",95.5466
"110403","313.904","Ica, Palpa, distrito: Río Grande","902","944",95.5508
"110405","336.107","Ica, Palpa, distrito: Tibillo","129","129",100.0000
"110501","24.688","Ica, Pisco, distrito: Pisco","12576","19045",66.0331
"110404","253.903","Ica, Palpa, distrito: Santa Cruz","294","296",99.3243
"110102","81.674","Ica, Ica, distrito: La Tinguiña","7566","10789",70.1270
"110103","90.731","Ica, Ica, distrito: Los Aquijes","5045","6264",80.5396
"110104","1400.668","Ica, Ica, distrito: Ocucaje","1328","1523",87.1963
"110105","41.457","Ica, Ica, distrito: Pachacutec","1658","2070",80.0966
"110106","17.242","Ica, Ica, distrito: Parcona","9615","14161",67.8977
"110107","30.697","Ica, Ica, distrito: Pueblo Nuevo","1440","1812",79.4702
"110108","657.827","Ica, Ica, distrito: Salas","6572","7737",84.9425
"110109","360.539","Ica, Ica, distrito: San José de Los Molinos","1816","2099",86.5174
"110110","32.527","Ica, Ica, distrito: San Juan Bautista","2723","3912",69.6063
"110111","2769.905","Ica, Ica, distrito: Santiago","6650","8159",81.5051
"110112","186.127","Ica, Ica, distrito: Subtanjalla","5205","7747",67.1873
"110113","6.329","Ica, Ica, distrito: Tate","1147","1376",83.3576
"110114","1262.411","Ica, Ica, distrito: Yauca del Rosario","562","575",97.7391
"110101","886.998","Ica, Ica, distrito: Ica","22313","42166",52.9170
"110503","910.182","Ica, Pisco, distrito: Humay","1609","1704",94.4249
"110504","268.727","Ica, Pisco, distrito: Independencia","3518","3821",92.0701
"110505","1425.806","Ica, Pisco, distrito: Paracas","1549","2044",75.7828
"110506","232.513","Ica, Pisco, distrito: San Andrés","2492","3755",66.3648
"110507","136.903","Ica, Pisco, distrito: San Clemente","5823","7279",79.9973
"110508","55.662","Ica, Pisco, distrito: Tupac Amaru Inca","3728","4965",75.0856
"230101","1908.805","Tacna, Tacna, distrito: Tacna","14530","28194",51.5358
"230103","110.006","Tacna, Tacna, distrito: Calana","854","1093",78.1336
"230301","846.018","Tacna, Jorge Basadre, distrito: Locumba","827","890",92.9213
"230302","1057.879","Tacna, Jorge Basadre, distrito: Ilabaya","1149","1598",71.9024
"230303","825.227","Tacna, Jorge Basadre, distrito: Ite","609","750",81.2000
"180101","3944.307","Moquegua, Mariscal Nieto, distrito: Moquegua","16181","22385",72.2850
"180102","2263.860","Moquegua, Mariscal Nieto, distrito: Carumas","949","960",98.8542
"180103","68.855","Moquegua, Mariscal Nieto, distrito: Cuchumbaya","369","385",95.8442
"180104","64.595","Moquegua, Mariscal Nieto, distrito: Samegua","2071","2785",74.3627
"180105","539.511","Moquegua, Mariscal Nieto, distrito: San Cristóbal","787","794",99.1184
"180106","1768.950","Moquegua, Mariscal Nieto, distrito: Torata","1403","1827",76.7926
"180201","255.338","Moquegua, General Sánchez Cerro, distrito: Omate","1008","1123",89.7596
"180202","858.350","Moquegua, General Sánchez Cerro, distrito: Chojata","346","352",98.2955
"180203","244.600","Moquegua, General Sánchez Cerro, distrito: Coalaque","378","389",97.1722
"180204","998.919","Moquegua, General Sánchez Cerro, distrito: Ichuña","1319","1368",96.4181
"180205","778.956","Moquegua, General Sánchez Cerro, distrito: La Capilla","305","323",94.4272
"180206","255.278","Moquegua, General Sánchez Cerro, distrito: Lloque","254","255",99.6078
"180207","562.349","Moquegua, General Sánchez Cerro, distrito: Matalaque","234","240",97.5000
"180208","593.815","Moquegua, General Sánchez Cerro, distrito: Puquina","977","993",98.3887
"180209","194.602","Moquegua, General Sánchez Cerro, distrito: Quinistaquillas","225","237",94.9367
"180210","880.040","Moquegua, General Sánchez Cerro, distrito: Ubinas","782","789",99.1128
"180211","110.737","Moquegua, General Sánchez Cerro, distrito: Yunga","417","417",100.0000
"180301","292.982","Moquegua, Ilo, distrito: Ilo","14342","21028",68.2043
"180302","734.095","Moquegua, Ilo, distrito: El Algarrobal","1320","1415",93.2862
"180303","332.140","Moquegua, Ilo, distrito: Pacocha","573","1542",37.1595
"230105","1434.356","Tacna, Tacna, distrito: Inclan","1106","1123",98.4862
"230106","611.321","Tacna, Tacna, distrito: Pachia","742","813",91.2669
"230107","1452.974","Tacna, Tacna, distrito: Palca","432","438",98.6301
"230108","268.735","Tacna, Tacna, distrito: Pocollay","3527","5470",64.4790
"230109","1134.701","Tacna, Tacna, distrito: Sama","1565","1652",94.7337
"230110","187.314","Tacna, Tacna, distrito: Coronel Gregorio Albarracin Lanchipa","27945","37045",75.4353
"230201","1381.432","Tacna, Candarave, distrito: Candarave","939","989",94.9444
"230202","176.381","Tacna, Candarave, distrito: Cairani","398","404",98.5149
"230203","493.200","Tacna, Candarave, distrito: Camilaca","550","551",99.8185
"230204","112.048","Tacna, Candarave, distrito: Curibaya","118","124",95.1613
"230205","90.856","Tacna, Candarave, distrito: Huanuara","239","239",100.0000
"230206","55.222","Tacna, Candarave, distrito: Quilahuani","286","292",97.9452
"230401","880.156","Tacna, Tarata, distrito: Tarata","1128","1161",97.1576
"230402","378.084","Tacna, Tarata, distrito: Héroes Albarracín","184","184",100.0000
"230403","295.106","Tacna, Tarata, distrito: Estique","120","122",98.3607
"230404","147.555","Tacna, Tarata, distrito: Estique-Pampa","81","81",100.0000
"230405","233.009","Tacna, Tarata, distrito: Sitajara","174","189",92.0635
"230406","359.145","Tacna, Tarata, distrito: Susapaya","260","264",98.4848
"230407","106.724","Tacna, Tarata, distrito: Tarucachi","163","164",99.3902
"230408","355.419","Tacna, Tarata, distrito: Ticaco","299","307",97.3941
"230102","374.037","Tacna, Tacna, distrito: Alto de la Alianza","6273","8737",71.7981
"230104","178.467","Tacna, Tacna, distrito: Ciudad Nueva","7313","9799",74.6301
"040514","1540.259","Arequipa, Caylloma, distrito: San Antonio de Chuca","343","349",98.2808
"040701","932.185","Arequipa, Islay, distrito: Mollendo","5031","7429",67.7211
"040702","1549.841","Arequipa, Islay, distrito: Cocachacra","2568","2873",89.3839
"040502","365.349","Arequipa, Caylloma, distrito: Achoma","370","374",98.9305
"040105","86.112","Arequipa, Arequipa, distrito: Characato","3203","4130",77.5545
"040106","230.253","Arequipa, Arequipa, distrito: Chiguata","944","1054",89.5636
"040108","695.538","Arequipa, Arequipa, distrito: La Joya","10373","11858",87.4768
"210502","1041.286","Puno, El Collao, distrito: Capazo","580","581",99.8279
"210405","956.290","Puno, Chucuito, distrito: Pisacoma","2774","2791",99.3909
"210404","491.995","Puno, Chucuito, distrito: Kelluyo","3793","3804",99.7108
"210504","2694.171","Puno, El Collao, distrito: Santa Rosa","1825","1847",98.8089
"210403","627.178","Puno, Chucuito, distrito: Huacullani","3571","3581",99.7207
"210402","174.560","Puno, Chucuito, distrito: Desaguadero","5444","5970",91.1893
"210505","844.414","Puno, El Collao, distrito: Conduriri","1221","1221",100.0000
"210407","522.859","Puno, Chucuito, distrito: Zepita","7223","7243",99.7239
"211303","59.262","Puno, Yunguyo, distrito: Copani","1964","1976",99.3927
"211304","23.711","Puno, Yunguyo, distrito: Cuturapi","546","549",99.4536
"210406","400.941","Puno, Chucuito, distrito: Pomata","5170","5227",98.9095
"211301","174.721","Puno, Yunguyo, distrito: Yunguyo","8495","8840",96.0973
"211302","120.261","Puno, Yunguyo, distrito: Anapia","606","611",99.1817
"211307","8.013","Puno, Yunguyo, distrito: Unicachi","571","573",99.6510
"210401","772.292","Puno, Chucuito, distrito: Juli","7883","8210",96.0171
"211305","27.128","Puno, Yunguyo, distrito: Ollaraya","1511","1512",99.9339
"211306","4.046","Puno, Yunguyo, distrito: Tinicachi","327","331",98.7915
"210111","1637.527","Puno, Puno, distrito: Pichacani","2488","2523",98.6128
"210503","152.891","Puno, El Collao, distrito: Pilcuyo","4883","4956",98.5270
"210113","336.867","Puno, Puno, distrito: San Antonio","997","1002",99.5010
"210501","890.167","Puno, El Collao, distrito: Ilave","16988","17538",96.8640
"210102","1917.238","Puno, Puno, distrito: Acora","10156","10257",99.0153
"210112","244.472","Puno, Puno, distrito: Plateria","3208","3213",99.8444
"210106","115.261","Puno, Puno, distrito: Chucuito","2828","2892",97.7870
"210703","137.913","Puno, Lampa, distrito: Calapuja","542","581",93.2874
