IDDIST,AREA_KM2,Distrito,SinCelMovil,without_mobilephone_access
"021304","213.547","Áncash, Mariscal Luzuriaga, distrito: Fidel Olivas Escudero","299",52.920
"021305","49.090","Áncash, Mariscal Luzuriaga, distrito: Llama","124",36.686
"021306","139.104","Áncash, Mariscal Luzuriaga, distrito: Llumpa","568",35.367
"021307","75.274","Áncash, Mariscal Luzuriaga, distrito: Lucma","449",50.224
"021308","38.871","Áncash, Mariscal Luzuriaga, distrito: Musga","114",37.624
"021501","144.673","Áncash, Pallasca, distrito: Cabana","169",24.212
"021502","81.822","Áncash, Pallasca, distrito: Bolognesi","113",40.794
"020803","217.337","Áncash, Casma, distrito: Comandante Noel","139",21.484
"020608","122.927","Áncash, Carhuaz, distrito: San Miguel de Aco","489",68.776
"020609","127.792","Áncash, Carhuaz, distrito: Shilla","356",37.474
"020610","15.749","Áncash, Carhuaz, distrito: Tinco","180",18.462
"020611","45.271","Áncash, Carhuaz, distrito: Yungar","307",36.033
"021001","399.663","Áncash, Huari, distrito: Huari","459",17.032
"021002","80.666","Áncash, Huari, distrito: Anra","113",26.218
"021003","165.449","Áncash, Huari, distrito: Cajay","366",48.800
"021004","419.380","Áncash, Huari, distrito: Chavin de Huantar","1045",42.154
"021005","89.034","Áncash, Huari, distrito: Huacachi","185",35.992
"021006","76.268","Áncash, Huari, distrito: Huacchis","188",41.319
"021007","152.071","Áncash, Huari, distrito: Huachis","302",29.521
"021401","226.233","Áncash, Ocros, distrito: Ocros","118",27.315
"021402","254.850","Áncash, Ocros, distrito: Acas","55",24.444
"021403","78.620","Áncash, Ocros, distrito: Cajamarquilla","31",26.271
"021404","106.568","Áncash, Ocros, distrito: Carhuapampa","84",40.385
"021406","108.993","Áncash, Ocros, distrito: Congas","149",33.710
"021407","31.473","Áncash, Ocros, distrito: Llipa","46",38.655
"021408","70.609","Áncash, Ocros, distrito: San Cristóbal de Rajan","54",27.411
"021503","579.512","Áncash, Pallasca, distrito: Conchucos","639",32.552
"021504","13.562","Áncash, Pallasca, distrito: Huacaschuque","37",23.567
"021505","115.514","Áncash, Pallasca, distrito: Huandoval","78",26.351
"021506","63.517","Áncash, Pallasca, distrito: Lacabamba","66",41.250
"021507","29.227","Áncash, Pallasca, distrito: Llapo","43",22.751
"021508","110.297","Áncash, Pallasca, distrito: Pallasca","222",30.081
"021509","439.910","Áncash, Pallasca, distrito: Pampas","479",38.412
"021510","290.038","Áncash, Pallasca, distrito: Santa Rosa","51",15.315
"021511","198.784","Áncash, Pallasca, distrito: Tauca","125",15.783
"021601","344.069","Áncash, Pomabamba, distrito: Pomabamba","1180",28.943
"021602","88.765","Áncash, Pomabamba, distrito: Huayllan","305",33.297
"021603","338.804","Áncash, Pomabamba, distrito: Parobamba","796",47.923
"021604","149.644","Áncash, Pomabamba, distrito: Quinuabamba","399",60.823
"021801","1445.303","Áncash, Santa, distrito: Chimbote","6019",11.067
"021802","528.168","Áncash, Santa, distrito: Cáceres del Perú","616",42.395
"021804","586.901","Áncash, Santa, distrito: Macate","219",22.077
"021808","40.850","Áncash, Santa, distrito: Santa","664",12.762
"021901","46.017","Áncash, Sihuas, distrito: Sihuas","237",14.711
"021902","150.328","Áncash, Sihuas, distrito: Acobamba","317",76.019
"021903","89.110","Áncash, Sihuas, distrito: Alfonso Ugarte","105",62.874
"021904","69.587","Áncash, Sihuas, distrito: Cashapampa","306",37.136
"021905","173.453","Áncash, Sihuas, distrito: Chingalpo","144",54.753
"021906","276.599","Áncash, Sihuas, distrito: Huayllabamba","331",32.643
"021907","148.275","Áncash, Sihuas, distrito: Quiches","402",58.686
"021908","208.773","Áncash, Sihuas, distrito: Ragash","253",37.931
"021909","211.312","Áncash, Sihuas, distrito: San Juan","668",38.019
"021910","82.453","Áncash, Sihuas, distrito: Sicsibamba","150",30.060
"150304","150.104","Lima, Cajatambo, distrito: Huancapon","217",55.076
"150305","282.692","Lima, Cajatambo, distrito: Manas","125",32.808
"150802","941.447","Lima, Huaura, distrito: Ambar","453",60.320
"150804","166.913","Lima, Huaura, distrito: Checras","172",39.359
"150808","237.498","Lima, Huaura, distrito: Paccho","158",26.202
"150809","374.601","Lima, Huaura, distrito: Santa Leonor","76",25.589
"150811","1313.526","Lima, Huaura, distrito: Sayan","865",12.893
"150812","257.660","Lima, Huaura, distrito: Vegueta","930",12.420
"150901","876.704","Lima, Oyón, distrito: Oyón","415",13.801
"150906","255.128","Lima, Oyón, distrito: Pachangara","148",23.197
"150203","281.843","Lima, Barranca, distrito: Pativilca","833",15.970
"150301","552.217","Lima, Cajatambo, distrito: Cajatambo","201",29.778
"150302","205.395","Lima, Cajatambo, distrito: Copa","208",74.286
"150303","336.121","Lima, Cajatambo, distrito: Gorgor","186",34.444
"130102","38.437","La Libertad, Trujillo, distrito: El Porvenir","6493",12.780
"060101","379.110","Cajamarca, Cajamarca, distrito: Cajamarca","5625",9.560
"140104","13.169","Lambayeque, Chiclayo, distrito: Eten Puerto","94",14.093
"130103","2.584","La Libertad, Trujillo, distrito: Florencia de Mora","993",11.500
"130105","21.554","La Libertad, Trujillo, distrito: La Esperanza","4507",9.410
"021803","8.467","Áncash, Santa, distrito: Coishco","597",13.753
"160804","17961.263","Loreto, Putumayo, distrito: Yaguas","243",89.338
"160802","7170.236","Loreto, Putumayo, distrito: Rosa Panduro","115",88.462
"010703","300.885","Amazonas, Utcubamba, distrito: Cumba","616",26.415
"010701","727.450","Amazonas, Utcubamba, distrito: Bagua Grande","2456",16.640
"010702","1798.795","Amazonas, Utcubamba, distrito: Cajaruro","1836",26.620
"010401","4182.378","Amazonas, Condorcanqui, distrito: Nieva","3182",67.060
"010103","316.905","Amazonas, Chachapoyas, distrito: Balsas","108",30.084
"010110","380.492","Amazonas, Chachapoyas, distrito: Leimebamba","233",20.748
"010113","78.826","Amazonas, Chachapoyas, distrito: Mariscal Castilla","131",32.187
"010115","122.963","Amazonas, Chachapoyas, distrito: Montevideo","60",36.585
"010517","181.714","Amazonas, Luya, distrito: San Francisco del Yeso","61",25.103
"010521","89.934","Amazonas, Luya, distrito: Santo Tomas","230",24.758
"010503","340.973","Amazonas, Luya, distrito: Cocabamba","130",23.214
"010602","153.743","Amazonas, Rodríguez de Mendoza, distrito: Chirimoto","188",25.100
"010109","124.005","Amazonas, Chachapoyas, distrito: La Jalca","265",23.917
"010608","42.942","Amazonas, Rodríguez de Mendoza, distrito: Milpuc","26",15.951
"010514","290.700","Amazonas, Luya, distrito: Pisuquia","552",41.102
"010519","86.292","Amazonas, Luya, distrito: San Juan de Lopecancha","44",34.109
"010605","614.496","Amazonas, Rodríguez de Mendoza, distrito: Limabamba","342",46.154
"010511","87.681","Amazonas, Luya, distrito: María","51",21.074
"010604","77.614","Amazonas, Rodríguez de Mendoza, distrito: Huambo","476",47.887
"010112","135.339","Amazonas, Chachapoyas, distrito: Magdalena","75",23.585
"010507","58.649","Amazonas, Luya, distrito: Longuita","84",33.071
"010601","102.144","Amazonas, Rodríguez de Mendoza, distrito: San Nicolás","240",13.400
"010522","108.977","Amazonas, Luya, distrito: Tingo","63",16.321
"010606","82.202","Amazonas, Rodríguez de Mendoza, distrito: Longar","122",24.597
"010119","107.910","Amazonas, Chachapoyas, distrito: San Isidro de Maino","44",23.529
"010611","19.446","Amazonas, Rodríguez de Mendoza, distrito: Totora","21",18.919
"010609","225.084","Amazonas, Rodríguez de Mendoza, distrito: Omia","835",33.629
"010610","20.219","Amazonas, Rodríguez de Mendoza, distrito: Santa Rosa","58",28.856
"010111","74.796","Amazonas, Chachapoyas, distrito: Levanto","32",12.698
"010603","180.702","Amazonas, Rodríguez de Mendoza, distrito: Cochamal","59",31.720
"010504","107.584","Amazonas, Luya, distrito: Colcamar","133",20.462
"010513","363.725","Amazonas, Luya, distrito: Ocumal","290",32.258
"010515","116.403","Amazonas, Luya, distrito: Providencia","109",32.931
"010120","74.730","Amazonas, Chachapoyas, distrito: Soloco","138",33.907
"010104","70.292","Amazonas, Chachapoyas, distrito: Cheto","57",25.909
"010506","118.480","Amazonas, Luya, distrito: Inguilpata","15",8.721
"010118","40.382","Amazonas, Chachapoyas, distrito: San Francisco de Daguas","14",13.333
"010502","218.708","Amazonas, Luya, distrito: Camporredondo","383",20.804
"010607","202.473","Amazonas, Rodríguez de Mendoza, distrito: Mariscal Benavides","94",18.876
"010508","69.492","Amazonas, Luya, distrito: Lonya Chico","77",28.413
"010101","153.132","Amazonas, Chachapoyas, distrito: Chachapoyas","611",7.242
"010509","96.086","Amazonas, Luya, distrito: Luya","340",29.035
"010523","12.934","Amazonas, Luya, distrito: Trita","126",32.898
"010512","171.875","Amazonas, Luya, distrito: Ocalli","253",23.339
"010114","340.191","Amazonas, Chachapoyas, distrito: Molinopampa","124",17.614
"010121","120.113","Amazonas, Chachapoyas, distrito: Sonche","31",36.047
"010108","46.207","Amazonas, Chachapoyas, distrito: Huancas","23",15.541
"010505","248.582","Amazonas, Luya, distrito: Conila","158",29.811
"010501","73.093","Amazonas, Luya, distrito: Lamud","109",14.437
"010117","82.442","Amazonas, Chachapoyas, distrito: Quinjalca","194",65.763
"010516","35.531","Amazonas, Luya, distrito: San Cristobal","86",45.263
"010107","171.099","Amazonas, Chachapoyas, distrito: Granada","40",25.316
"010311","78.003","Amazonas, Bongara, distrito: Valera","62",20.462
"010105","141.580","Amazonas, Chachapoyas, distrito: Chiliquin","89",43.204
"010520","164.652","Amazonas, Luya, distrito: Santa Catalina","89",16.481
"010706","364.154","Amazonas, Utcubamba, distrito: Lonya Grande","477",15.553
"010510","55.665","Amazonas, Luya, distrito: Luya Viejo","46",44.231
"010612","861.265","Amazonas, Rodríguez de Mendoza, distrito: Vista Alegre","464",58.883
"010303","31.804","Amazonas, Bongara, distrito: Churuja","12",13.333
"010518","207.788","Amazonas, Luya, distrito: San Jerónimo","69",28.163
"010309","112.415","Amazonas, Bongara, distrito: San Carlos","56",30.601
"010102","34.851","Amazonas, Chachapoyas, distrito: Asunción","39",37.143
"010116","106.747","Amazonas, Chachapoyas, distrito: Olleros","21",14.189
"010307","75.736","Amazonas, Bongara, distrito: Jazan","343",14.412
"010308","28.043","Amazonas, Bongara, distrito: Recta","25",31.646
"010301","158.608","Amazonas, Bongara, distrito: Jumbilla","46",10.360
"010305","96.427","Amazonas, Bongara, distrito: Cuispes","69",30.667
"010310","125.327","Amazonas, Bongara, distrito: Shipasbamba","55",12.061
"010302","161.771","Amazonas, Bongara, distrito: Chisquilla","34",29.565
"010306","221.992","Amazonas, Bongara, distrito: Florida","246",14.608
"010304","64.169","Amazonas, Bongara, distrito: Corosha","61",26.180
"010312","1679.371","Amazonas, Bongara, distrito: Yambrasbamba","493",29.663
"010707","135.287","Amazonas, Utcubamba, distrito: Yamon","287",31.608
"010705","350.383","Amazonas, Utcubamba, distrito: Jamalca","531",27.428
"010203","98.937","Amazonas, Bagua, distrito: Copallin","433",29.356
"010704","306.992","Amazonas, Utcubamba, distrito: El Milagro","635",37.596
"010204","18.165","Amazonas, Bagua, distrito: El Parco","147",37.887
"010201","132.969","Amazonas, Bagua, distrito: Bagua","1204",15.996
"010206","138.065","Amazonas, Bagua, distrito: La Peca","560",28.441
"010202","818.939","Amazonas, Bagua, distrito: Aramango","1183",40.878
"010205","4584.997","Amazonas, Bagua, distrito: Imaza","4442",70.251
"010402","5608.925","Amazonas, Condorcanqui, distrito: El Cenepa","1785",84.677
"010403","8074.562","Amazonas, Condorcanqui, distrito: Rio Santiago","2685",87.260
"160502","9067.485","Loreto, Requena, distrito: Alto Tapiche","262",83.706
"160503","801.065","Loreto, Requena, distrito: Capelo","328",55.312
"160504","4641.003","Loreto, Requena, distrito: Emilio San Martín","827",65.844
"160505","4895.373","Loreto, Requena, distrito: Maquia","1009",64.887
"160506","6285.811","Loreto, Requena, distrito: Puinahua","666",69.520
"160507","2595.538","Loreto, Requena, distrito: Saquena","400",54.720
"160508","4697.861","Loreto, Requena, distrito: Soplin","109",77.857
"160101","366.934","Loreto, Maynas, distrito: Iquitos","3327",10.869
"160102","14562.992","Loreto, Maynas, distrito: Alto Nanay","444",68.098
"160103","4567.906","Loreto, Maynas, distrito: Fernando Lores","1876",59.012
"160104","3365.543","Loreto, Maynas, distrito: Indiana","1334",59.157
"160105","6719.587","Loreto, Maynas, distrito: Las Amazonas","1128",66.236
"160106","10053.609","Loreto, Maynas, distrito: Mazan","1924",66.690
"160107","24171.438","Loreto, Maynas, distrito: Napo","2405",80.516
"160202","3003.818","Loreto, Alto Amazonas, distrito: Balsapuerto","2237",75.959
"160205","4346.500","Loreto, Alto Amazonas, distrito: Jeberos","505",60.119
"160206","6059.438","Loreto, Alto Amazonas, distrito: Lagunas","1314",49.306
"160210","2271.423","Loreto, Alto Amazonas, distrito: Santa Cruz","481",54.909
"160211","1320.551","Loreto, Alto Amazonas, distrito: Teniente Cesar López Rojas","766",54.288
"160301","6761.710","Loreto, Loreto, distrito: Nauta","2827",41.604
"160302","13222.309","Loreto, Loreto, distrito: Parinari","645",50.000
"160303","20128.155","Loreto, Loreto, distrito: Tigre","1156",79.232
"160304","12572.351","Loreto, Loreto, distrito: Trompeteros","1113",65.240
"160305","15776.709","Loreto, Loreto, distrito: Urarinas","1543",59.714
"160401","6858.334","Loreto, Mariscal Ramón Castilla, distrito: Ramón Castilla","2457",59.276
"160402","11231.637","Loreto, Mariscal Ramón Castilla, distrito: Pebas","1239",55.461
"160403","14339.777","Loreto, Mariscal Ramón Castilla, distrito: Yavari","1373",73.266
"160404","5082.282","Loreto, Mariscal Ramón Castilla, distrito: San Pablo","1584",66.499
"160501","3074.260","Loreto, Requena, distrito: Requena","1880",34.622
"160509","2091.150","Loreto, Requena, distrito: Tapiche","139",72.396
"160510","1160.410","Loreto, Requena, distrito: Jenaro Herrera","383",42.320
"160511","11048.745","Loreto, Requena, distrito: Yaquerana","329",77.594
"160605","6249.308","Loreto, Ucayali, distrito: Sarayacu","1536",51.337
"160606","1898.246","Loreto, Ucayali, distrito: Vargas Guerra","577",42.932
"160701","7386.469","Loreto, Datem del Marañón, distrito: Barranca","1184",42.180
"160702","4784.472","Loreto, Datem del Marañón, distrito: Cahuapanas","1136",87.926
"160703","3565.978","Loreto, Datem del Marañón, distrito: Manseriche","1194",64.021
"160704","11033.638","Loreto, Datem del Marañón, distrito: Morona","649",70.238
"160705","9099.725","Loreto, Datem del Marañón, distrito: Pastaza","632",59.121
"160108","1602.952","Loreto, Maynas, distrito: Punchana","3461",20.571
"160801","11069.966","Loreto, Putumayo, distrito: Putumayo","409",49.878
"160110","6923.457","Loreto, Maynas, distrito: Torres Causana","708",81.944
"160112","652.909","Loreto, Maynas, distrito: Belén","3170",22.286
"160113","3200.683","Loreto, Maynas, distrito: San Juan Bautista","6014",19.295
"160803","9622.347","Loreto, Putumayo, distrito: Teniente Manuel Clavero","380",68.966
"160201","2235.501","Loreto, Alto Amazonas, distrito: Yurimaguas","5308",25.988
"160706","11787.627","Loreto, Datem del Marañón, distrito: Andoas","1996",84.684
"220603","9741.610","San Martín, Mariscal Cáceres, distrito: Huicungo","885",39.474
"220604","1800.483","San Martín, Mariscal Cáceres, distrito: Pachiza","800",50.633
"220401","525.407","San Martín, Huallaga, distrito: Saposoa","1491",37.595
"220912","78.304","San Martín, San Martín, distrito: San Antonio","121",24.248
"220103","68.791","San Martín, Moyobamba, distrito: Habana","102",20.000
"220705","202.952","San Martín, Picota, distrito: Pucacaca","162",18.472
"220205","348.008","San Martín, Bellavista, distrito: San Pablo","647",26.279
"220704","68.370","San Martín, Picota, distrito: Pilluana","131",47.292
"220710","370.521","San Martín, Picota, distrito: Tres Unidos","328",29.234
"220304","249.220","San Martín, El Dorado, distrito: Santa Rosa","592",35.217
"220702","311.243","San Martín, Picota, distrito: Buenos Aires","306",36.472
"220913","100.832","San Martín, San Martín, distrito: Sauce","362",20.022
"220902","51.789","San Martín, San Martín, distrito: Alberto Leveau","66",27.049
"220302","152.639","San Martín, El Dorado, distrito: Agua Blanca","277",37.842
"220301","308.479","San Martín, El Dorado, distrito: San José de Sisa","817",22.298
"220908","192.166","San Martín, San Martín, distrito: Juan Guerra","180",16.423
"220511","174.417","San Martín, Lamas, distrito: Zapatero","474",33.713
"220305","62.016","San Martín, El Dorado, distrito: Shatoja","272",33.915
"220914","237.752","San Martín, San Martín, distrito: Shapaja","192",33.684
"220505","182.075","San Martín, Lamas, distrito: Cuñumbuqui","249",24.151
"220904","952.245","San Martín, San Martín, distrito: Chazuta","796",35.520
"220402","1378.177","San Martín, Huallaga, distrito: Alto Saposoa","549",42.591
"220909","266.633","San Martín, San Martín, distrito: La Banda de Shilcayo","1241",10.715
"220910","50.681","San Martín, San Martín, distrito: Morales","658",6.704
"220303","520.608","San Martín, El Dorado, distrito: San Martín","899",35.436
"220901","58.469","San Martín, San Martín, distrito: Tarapoto","1563",7.198
"220903","52.449","San Martín, San Martín, distrito: Cacatachi","133",13.340
"220501","129.433","San Martín, Lamas, distrito: Lamas","748",18.204
"220507","33.249","San Martín, Lamas, distrito: Rumisapa","220",22.088
"220509","24.349","San Martín, Lamas, distrito: Shanao","90",17.045
"220907","1714.058","San Martín, San Martín, distrito: Huimbayoc","769",61.422
"220510","361.951","San Martín, Lamas, distrito: Tabalosos","1121",30.038
"220502","296.242","San Martín, Lamas, distrito: Alonso de Alvarado","758",20.813
"220905","306.267","San Martín, San Martín, distrito: Chipurana","200",37.106
"220504","1271.689","San Martín, Lamas, distrito: Caynarachi","731",29.583
"220911","990.630","San Martín, San Martín, distrito: Papaplaya","312",56.014
"220503","1057.466","San Martín, Lamas, distrito: Barranquita","693",41.472
"220105","583.413","San Martín, Moyobamba, distrito: Soritor","1173",19.453
"220506","559.706","San Martín, Lamas, distrito: Pinto Recodo","576",27.520
"220906","489.591","San Martín, San Martín, distrito: El Porvenir","247",38.235
"220808","81.756","San Martín, Rioja, distrito: Yorongos","156",21.053
"220104","386.073","San Martín, Moyobamba, distrito: Jepelacio","924",22.026
"220508","652.195","San Martín, Lamas, distrito: San Roque de Cumbaza","88",20.137
"220801","208.941","San Martín, Rioja, distrito: Rioja","783",10.401
"220101","2697.322","San Martín, Moyobamba, distrito: Moyobamba","2389",11.307
"220102","115.874","San Martín, Moyobamba, distrito: Calzada","156",12.178
"220803","169.329","San Martín, Rioja, distrito: Elías Soplin Vargas","456",11.022
"220804","334.004","San Martín, Rioja, distrito: Nueva Cajamarca","1707",13.791
"220806","52.562","San Martín, Rioja, distrito: Posic","141",25.543
"220106","69.617","San Martín, Moyobamba, distrito: Yantalo","123",15.356
"220809","62.058","San Martín, Rioja, distrito: Yuracyacu","118",10.461
"220807","69.118","San Martín, Rioja, distrito: San Fernando","247",25.864
"220802","506.382","San Martín, Rioja, distrito: Awajun","528",27.273
"220805","1165.497","San Martín, Rioja, distrito: Pardo Miguel","1181",24.553
"060808","221.079","Cajamarca, Jaén, distrito: Pucara","525",25.350
"060602","307.810","Cajamarca, Cutervo, distrito: Callayuc","1320",46.170
"060604","100.260","Cajamarca, Cutervo, distrito: Cujillo","193",27.850
"060606","169.139","Cajamarca, Cutervo, distrito: Pimpingos","654",42.275
"060608","124.473","Cajamarca, Cutervo, distrito: San Andrés de Cutervo","295",24.542
"060609","70.117","Cajamarca, Cutervo, distrito: San Juan de Cutervo","197",36.754
"060610","71.162","Cajamarca, Cutervo, distrito: San Luis de Lucma","176",17.530
"060612","104.584","Cajamarca, Cutervo, distrito: Santo Domingo de la Capilla","430",31.069
"060613","229.355","Cajamarca, Cutervo, distrito: Santo Tomas","501",24.765
"060614","154.743","Cajamarca, Cutervo, distrito: Socota","565",20.903
"060302","204.821","Cajamarca, Celendín, distrito: Chumuch","357",46.667
"060303","251.667","Cajamarca, Celendín, distrito: Cortegana","1244",64.489
"060402","151.602","Cajamarca, Chota, distrito: Anguia","220",23.454
"060404","48.132","Cajamarca, Chota, distrito: Chiguirip","388",33.362
"060405","144.733","Cajamarca, Chota, distrito: Chimban","138",22.045
"060407","117.520","Cajamarca, Chota, distrito: Cochabamba","502",28.735
"060410","120.447","Cajamarca, Chota, distrito: Lajas","831",23.115
"060414","139.041","Cajamarca, Chota, distrito: Pion","80",19.465
"060418","216.704","Cajamarca, Chota, distrito: Tocmoche","176",54.489
"061104","202.052","Cajamarca, San Miguel, distrito: Catilluc","213",24.511
"061301","104.687","Cajamarca, Santa Cruz, distrito: Santa Cruz","869",28.315
"061302","8.532","Cajamarca, Santa Cruz, distrito: Andabamba","178",39.035
"060901","356.126","Cajamarca, San Ignacio, distrito: San Ignacio","2362",23.951
"060902","355.766","Cajamarca, San Ignacio, distrito: Chirinos","1312",31.698
"060903","903.223","Cajamarca, San Ignacio, distrito: Huarango","1367",25.189
"060904","404.531","Cajamarca, San Ignacio, distrito: La Coipa","1340",23.971
"060905","632.813","Cajamarca, San Ignacio, distrito: Namballe","1221",48.626
"060906","1359.755","Cajamarca, San Ignacio, distrito: San José de Lourdes","1630",34.237
"060802","866.482","Cajamarca, Jaén, distrito: Bellavista","1430",30.529
"060811","504.080","Cajamarca, Jaén, distrito: San José del Alto","392",19.473
"060803","462.253","Cajamarca, Jaén, distrito: Chontali","829",29.159
"060809","365.962","Cajamarca, Jaén, distrito: Sallique","615",33.154
"060801","555.952","Cajamarca, Jaén, distrito: Jaén","2870",11.000
"060807","812.364","Cajamarca, Jaén, distrito: Pomahuaca","883",35.909
"060804","602.098","Cajamarca, Jaén, distrito: Colasay","782",24.825
"060805","84.821","Cajamarca, Jaén, distrito: Huabal","800",35.939
"060603","259.757","Cajamarca, Cutervo, distrito: Choros","362",40.447
"060615","129.244","Cajamarca, Cutervo, distrito: Toribio Casanova","70",19.337
"240101","151.511","Tumbes, Tumbes, distrito: Tumbes","3243",11.629
"240102","128.305","Tumbes, Tumbes, distrito: Corrales","1030",15.670
"240103","64.499","Tumbes, Tumbes, distrito: La Cruz","335",12.384
"240104","725.722","Tumbes, Tumbes, distrito: Pampas de Hospital","325",16.565
"240105","585.802","Tumbes, Tumbes, distrito: San Jacinto","470",18.570
"240106","115.102","Tumbes, Tumbes, distrito: San Juan de la Virgen","275",19.770
"240201","647.636","Tumbes, Contralmirante Villar, distrito: Zorritos","421",12.164
"240202","855.608","Tumbes, Contralmirante Villar, distrito: Casitas","169",22.266
"240203","625.244","Tumbes, Contralmirante Villar, distrito: Canoas de Punta Sal","199",12.083
"240301","112.519","Tumbes, Zarumilla, distrito: Zarumilla","916",14.731
"240302","47.417","Tumbes, Zarumilla, distrito: Aguas Verdes","799",15.806
"240303","390.046","Tumbes, Zarumilla, distrito: Matapalo","152",16.685
"240304","202.433","Tumbes, Zarumilla, distrito: Papayal","342",19.000
"060301","404.759","Cajamarca, Celendín, distrito: Celendín","1634",20.585
"060304","445.461","Cajamarca, Celendín, distrito: Huasmin","1270",38.625
"060601","430.761","Cajamarca, Cutervo, distrito: Cutervo","3455",21.816
"060607","686.801","Cajamarca, Cutervo, distrito: Querocotillo","1956",51.582
"060611","129.522","Cajamarca, Cutervo, distrito: Santa Cruz","187",24.317
"060701","453.170","Cajamarca, Hualgayoc, distrito: Bambamarca","6404",31.468
"060703","228.798","Cajamarca, Hualgayoc, distrito: Hualgayoc","1719",40.352
"060307","262.612","Cajamarca, Celendín, distrito: Miguel Iglesias","294",26.463
"060312","169.505","Cajamarca, Celendín, distrito: La Libertad de Pallan","924",47.580
"060401","266.735","Cajamarca, Chota, distrito: Chota","2882",19.566
"060403","64.777","Cajamarca, Chota, distrito: Chadin","406",38.015
"060406","207.393","Cajamarca, Chota, distrito: Choropampa","190",29.141
"060408","152.871","Cajamarca, Chota, distrito: Conchan","430",24.376
"060409","244.555","Cajamarca, Chota, distrito: Huambos","604",24.054
"060411","490.681","Cajamarca, Chota, distrito: Llama","541",23.339
"060412","421.607","Cajamarca, Chota, distrito: Miracosta","438",48.132
"060413","98.327","Cajamarca, Chota, distrito: Paccha","372",26.996
"060415","298.399","Cajamarca, Chota, distrito: Querocoto","746",31.187
"060416","199.926","Cajamarca, Chota, distrito: San Juan de Licupis","102",32.075
"060417","194.253","Cajamarca, Chota, distrito: Tacabamba","1151",24.135
"060419","177.083","Cajamarca, Chota, distrito: Chalamarca","1012",33.632
"061112","161.074","Cajamarca, San Miguel, distrito: Tongod","237",27.273
"061303","563.972","Cajamarca, Santa Cruz, distrito: Catache","899",35.903
"061304","128.652","Cajamarca, Santa Cruz, distrito: Chancaybaños","333",32.615
"061305","59.892","Cajamarca, Santa Cruz, distrito: La Esperanza","454",55.980
"061306","57.717","Cajamarca, Santa Cruz, distrito: Ninabamba","95",14.329
"061307","158.125","Cajamarca, Santa Cruz, distrito: Pulan","371",28.560
"061308","31.715","Cajamarca, Santa Cruz, distrito: Saucepampa","89",17.871
"061309","190.268","Cajamarca, Santa Cruz, distrito: Sexi","28",24.138
"061310","43.471","Cajamarca, Santa Cruz, distrito: Uticyacu","95",25.401
"061311","33.831","Cajamarca, Santa Cruz, distrito: Yauyucan","201",23.103
"060907","772.606","Cajamarca, San Ignacio, distrito: Tabaconas","2165",43.008
"060812","267.982","Cajamarca, Jaén, distrito: Santa Rosa","712",23.741
"060810","256.118","Cajamarca, Jaén, distrito: San Felipe","541",37.131
"060806","65.290","Cajamarca, Jaén, distrito: Las Pirias","366",26.106
"140105","29.890","Lambayeque, Chiclayo, distrito: José Leonardo Ortiz","3471",8.785
