IDDIST,AREA_KM2,Distrito,SnConexaInternet,Hogar,without_internet_access
"060102","213.955","Cajamarca, Cajamarca, distrito: Asunción","2385","2414",98.7987
"060105","633.375","Cajamarca, Cajamarca, distrito: Encañada","5980","6062",98.6473
"060202","817.428","Cajamarca, Cajabamba, distrito: Cachachi","5777","5824",99.1930
"060203","196.924","Cajamarca, Cajabamba, distrito: Condebamba","3873","3945",98.1749
"060204","581.182","Cajamarca, Cajabamba, distrito: Sitacocha","2158","2166",99.6307
"060306","50.381","Cajamarca, Celendín, distrito: José Galvez","787","812",96.9212
"060308","281.648","Cajamarca, Celendín, distrito: Oxamarca","1612","1615",99.8142
"060309","166.554","Cajamarca, Celendín, distrito: Sorochuco","2496","2537",98.3839
"060504","50.385","Cajamarca, Contumazá, distrito: Guzmango","874","879",99.4312
"061105","70.308","Cajamarca, San Miguel, distrito: El Prado","549","552",99.4565
"061109","154.968","Cajamarca, San Miguel, distrito: Niepos","1106","1117",99.0152
"061110","308.195","Cajamarca, San Miguel, distrito: San Gregorio","759","767",98.9570
"061203","42.788","Cajamarca, San Pablo, distrito: San Luis","326","327",99.6942
"140103","83.270","Lambayeque, Chiclayo, distrito: Eten","2299","3100",74.1613
"140106","41.314","Lambayeque, Chiclayo, distrito: La Victoria","14537","22575",64.3942
"140107","429.995","Lambayeque, Chiclayo, distrito: Lagunas","2532","2876",88.0389
"140108","46.794","Lambayeque, Chiclayo, distrito: Monsefu","6263","7849",79.7936
"140109","211.482","Lambayeque, Chiclayo, distrito: Nueva Arica","804","825",97.4545
"140113","45.321","Lambayeque, Chiclayo, distrito: Reque","3109","4307",72.1848
"140114","13.589","Lambayeque, Chiclayo, distrito: Santa Rosa","2119","3003",70.5628
"140115","314.095","Lambayeque, Chiclayo, distrito: Saña","2932","3463",84.6665
"140116","164.427","Lambayeque, Chiclayo, distrito: Cayalti","4114","4517",91.0781
"150201","160.720","Lima, Barranca, distrito: Barranca","12745","18591",68.5547
"150806","481.207","Lima, Huaura, distrito: Huaura","6699","9192",72.8786
"150902","152.970","Lima, Oyón, distrito: Andajes","241","242",99.5868
"150903","104.415","Lima, Oyón, distrito: Caujul","192","193",99.4819
"150904","258.461","Lima, Oyón, distrito: Cochamarca","340","341",99.7067
"150905","230.635","Lima, Oyón, distrito: Navan","309","315",98.0952
"150202","413.439","Lima, Barranca, distrito: Paramonga","4814","6646",72.4345
"150204","519.125","Lima, Barranca, distrito: Supe","5133","6626",77.4676
"150205","15.443","Lima, Barranca, distrito: Supe Puerto","2632","3494",75.3291
"020301","95.345","Áncash, Antonio Raymondi, distrito: Llamellin","899","922",97.5054
"021206","500.101","Áncash, Huaylas, distrito: Pamparomas","2017","2095",96.2768
"020502","11.907","Áncash, Bolognesi, distrito: Abelardo Pardo Lezameta","122","122",100.0000
"020503","121.918","Áncash, Bolognesi, distrito: Antonio Raymondi","357","363",98.3471
"020505","185.188","Áncash, Bolognesi, distrito: Cajacay","587","594",98.8215
"020506","20.733","Áncash, Bolognesi, distrito: Canis","113","118",95.7627
"020507","305.032","Áncash, Bolognesi, distrito: Colquioc","552","570",96.8421
"020511","62.472","Áncash, Bolognesi, distrito: La Primavera","165","165",100.0000
"020512","126.035","Áncash, Bolognesi, distrito: Mangas","173","176",98.2955
"020513","210.629","Áncash, Bolognesi, distrito: Pacllon","317","322",98.4472
"020514","42.718","Áncash, Bolognesi, distrito: San Miguel de Corpanqui","148","151",98.0132
"020515","92.560","Áncash, Bolognesi, distrito: Ticllos","257","260",98.8462
"020105","345.480","Áncash, Huaraz, distrito: Independencia","15392","21622",71.1868
"020305","172.063","Áncash, Antonio Raymondi, distrito: Mirgas","1135","1140",99.5614
"021809","400.745","Áncash, Santa, distrito: Nuevo Chimbote","33043","49688",66.5010
"020901","151.661","Áncash, Corongo, distrito: Corongo","445","498",89.3574
"020902","57.464","Áncash, Corongo, distrito: Aco","128","128",100.0000
"020903","153.807","Áncash, Corongo, distrito: Bambas","132","132",100.0000
"020904","425.929","Áncash, Corongo, distrito: Cusca","671","674",99.5549
"020905","94.672","Áncash, Corongo, distrito: La Pampa","315","331",95.1662
"020906","46.802","Áncash, Corongo, distrito: Yanac","215","220",97.7273
"020907","84.906","Áncash, Corongo, distrito: Yupan","142","146",97.2603
"021405","411.101","Áncash, Ocros, distrito: Cochas","474","477",99.3711
"060103","73.517","Cajamarca, Cajamarca, distrito: Chetilla","1022","1025",99.7073
"060104","552.527","Cajamarca, Cajamarca, distrito: Cospan","1881","1889",99.5765
"060503","292.883","Cajamarca, Contumazá, distrito: Cupisnique","446","450",99.1111
"060505","486.443","Cajamarca, Contumazá, distrito: San Benito","1096","1101",99.5459
"020205","77.415","Áncash, Aija, distrito: Succha","267","269",99.2565
"021008","161.756","Áncash, Huari, distrito: Huantar","850","857",99.1832
"021009","75.222","Áncash, Huari, distrito: Masin","489","495",98.7879
"021010","138.977","Áncash, Huari, distrito: Paucas","494","495",99.7980
"021011","119.006","Áncash, Huari, distrito: Ponto","771","775",99.4839
"021012","9.548","Áncash, Huari, distrito: Rahuapampa","196","200",98.0000
"021013","145.514","Áncash, Huari, distrito: Rapayan","422","426",99.0610
"021014","561.501","Áncash, Huari, distrito: San Marcos","3630","3700",98.1081
"021015","143.957","Áncash, Huari, distrito: San Pedro de Chana","681","686",99.2711
"021016","51.884","Áncash, Huari, distrito: Uco","394","403",97.7667
"021101","2908.824","Áncash, Huarmey, distrito: Huarmey","6549","7748",84.5250
"021102","98.514","Áncash, Huarmey, distrito: Cochapeti","296","296",100.0000
"021103","630.301","Áncash, Huarmey, distrito: Culebras","864","989",87.3610
"021104","113.096","Áncash, Huarmey, distrito: Huayan","296","300",98.6667
"021105","167.702","Áncash, Huarmey, distrito: Malvas","274","277",98.9170
"021201","243.799","Áncash, Huaylas, distrito: Caraz","5779","6892",83.8508
"021207","127.213","Áncash, Huaylas, distrito: Pueblo Libre","1892","1904",99.3697
"020204","156.697","Áncash, Aija, distrito: La Merced","521","526",99.0494
"020302","65.474","Áncash, Antonio Raymondi, distrito: Aczo","567","569",99.6485
"020303","71.988","Áncash, Antonio Raymondi, distrito: Chaccho","419","421",99.5249
"020304","50.524","Áncash, Antonio Raymondi, distrito: Chingas","563","569",98.9455
"020804","365.328","Áncash, Casma, distrito: Yautan","2372","2415",98.2195
"020501","185.811","Áncash, Bolognesi, distrito: Chiquian","1061","1153",92.0208
"020504","436.843","Áncash, Bolognesi, distrito: Aquia","624","640",97.5000
"020508","817.962","Áncash, Bolognesi, distrito: Huallanca","1611","1668",96.5827
"020509","389.767","Áncash, Bolognesi, distrito: Huasta","503","514",97.8599
"020510","117.474","Áncash, Bolognesi, distrito: Huayllacayan","414","433",95.6120
"020601","195.332","Áncash, Carhuaz, distrito: Carhuaz","3816","4350",87.7241
"020602","14.573","Áncash, Carhuaz, distrito: Acopampa","711","772",92.0984
"020603","13.208","Áncash, Carhuaz, distrito: Amashca","506","508",99.6063
"020604","43.209","Áncash, Carhuaz, distrito: Anta","744","766",97.1279
"020605","46.362","Áncash, Carhuaz, distrito: Ataquero","427","474",90.0844
"020606","176.991","Áncash, Carhuaz, distrito: Marcara","2599","2730",95.2015
"020607","11.925","Áncash, Carhuaz, distrito: Pariahuanca","424","430",98.6047
"020101","422.664","Áncash, Huaraz, distrito: Huaraz","10866","16446",66.0708
"020102","138.266","Áncash, Huaraz, distrito: Cochabamba","543","546",99.4505
"020104","208.860","Áncash, Huaraz, distrito: Huanchay","573","574",99.8258
"020106","62.264","Áncash, Huaraz, distrito: Jangas","1253","1387",90.3389
"020107","148.377","Áncash, Huaraz, distrito: La Libertad","324","330",98.1818
"020108","230.777","Áncash, Huaraz, distrito: Olleros","711","720",98.7500
"020109","351.672","Áncash, Huaraz, distrito: Pampas Grande","385","385",100.0000
"020110","168.126","Áncash, Huaraz, distrito: Pariacoto","1405","1440",97.5694
"020111","261.262","Áncash, Huaraz, distrito: Pira","1041","1047",99.4269
"020112","117.147","Áncash, Huaraz, distrito: Tarica","1759","1841",95.5459
"020201","162.420","Áncash, Aija, distrito: Aija","490","557",87.9713
"020202","259.027","Áncash, Aija, distrito: Coris","542","546",99.2674
"020203","39.917","Áncash, Aija, distrito: Huacllan","122","123",99.1870
"020306","101.942","Áncash, Antonio Raymondi, distrito: San Juan de Rontoy","314","319",98.4326
"020401","451.218","Áncash, Asunción, distrito: Chacas","1303","1351",96.4471
"020402","76.542","Áncash, Asunción, distrito: Acochaca","1013","1019",99.4112
"020701","247.431","Áncash, Carlos Fermín Fitzcarrald, distrito: San Luis","3066","3146",97.4571
"020801","1207.722","Áncash, Casma, distrito: Casma","8823","10705",82.4194
"020802","480.440","Áncash, Casma, distrito: Buena Vista Alta","1482","1541",96.1713
"021409","534.305","Áncash, Ocros, distrito: San Pedro","258","259",99.6139
"021410","88.703","Áncash, Ocros, distrito: Santiago de Chilcas","158","162",97.5309
"021701","149.329","Áncash, Recuay, distrito: Recuay","1220","1367",89.2465
"021702","1024.538","Áncash, Recuay, distrito: Catac","1103","1138",96.9244
"021703","175.033","Áncash, Recuay, distrito: Cotaparaco","118","123",95.9350
"021704","110.988","Áncash, Recuay, distrito: Huayllapampa","260","264",98.4848
"021705","95.912","Áncash, Recuay, distrito: Llacllin","316","322",98.1366
"021706","182.544","Áncash, Recuay, distrito: Marca","447","449",99.5546
"021707","104.725","Áncash, Recuay, distrito: Pampas Chico","349","353",98.8669
"021708","258.976","Áncash, Recuay, distrito: Pararin","509","510",99.8039
"021709","78.225","Áncash, Recuay, distrito: Tapacocha","148","149",99.3289
"021710","146.120","Áncash, Recuay, distrito: Ticapampa","722","768",94.0104
"021805","356.924","Áncash, Santa, distrito: Moro","2420","2510",96.4143
"021806","456.877","Áncash, Santa, distrito: Nepeña","3176","4140",76.7150
"021807","149.225","Áncash, Santa, distrito: Samanco","1326","1503",88.2236
"022001","273.222","Áncash, Yungay, distrito: Yungay","5409","5868",92.1779
"022002","136.933","Áncash, Yungay, distrito: Cascapara","478","479",99.7912
"022003","62.926","Áncash, Yungay, distrito: Mancos","1953","2022",96.5875
"022004","47.020","Áncash, Yungay, distrito: Matacoto","366","387",94.5736
"022005","370.746","Áncash, Yungay, distrito: Quillo","3143","3210",97.9128
"022006","21.674","Áncash, Yungay, distrito: Ranrahirca","770","810",95.0617
"022007","166.514","Áncash, Yungay, distrito: Shupluy","504","508",99.2126
"022008","283.824","Áncash, Yungay, distrito: Yanama","1578","1590",99.2453
"020103","52.017","Áncash, Huaraz, distrito: Colcabamba","106","110",96.3636
"021202","195.131","Áncash, Huaylas, distrito: Huallanca","299","345",86.6667
"021203","69.441","Áncash, Huaylas, distrito: Huata","384","399",96.2406
"021204","54.004","Áncash, Huaylas, distrito: Huaylas","643","647",99.3818
"021205","105.829","Áncash, Huaylas, distrito: Mato","560","593",94.4351
"020702","204.922","Áncash, Carlos Fermín Fitzcarrald, distrito: San Nicolás","886","887",99.8873
"020703","174.636","Áncash, Carlos Fermín Fitzcarrald, distrito: Yauya","1280","1290",99.2248
"021208","359.365","Áncash, Huaylas, distrito: Santa Cruz","1194","1255",95.1394
"021209","84.390","Áncash, Huaylas, distrito: Santo Toribio","362","368",98.3696
"021210","547.226","Áncash, Huaylas, distrito: Yuracmarca","535","591",90.5245
"021301","45.791","Áncash, Mariscal Luzuriaga, distrito: Piscobamba","891","920",96.8478
"021302","75.980","Áncash, Mariscal Luzuriaga, distrito: Casca","1182","1182",100.0000
"021303","98.458","Áncash, Mariscal Luzuriaga, distrito: Eleazar Guzmán Barron","336","340",98.8235
"021304","213.547","Áncash, Mariscal Luzuriaga, distrito: Fidel Olivas Escudero","565","565",100.0000
"021305","49.090","Áncash, Mariscal Luzuriaga, distrito: Llama","335","338",99.1124
"021306","139.104","Áncash, Mariscal Luzuriaga, distrito: Llumpa","1594","1606",99.2528
"021307","75.274","Áncash, Mariscal Luzuriaga, distrito: Lucma","894","894",100.0000
"021308","38.871","Áncash, Mariscal Luzuriaga, distrito: Musga","301","303",99.3399
"021501","144.673","Áncash, Pallasca, distrito: Cabana","669","698",95.8453
"021502","81.822","Áncash, Pallasca, distrito: Bolognesi","277","277",100.0000
"020803","217.337","Áncash, Casma, distrito: Comandante Noel","607","647",93.8176
"020608","122.927","Áncash, Carhuaz, distrito: San Miguel de Aco","702","711",98.7342
"020609","127.792","Áncash, Carhuaz, distrito: Shilla","941","950",99.0526
"020610","15.749","Áncash, Carhuaz, distrito: Tinco","894","975",91.6923
"020611","45.271","Áncash, Carhuaz, distrito: Yungar","773","852",90.7277
"021001","399.663","Áncash, Huari, distrito: Huari","2411","2695",89.4620
"021002","80.666","Áncash, Huari, distrito: Anra","427","431",99.0719
"021003","165.449","Áncash, Huari, distrito: Cajay","748","750",99.7333
"021004","419.380","Áncash, Huari, distrito: Chavin de Huantar","2431","2479",98.0637
"021005","89.034","Áncash, Huari, distrito: Huacachi","511","514",99.4163
"021006","76.268","Áncash, Huari, distrito: Huacchis","455","455",100.0000
"021007","152.071","Áncash, Huari, distrito: Huachis","973","1023",95.1124
"021401","226.233","Áncash, Ocros, distrito: Ocros","413","432",95.6019
"021402","254.850","Áncash, Ocros, distrito: Acas","225","225",100.0000
"021403","78.620","Áncash, Ocros, distrito: Cajamarquilla","117","118",99.1525
"021404","106.568","Áncash, Ocros, distrito: Carhuapampa","203","208",97.5962
"021406","108.993","Áncash, Ocros, distrito: Congas","440","442",99.5475
"021407","31.473","Áncash, Ocros, distrito: Llipa","116","119",97.4790
"021408","70.609","Áncash, Ocros, distrito: San Cristóbal de Rajan","167","197",84.7716
"021503","579.512","Áncash, Pallasca, distrito: Conchucos","1953","1963",99.4906
"021504","13.562","Áncash, Pallasca, distrito: Huacaschuque","153","157",97.4522
"021505","115.514","Áncash, Pallasca, distrito: Huandoval","291","296",98.3108
"021506","63.517","Áncash, Pallasca, distrito: Lacabamba","160","160",100.0000
"021507","29.227","Áncash, Pallasca, distrito: Llapo","177","189",93.6508
"021508","110.297","Áncash, Pallasca, distrito: Pallasca","730","738",98.9160
"021509","439.910","Áncash, Pallasca, distrito: Pampas","1202","1247",96.3913
"021510","290.038","Áncash, Pallasca, distrito: Santa Rosa","322","333",96.6967
"021511","198.784","Áncash, Pallasca, distrito: Tauca","776","792",97.9798
"021601","344.069","Áncash, Pomabamba, distrito: Pomabamba","3953","4077",96.9585
"021602","88.765","Áncash, Pomabamba, distrito: Huayllan","906","916",98.9083
"021603","338.804","Áncash, Pomabamba, distrito: Parobamba","1653","1661",99.5184
"021604","149.644","Áncash, Pomabamba, distrito: Quinuabamba","656","656",100.0000
"021801","1445.303","Áncash, Santa, distrito: Chimbote","36673","54385",67.4322
"021802","528.168","Áncash, Santa, distrito: Cáceres del Perú","1405","1453",96.6965
"021804","586.901","Áncash, Santa, distrito: Macate","983","992",99.0927
"021808","40.850","Áncash, Santa, distrito: Santa","4103","5203",78.8584
"021901","46.017","Áncash, Sihuas, distrito: Sihuas","1438","1611",89.2613
"021902","150.328","Áncash, Sihuas, distrito: Acobamba","416","417",99.7602
"021903","89.110","Áncash, Sihuas, distrito: Alfonso Ugarte","164","167",98.2036
"021904","69.587","Áncash, Sihuas, distrito: Cashapampa","805","824",97.6942
"021905","173.453","Áncash, Sihuas, distrito: Chingalpo","263","263",100.0000
"021906","276.599","Áncash, Sihuas, distrito: Huayllabamba","1010","1014",99.6055
"021907","148.275","Áncash, Sihuas, distrito: Quiches","682","685",99.5620
"021908","208.773","Áncash, Sihuas, distrito: Ragash","666","667",99.8501
"021909","211.312","Áncash, Sihuas, distrito: San Juan","1657","1757",94.3085
"021910","82.453","Áncash, Sihuas, distrito: Sicsibamba","499","499",100.0000
"150304","150.104","Lima, Cajatambo, distrito: Huancapon","393","394",99.7462
"150305","282.692","Lima, Cajatambo, distrito: Manas","361","381",94.7507
"150802","941.447","Lima, Huaura, distrito: Ambar","740","751",98.5353
"150804","166.913","Lima, Huaura, distrito: Checras","434","437",99.3135
"150808","237.498","Lima, Huaura, distrito: Paccho","600","603",99.5025
"150809","374.601","Lima, Huaura, distrito: Santa Leonor","288","297",96.9697
"150811","1313.526","Lima, Huaura, distrito: Sayan","5376","6709",80.1312
"150812","257.660","Lima, Huaura, distrito: Vegueta","6093","7488",81.3702
"150901","876.704","Lima, Oyón, distrito: Oyón","2701","3007",89.8237
"150906","255.128","Lima, Oyón, distrito: Pachangara","595","638",93.2602
"150203","281.843","Lima, Barranca, distrito: Pativilca","4118","5216",78.9494
"150301","552.217","Lima, Cajatambo, distrito: Cajatambo","650","675",96.2963
"150302","205.395","Lima, Cajatambo, distrito: Copa","277","280",98.9286
"150303","336.121","Lima, Cajatambo, distrito: Gorgor","530","540",98.1481
"130102","38.437","La Libertad, Trujillo, distrito: El Porvenir","40867","50805",80.4389
"060101","379.110","Cajamarca, Cajamarca, distrito: Cajamarca","38481","58838",65.4016
"140104","13.169","Lambayeque, Chiclayo, distrito: Eten Puerto","500","667",74.9625
"130103","2.584","La Libertad, Trujillo, distrito: Florencia de Mora","5636","8635",65.2693
"130105","21.554","La Libertad, Trujillo, distrito: La Esperanza","31690","47896",66.1642
"021803","8.467","Áncash, Santa, distrito: Coishco","3065","4341",70.6059
"160804","17961.263","Loreto, Putumayo, distrito: Yaguas","253","272",93.0147
"160802","7170.236","Loreto, Putumayo, distrito: Rosa Panduro","128","130",98.4615
"010703","300.885","Amazonas, Utcubamba, distrito: Cumba","2310","2332",99.0566
"010701","727.450","Amazonas, Utcubamba, distrito: Bagua Grande","13450","14760",91.1247
"010702","1798.795","Amazonas, Utcubamba, distrito: Cajaruro","6854","6897",99.3765
"010401","4182.378","Amazonas, Condorcanqui, distrito: Nieva","4655","4745",98.1033
"010103","316.905","Amazonas, Chachapoyas, distrito: Balsas","352","359",98.0501
"010110","380.492","Amazonas, Chachapoyas, distrito: Leimebamba","1043","1123",92.8762
"010113","78.826","Amazonas, Chachapoyas, distrito: Mariscal Castilla","400","407",98.2801
"010115","122.963","Amazonas, Chachapoyas, distrito: Montevideo","163","164",99.3902
"010517","181.714","Amazonas, Luya, distrito: San Francisco del Yeso","243","243",100.0000
"010521","89.934","Amazonas, Luya, distrito: Santo Tomas","864","929",93.0032
"010503","340.973","Amazonas, Luya, distrito: Cocabamba","559","560",99.8214
"010602","153.743","Amazonas, Rodríguez de Mendoza, distrito: Chirimoto","749","749",100.0000
"010109","124.005","Amazonas, Chachapoyas, distrito: La Jalca","1077","1108",97.2022
"010608","42.942","Amazonas, Rodríguez de Mendoza, distrito: Milpuc","162","163",99.3865
"010514","290.700","Amazonas, Luya, distrito: Pisuquia","1336","1343",99.4788
"010519","86.292","Amazonas, Luya, distrito: San Juan de Lopecancha","129","129",100.0000
"010605","614.496","Amazonas, Rodríguez de Mendoza, distrito: Limabamba","735","741",99.1903
"010511","87.681","Amazonas, Luya, distrito: María","240","242",99.1736
"010604","77.614","Amazonas, Rodríguez de Mendoza, distrito: Huambo","987","994",99.2958
"010112","135.339","Amazonas, Chachapoyas, distrito: Magdalena","308","318",96.8553
"010507","58.649","Amazonas, Luya, distrito: Longuita","254","254",100.0000
"010601","102.144","Amazonas, Rodríguez de Mendoza, distrito: San Nicolás","1611","1791",89.9497
"010522","108.977","Amazonas, Luya, distrito: Tingo","368","386",95.3368
"010606","82.202","Amazonas, Rodríguez de Mendoza, distrito: Longar","486","496",97.9839
"010119","107.910","Amazonas, Chachapoyas, distrito: San Isidro de Maino","187","187",100.0000
"010611","19.446","Amazonas, Rodríguez de Mendoza, distrito: Totora","111","111",100.0000
"010609","225.084","Amazonas, Rodríguez de Mendoza, distrito: Omia","2467","2483",99.3556
"010610","20.219","Amazonas, Rodríguez de Mendoza, distrito: Santa Rosa","200","201",99.5025
"010111","74.796","Amazonas, Chachapoyas, distrito: Levanto","251","252",99.6032
"010603","180.702","Amazonas, Rodríguez de Mendoza, distrito: Cochamal","186","186",100.0000
"010504","107.584","Amazonas, Luya, distrito: Colcamar","641","650",98.6154
"010513","363.725","Amazonas, Luya, distrito: Ocumal","896","899",99.6663
"010515","116.403","Amazonas, Luya, distrito: Providencia","327","331",98.7915
"010120","74.730","Amazonas, Chachapoyas, distrito: Soloco","407","407",100.0000
"010104","70.292","Amazonas, Chachapoyas, distrito: Cheto","214","220",97.2727
"010506","118.480","Amazonas, Luya, distrito: Inguilpata","170","172",98.8372
"010118","40.382","Amazonas, Chachapoyas, distrito: San Francisco de Daguas","91","105",86.6667
"010502","218.708","Amazonas, Luya, distrito: Camporredondo","1787","1841",97.0668
"010607","202.473","Amazonas, Rodríguez de Mendoza, distrito: Mariscal Benavides","491","498",98.5944
"010508","69.492","Amazonas, Luya, distrito: Lonya Chico","270","271",99.6310
"010101","153.132","Amazonas, Chachapoyas, distrito: Chachapoyas","6825","8437",80.8937
"010509","96.086","Amazonas, Luya, distrito: Luya","1124","1171",95.9863
"010523","12.934","Amazonas, Luya, distrito: Trita","379","383",98.9556
"010512","171.875","Amazonas, Luya, distrito: Ocalli","1038","1084",95.7565
"010114","340.191","Amazonas, Chachapoyas, distrito: Molinopampa","697","704",99.0057
"010121","120.113","Amazonas, Chachapoyas, distrito: Sonche","86","86",100.0000
"010108","46.207","Amazonas, Chachapoyas, distrito: Huancas","120","148",81.0811
"010505","248.582","Amazonas, Luya, distrito: Conila","527","530",99.4340
"010501","73.093","Amazonas, Luya, distrito: Lamud","706","755",93.5099
"010117","82.442","Amazonas, Chachapoyas, distrito: Quinjalca","295","295",100.0000
"010516","35.531","Amazonas, Luya, distrito: San Cristobal","190","190",100.0000
"010107","171.099","Amazonas, Chachapoyas, distrito: Granada","156","158",98.7342
"010311","78.003","Amazonas, Bongara, distrito: Valera","295","303",97.3597
"010105","141.580","Amazonas, Chachapoyas, distrito: Chiliquin","206","206",100.0000
"010520","164.652","Amazonas, Luya, distrito: Santa Catalina","538","540",99.6296
"010706","364.154","Amazonas, Utcubamba, distrito: Lonya Grande","3017","3067",98.3697
"010510","55.665","Amazonas, Luya, distrito: Luya Viejo","103","104",99.0385
"010612","861.265","Amazonas, Rodríguez de Mendoza, distrito: Vista Alegre","788","788",100.0000
"010303","31.804","Amazonas, Bongara, distrito: Churuja","86","90",95.5556
"010518","207.788","Amazonas, Luya, distrito: San Jerónimo","242","245",98.7755
"010309","112.415","Amazonas, Bongara, distrito: San Carlos","183","183",100.0000
"010102","34.851","Amazonas, Chachapoyas, distrito: Asunción","104","105",99.0476
"010116","106.747","Amazonas, Chachapoyas, distrito: Olleros","146","148",98.6486
"010307","75.736","Amazonas, Bongara, distrito: Jazan","2249","2380",94.4958
"010308","28.043","Amazonas, Bongara, distrito: Recta","78","79",98.7342
"010301","158.608","Amazonas, Bongara, distrito: Jumbilla","393","444",88.5135
"010305","96.427","Amazonas, Bongara, distrito: Cuispes","225","225",100.0000
"010310","125.327","Amazonas, Bongara, distrito: Shipasbamba","449","456",98.4649
"010302","161.771","Amazonas, Bongara, distrito: Chisquilla","113","115",98.2609
"010306","221.992","Amazonas, Bongara, distrito: Florida","1639","1684",97.3278
"010304","64.169","Amazonas, Bongara, distrito: Corosha","232","233",99.5708
"010312","1679.371","Amazonas, Bongara, distrito: Yambrasbamba","1637","1662",98.4958
"010707","135.287","Amazonas, Utcubamba, distrito: Yamon","906","908",99.7797
"010705","350.383","Amazonas, Utcubamba, distrito: Jamalca","1911","1936",98.7087
"010203","98.937","Amazonas, Bagua, distrito: Copallin","1439","1475",97.5593
"010704","306.992","Amazonas, Utcubamba, distrito: El Milagro","1649","1689",97.6317
"010204","18.165","Amazonas, Bagua, distrito: El Parco","385","388",99.2268
"010201","132.969","Amazonas, Bagua, distrito: Bagua","6673","7527",88.6542
"010206","138.065","Amazonas, Bagua, distrito: La Peca","1909","1969",96.9528
"010202","818.939","Amazonas, Bagua, distrito: Aramango","2851","2894",98.5142
"010205","4584.997","Amazonas, Bagua, distrito: Imaza","6263","6323",99.0511
"010402","5608.925","Amazonas, Condorcanqui, distrito: El Cenepa","2087","2108",99.0038
"010403","8074.562","Amazonas, Condorcanqui, distrito: Rio Santiago","3068","3077",99.7075
"160502","9067.485","Loreto, Requena, distrito: Alto Tapiche","307","313",98.0831
"160503","801.065","Loreto, Requena, distrito: Capelo","583","593",98.3137
"160504","4641.003","Loreto, Requena, distrito: Emilio San Martín","1248","1256",99.3631
"160505","4895.373","Loreto, Requena, distrito: Maquia","1546","1555",99.4212
"160506","6285.811","Loreto, Requena, distrito: Puinahua","953","958",99.4781
"160507","2595.538","Loreto, Requena, distrito: Saquena","719","731",98.3584
"160508","4697.861","Loreto, Requena, distrito: Soplin","139","140",99.2857
"160101","366.934","Loreto, Maynas, distrito: Iquitos","19774","30610",64.5998
"160102","14562.992","Loreto, Maynas, distrito: Alto Nanay","642","652",98.4663
"160103","4567.906","Loreto, Maynas, distrito: Fernando Lores","3132","3179",98.5215
"160104","3365.543","Loreto, Maynas, distrito: Indiana","2192","2255",97.2062
"160105","6719.587","Loreto, Maynas, distrito: Las Amazonas","1685","1703",98.9430
"160106","10053.609","Loreto, Maynas, distrito: Mazan","2858","2885",99.0641
"160107","24171.438","Loreto, Maynas, distrito: Napo","2969","2987",99.3974
"160202","3003.818","Loreto, Alto Amazonas, distrito: Balsapuerto","2937","2945",99.7284
"160205","4346.500","Loreto, Alto Amazonas, distrito: Jeberos","832","840",99.0476
