IDDIST,AREA_KM2,Distrito,SinCelMovil,without_mobilephone_access
"030220","175.236","Apurímac, Andahuaylas, distrito: José María Arguedas","407",35.639
"030415","142.393","Apurímac, Aymaraes, distrito: Tintay","226",26.588
"030409","103.766","Apurímac, Aymaraes, distrito: Lucre","179",34.226
"030214","84.929","Apurímac, Andahuaylas, distrito: San Miguel de Chaccrampa","207",41.071
"030206","95.320","Apurímac, Andahuaylas, distrito: Huayana","127",48.289
"030404","204.060","Apurímac, Aymaraes, distrito: Chapimarca","272",37.311
"030405","91.771","Apurímac, Aymaraes, distrito: Colcabamba","57",21.190
"030304","632.359","Apurímac, Antabamba, distrito: Juan Espinoza Medrano","259",37.536
"030406","1735.304","Apurímac, Aymaraes, distrito: Cotaruse","422",51.090
"030301","602.523","Apurímac, Antabamba, distrito: Antabamba","489",46.395
"030403","230.271","Apurímac, Aymaraes, distrito: Caraybamba","134",36.314
"030303","350.743","Apurímac, Antabamba, distrito: Huaquirca","209",41.468
"030307","176.532","Apurímac, Antabamba, distrito: Sabaino","345",81.176
"030713","114.248","Apurímac, Grau, distrito: Virundo","86",35.391
"030401","339.028","Apurímac, Aymaraes, distrito: Chalhuanca","187",12.467
"030410","87.573","Apurímac, Aymaraes, distrito: Pocohuanca","104",24.586
"030305","1170.603","Apurímac, Antabamba, distrito: Oropesa","423",55.952
"030417","104.366","Apurímac, Aymaraes, distrito: Yanaca","123",33.243
"030504","484.064","Apurímac, Cotabambas, distrito: Haquira","899",27.226
"030705","62.668","Apurímac, Grau, distrito: Mamara","227",66.765
"030711","50.970","Apurímac, Grau, distrito: Turpay","98",36.842
"030709","25.354","Apurímac, Grau, distrito: San Antonio","51",39.231
"030707","146.412","Apurímac, Grau, distrito: Pataypampa","271",91.554
"030412","365.244","Apurímac, Aymaraes, distrito: Sañayca","127",30.751
"030306","229.231","Apurímac, Antabamba, distrito: Pachaconas","202",51.139
"030413","44.385","Apurímac, Aymaraes, distrito: Soraya","88",31.884
"030710","31.042","Apurímac, Grau, distrito: Santa Rosa","82",35.043
"030506","453.501","Apurímac, Cotabambas, distrito: Challhuahuacho","1063",29.759
"030210","590.658","Apurímac, Andahuaylas, distrito: Pampachiri","390",53.425
"030302","66.604","Apurímac, Antabamba, distrito: El Oro","168",59.364
"030701","425.409","Apurímac, Grau, distrito: Chuquibambilla","900",55.659
"030414","158.187","Apurímac, Aymaraes, distrito: Tapairihua","419",57.240
"030402","83.288","Apurímac, Aymaraes, distrito: Capaya","138",57.983
"030712","6.579","Apurímac, Grau, distrito: Vilcabamba","281",57.582
"030706","104.777","Apurímac, Grau, distrito: Micaela Bastidas","152",49.191
"030211","122.859","Apurímac, Andahuaylas, distrito: Pomacocha","125",40.984
"030505","221.923","Apurímac, Cotabambas, distrito: Mara","901",49.262
"030217","453.423","Apurímac, Andahuaylas, distrito: Tumay Huaraca","425",64.297
"030407","72.783","Apurímac, Aymaraes, distrito: Ihuayllo","58",29.744
"030408","100.994","Apurímac, Aymaraes, distrito: Justo Apu Sahuaraura","117",38.742
"030708","240.419","Apurímac, Grau, distrito: Progreso","447",48.534
"030714","136.403","Apurímac, Grau, distrito: Curasco","180",46.154
"030702","310.153","Apurímac, Grau, distrito: Curpahuasi","358",49.861
"030416","168.616","Apurímac, Aymaraes, distrito: Toraya","125",23.992
"030704","124.134","Apurímac, Grau, distrito: Huayllati","223",48.268
"030102","176.850","Apurímac, Abancay, distrito: Chacoche","247",49.499
"030107","373.769","Apurímac, Abancay, distrito: Pichirhua","363",34.971
"030203","146.730","Apurímac, Andahuaylas, distrito: Chiara","147",34.186
"030501","714.098","Apurímac, Cotabambas, distrito: Tambobamba","1422",43.593
"030503","418.982","Apurímac, Cotabambas, distrito: Coyllurqui","982",45.866
"030411","96.210","Apurímac, Aymaraes, distrito: San Juan de Chacña","89",33.585
"030106","525.594","Apurímac, Abancay, distrito: Lambrama","518",41.909
"030703","349.620","Apurímac, Grau, distrito: Gamarra","701",71.240
"030103","634.251","Apurímac, Abancay, distrito: Circa","431",52.689
"030218","123.766","Apurímac, Andahuaylas, distrito: Turpo","460",38.494
"030205","111.140","Apurímac, Andahuaylas, distrito: Huancaray","625",49.058
"030212","178.561","Apurímac, Andahuaylas, distrito: San Antonio de Cachi","413",39.296
"030502","326.959","Apurímac, Cotabambas, distrito: Cotabambas","501",39.325
"030607","146.864","Apurímac, Chincheros, distrito: Uranmarca","280",33.333
"030207","309.046","Apurímac, Andahuaylas, distrito: Kishuara","533",29.270
"030213","248.614","Apurímac, Andahuaylas, distrito: San Jerónimo","1405",24.784
"030204","156.295","Apurímac, Andahuaylas, distrito: Huancarama","573",35.067
"030201","197.259","Apurímac, Andahuaylas, distrito: Andahuaylas","1752",14.289
"030209","170.665","Apurímac, Andahuaylas, distrito: Pacucha","913",38.539
"030215","156.092","Apurímac, Andahuaylas, distrito: Santa María de Chicmo","725",29.317
"030603","108.193","Apurímac, Chincheros, distrito: Cocharcas","333",56.923
"030109","54.569","Apurímac, Abancay, distrito: Tamburco","331",10.018
"030101","286.551","Apurímac, Abancay, distrito: Abancay","1583",7.697
"080702","267.803","Cusco, Chumbivilcas, distrito: Capacmarca","535",42.159
"080703","674.067","Cusco, Chumbivilcas, distrito: Chamaca","918",44.693
"081003","325.522","Cusco, Paruro, distrito: Ccapi","392",39.239
"081005","361.035","Cusco, Paruro, distrito: Huanoquite","707",47.642
"081006","427.279","Cusco, Paruro, distrito: Omacha","1507",93.953
"080704","452.194","Cusco, Chumbivilcas, distrito: Colquemarca","1144",48.743
"080705","746.638","Cusco, Chumbivilcas, distrito: Livitaca","2026",55.967
"080706","314.992","Cusco, Chumbivilcas, distrito: Llusco","648",46.187
"080707","226.042","Cusco, Chumbivilcas, distrito: Quiñota","603",54.373
"080503","393.761","Cusco, Canas, distrito: Kunturkanki","592",36.566
"080504","171.122","Cusco, Canas, distrito: Langui","226",33.333
"080505","425.824","Cusco, Canas, distrito: Layo","930",54.770
"080508","115.173","Cusco, Canas, distrito: Tupac Amaru","414",51.621
"080602","936.927","Cusco, Canchis, distrito: Checacupe","763",49.289
"081201","140.594","Cusco, Quispicanchi, distrito: Urcos","518",16.597
"081202","85.669","Cusco, Quispicanchi, distrito: Andahuaylillas","317",19.677
"080102","161.581","Cusco, Cusco, distrito: Ccorca","345",46.685
"080106","59.031","Cusco, Cusco, distrito: Santiago","1828",6.745
"080201","141.300","Cusco, Acomayo, distrito: Acomayo","404",31.149
"080202","71.393","Cusco, Acomayo, distrito: Acopia","376",46.248
"080204","43.871","Cusco, Acomayo, distrito: Mosoc Llacta","387",86.577
"080205","267.277","Cusco, Acomayo, distrito: Pomacanchi","822",38.592
"080206","183.004","Cusco, Acomayo, distrito: Rondocan","327",42.801
"080207","86.022","Cusco, Acomayo, distrito: Sangarara","290",28.856
"080203","137.678","Cusco, Acomayo, distrito: Acos","215",29.903
"080701","1904.779","Cusco, Chumbivilcas, distrito: Santo Tomas","2589",35.544
"050609","1110.659","Ayacucho, Lucanas, distrito: Leoncio Prado","281",58.420
"050803","100.862","Ayacucho, Páucar del Sara Sara, distrito: Corculla","30",17.341
"050810","85.031","Ayacucho, Páucar del Sara Sara, distrito: Sara Sara","96",45.933
"050801","251.426","Ayacucho, Páucar del Sara Sara, distrito: Pausa","170",14.744
"050809","28.415","Ayacucho, Páucar del Sara Sara, distrito: San José de Ushua","11",12.500
"050807","56.662","Ayacucho, Páucar del Sara Sara, distrito: Pararca","46",27.545
"050706","643.279","Ayacucho, Parinacochas, distrito: Puyusca","261",34.893
"050806","793.713","Ayacucho, Páucar del Sara Sara, distrito: Oyolo","83",24.850
"050705","1563.276","Ayacucho, Parinacochas, distrito: Pullo","301",15.751
"050804","281.007","Ayacucho, Páucar del Sara Sara, distrito: Lampa","197",28.103
"050802","248.108","Ayacucho, Páucar del Sara Sara, distrito: Colta","36",20.809
"050702","372.212","Ayacucho, Parinacochas, distrito: Chumpi","146",19.160
"050808","117.501","Ayacucho, Páucar del Sara Sara, distrito: San Javier de Alpabamba","31",24.409
"050805","120.358","Ayacucho, Páucar del Sara Sara, distrito: Marcabamba","47",19.502
"050619","1504.093","Ayacucho, Lucanas, distrito: Sancos","428",26.551
"050701","1388.399","Ayacucho, Parinacochas, distrito: Coracora","869",23.106
"050707","102.981","Ayacucho, Parinacochas, distrito: San Francisco de Ravacayco","57",28.788
"050605","366.939","Ayacucho, Lucanas, distrito: Chaviña","171",26.227
"050303","639.465","Ayacucho, Huanca Sancos, distrito: Sacsamarca","116",22.437
"050909","141.830","Ayacucho, Sucre, distrito: San Salvador de Quije","118",30.971
"051005","265.212","Ayacucho, Víctor Fajardo, distrito: Canaria","409",30.432
"050704","147.042","Ayacucho, Parinacochas, distrito: Pacapausa","131",50.775
"050621","1034.046","Ayacucho, Lucanas, distrito: Santa Lucia","150",33.632
"050708","575.666","Ayacucho, Parinacochas, distrito: Upahuacho","141",31.195
"050614","575.655","Ayacucho, Lucanas, distrito: Saisa","93",45.146
"050617","727.490","Ayacucho, Lucanas, distrito: San Pedro","373",44.886
"050615","407.454","Ayacucho, Lucanas, distrito: San Cristobal","157",31.400
"050703","1081.616","Ayacucho, Parinacochas, distrito: Coronel Castañeda","105",41.667
"050601","863.694","Ayacucho, Lucanas, distrito: Puquio","733",16.897
"050616","46.855","Ayacucho, Lucanas, distrito: San Juan","130",28.571
"050611","1211.652","Ayacucho, Lucanas, distrito: Lucanas","254",27.341
"050613","716.572","Ayacucho, Lucanas, distrito: Otoca","227",34.763
"050612","859.086","Ayacucho, Lucanas, distrito: Ocaña","376",43.670
"050604","464.117","Ayacucho, Lucanas, distrito: Carmen Salcedo","121",19.611
"050606","1156.175","Ayacucho, Lucanas, distrito: Chipao","379",36.796
"050603","405.264","Ayacucho, Lucanas, distrito: Cabana","181",24.198
"050608","779.968","Ayacucho, Lucanas, distrito: Laramate","365",62.393
"050618","520.466","Ayacucho, Lucanas, distrito: San Pedro de Palco","154",42.308
"050610","493.547","Ayacucho, Lucanas, distrito: Llauta","142",41.159
"050620","45.503","Ayacucho, Lucanas, distrito: Santa Ana de HuaycAHUACHO","117",29.771
"050908","314.273","Ayacucho, Sucre, distrito: San Pedro de Larcay","49",17.438
"050905","144.061","Ayacucho, Sucre, distrito: Huacaña","67",42.675
"050602","872.404","Ayacucho, Lucanas, distrito: Aucara","527",32.611
"050911","351.818","Ayacucho, Sucre, distrito: Soras","99",27.424
"050607","312.611","Ayacucho, Lucanas, distrito: Huac-Huas","321",52.796
"050906","288.942","Ayacucho, Sucre, distrito: Morcolla","130",31.026
"050910","61.546","Ayacucho, Sucre, distrito: Santiago de Paucaray","82",33.469
"051004","71.362","Ayacucho, Víctor Fajardo, distrito: Asquipata","76",32.068
"051003","175.820","Ayacucho, Víctor Fajardo, distrito: Apongo","180",56.075
"050901","282.124","Ayacucho, Sucre, distrito: Querobamba","176",21.154
"050907","79.324","Ayacucho, Sucre, distrito: Paico","84",34.711
"050904","29.764","Ayacucho, Sucre, distrito: Chilcayoc","34",17.259
"050301","1357.052","Ayacucho, Huanca Sancos, distrito: Sancos","284",23.706
"051106","88.109","Ayacucho, Vilcas Huamán, distrito: Independencia","203",47.653
"050304","645.902","Ayacucho, Huanca Sancos, distrito: Santiago de Lucanamarca","221",30.609
"050903","54.891","Ayacucho, Sucre, distrito: Chalcos","49",27.841
"051010","156.701","Ayacucho, Víctor Fajardo, distrito: Hualla","243",29.348
"051006","63.507","Ayacucho, Víctor Fajardo, distrito: Cayara","226",43.212
"051102","86.469","Ayacucho, Vilcas Huamán, distrito: Accomarca","223",56.030
"050902","36.352","Ayacucho, Sucre, distrito: Belén","55",40.441
"050302","196.664","Ayacucho, Huanca Sancos, distrito: Carapo","239",34.488
"051105","162.982","Ayacucho, Vilcas Huamán, distrito: Huambalpa","234",38.678
"051008","72.444","Ayacucho, Víctor Fajardo, distrito: Huamanquiquia","129",35.246
"051001","239.371","Ayacucho, Víctor Fajardo, distrito: Huancapi","154",22.985
"051103","54.285","Ayacucho, Vilcas Huamán, distrito: Carhuanca","97",27.874
"051009","162.205","Ayacucho, Víctor Fajardo, distrito: Huancaraylla","136",27.984
"051007","63.872","Ayacucho, Víctor Fajardo, distrito: Colca","185",47.927
"051107","89.230","Ayacucho, Vilcas Huamán, distrito: Saurama","143",36.480
"051101","220.297","Ayacucho, Vilcas Huamán, distrito: Vilcas Huamán","839",38.188
"051002","116.022","Ayacucho, Víctor Fajardo, distrito: Alcamenca","222",36.215
"051011","378.926","Ayacucho, Víctor Fajardo, distrito: Sarhua","279",35.769
"051012","500.008","Ayacucho, Víctor Fajardo, distrito: Vilcanchos","259",30.046
"081007","142.059","Cusco, Paruro, distrito: Paccaritambo","279",41.955
"081008","78.419","Cusco, Paruro, distrito: Pillpinto","107",23.991
"081009","100.838","Cusco, Paruro, distrito: Yaurisque","235",37.184
"081001","152.677","Cusco, Paruro, distrito: Paruro","250",25.202
"081002","238.717","Cusco, Paruro, distrito: Accha","629",63.026
"081004","139.818","Cusco, Paruro, distrito: Colcha","282",70.854
"080708","759.872","Cusco, Chumbivilcas, distrito: Velille","706",30.274
"080802","515.217","Cusco, Espinar, distrito: Condoroma","71",19.888
"080501","291.112","Cusco, Canas, distrito: Yanaoca","1232",44.589
"080502","504.069","Cusco, Canas, distrito: Checca","738",42.487
"080506","31.173","Cusco, Canas, distrito: Pampamarca","266",48.452
"080507","148.860","Cusco, Canas, distrito: Quehue","583",65.213
"080601","646.407","Cusco, Canchis, distrito: Sicuani","2699",15.420
"080603","173.418","Cusco, Canchis, distrito: Combapata","440",30.387
"080604","438.745","Cusco, Canchis, distrito: Marangani","922",30.141
"080605","1091.066","Cusco, Canchis, distrito: Pitumarca","1203",49.082
"081206","242.518","Cusco, Quispicanchi, distrito: Cusipata","479",37.074
"081207","108.445","Cusco, Quispicanchi, distrito: Huaro","349",27.033
"081208","118.033","Cusco, Quispicanchi, distrito: Lucre","263",19.642
"081212","364.184","Cusco, Quispicanchi, distrito: Quiquijana","1196",40.556
"080606","522.959","Cusco, Canchis, distrito: San Pablo","530",35.030
"080607","55.980","Cusco, Canchis, distrito: San Pedro","242",26.711
"080608","82.595","Cusco, Canchis, distrito: Tinta","377",22.163
"080806","273.929","Cusco, Espinar, distrito: Pichigua","430",41.586
"080807","627.786","Cusco, Espinar, distrito: Suyckutambo","300",45.802
"080808","359.526","Cusco, Espinar, distrito: Alto Pichigua","315",42.625
"080801","738.312","Cusco, Espinar, distrito: Espinar","1327",12.409
"080803","1543.040","Cusco, Espinar, distrito: Coporaque","2076",56.846
"080804","359.239","Cusco, Espinar, distrito: Ocoruro","262",54.812
"080805","817.204","Cusco, Espinar, distrito: Pallpata","453",26.322
"090612","168.752","Huancavelica, Huaytará, distrito: San Isidro","244",63.049
"090614","175.493","Huancavelica, Huaytará, distrito: Santiago de Quirahuara","86",50.292
"090606","168.257","Huancavelica, Huaytará, distrito: Ocoyo","111",46.835
"090603","102.978","Huancavelica, Huaytará, distrito: Cordova","241",56.840
"090608","685.695","Huancavelica, Huaytará, distrito: Querco","269",62.125
"090605","193.322","Huancavelica, Huaytará, distrito: Laramarca","155",49.206
"090613","1144.183","Huancavelica, Huaytará, distrito: Santiago de Chocorvos","424",60.920
"090611","78.513","Huancavelica, Huaytará, distrito: San Francisco de Sangayaico","188",60.841
"090615","255.829","Huancavelica, Huaytará, distrito: Santo Domingo de Capillas","135",41.538
"090602","179.849","Huancavelica, Huaytará, distrito: Ayavi","255",75.893
"090604","37.745","Huancavelica, Huaytará, distrito: Huayacundo Arma","110",61.111
"110301","1144.287","Ica, Nasca, distrito: Nasca","931",11.160
"110302","955.421","Ica, Nasca, distrito: Changuillo","265",35.570
"110303","611.811","Ica, Nasca, distrito: El Ingenio","214",20.676
"110304","1945.394","Ica, Nasca, distrito: Marcona","294",6.004
"110305","534.520","Ica, Nasca, distrito: Vista Alegre","823",12.640
"110401","131.429","Ica, Palpa, distrito: Palpa","435",17.998
"110402","182.642","Ica, Palpa, distrito: Llipata","110",22.267
"110403","313.904","Ica, Palpa, distrito: Río Grande","251",26.589
"110405","336.107","Ica, Palpa, distrito: Tibillo","54",41.860
"110501","24.688","Ica, Pisco, distrito: Pisco","2147",11.273
"110404","253.903","Ica, Palpa, distrito: Santa Cruz","99",33.446
"110102","81.674","Ica, Ica, distrito: La Tinguiña","987",9.148
"110103","90.731","Ica, Ica, distrito: Los Aquijes","824",13.155
"110104","1400.668","Ica, Ica, distrito: Ocucaje","292",19.173
"110105","41.457","Ica, Ica, distrito: Pachacutec","231",11.159
"110106","17.242","Ica, Ica, distrito: Parcona","1585",11.193
"110107","30.697","Ica, Ica, distrito: Pueblo Nuevo","243",13.411
"110108","657.827","Ica, Ica, distrito: Salas","965",12.473
"110109","360.539","Ica, Ica, distrito: San José de Los Molinos","389",18.533
"110110","32.527","Ica, Ica, distrito: San Juan Bautista","417",10.660
"110111","2769.905","Ica, Ica, distrito: Santiago","1006",12.330
"110112","186.127","Ica, Ica, distrito: Subtanjalla","711",9.178
"110113","6.329","Ica, Ica, distrito: Tate","178",12.936
"110114","1262.411","Ica, Ica, distrito: Yauca del Rosario","278",48.348
"110101","886.998","Ica, Ica, distrito: Ica","3443",8.165
"110503","910.182","Ica, Pisco, distrito: Humay","285",16.725
"110504","268.727","Ica, Pisco, distrito: Independencia","594",15.546
"110505","1425.806","Ica, Pisco, distrito: Paracas","211",10.323
"110506","232.513","Ica, Pisco, distrito: San Andrés","512",13.635
"110507","136.903","Ica, Pisco, distrito: San Clemente","1025",14.082
"110508","55.662","Ica, Pisco, distrito: Tupac Amaru Inca","572",11.521
"230101","1908.805","Tacna, Tacna, distrito: Tacna","1604",5.689
"230103","110.006","Tacna, Tacna, distrito: Calana","103",9.424
"230301","846.018","Tacna, Jorge Basadre, distrito: Locumba","68",7.640
"230302","1057.879","Tacna, Jorge Basadre, distrito: Ilabaya","136",8.511
"230303","825.227","Tacna, Jorge Basadre, distrito: Ite","47",6.267
"180101","3944.307","Moquegua, Mariscal Nieto, distrito: Moquegua","1440",6.433
"180102","2263.860","Moquegua, Mariscal Nieto, distrito: Carumas","471",49.063
"180103","68.855","Moquegua, Mariscal Nieto, distrito: Cuchumbaya","151",39.221
"180104","64.595","Moquegua, Mariscal Nieto, distrito: Samegua","222",7.971
"180105","539.511","Moquegua, Mariscal Nieto, distrito: San Cristóbal","310",39.043
"180106","1768.950","Moquegua, Mariscal Nieto, distrito: Torata","290",15.873
"180201","255.338","Moquegua, General Sánchez Cerro, distrito: Omate","153",13.624
"180202","858.350","Moquegua, General Sánchez Cerro, distrito: Chojata","128",36.364
"180203","244.600","Moquegua, General Sánchez Cerro, distrito: Coalaque","153",39.332
"180204","998.919","Moquegua, General Sánchez Cerro, distrito: Ichuña","680",49.708
"180205","778.956","Moquegua, General Sánchez Cerro, distrito: La Capilla","212",65.635
"180206","255.278","Moquegua, General Sánchez Cerro, distrito: Lloque","107",41.961
"180207","562.349","Moquegua, General Sánchez Cerro, distrito: Matalaque","123",51.250
"180208","593.815","Moquegua, General Sánchez Cerro, distrito: Puquina","516",51.964
"180209","194.602","Moquegua, General Sánchez Cerro, distrito: Quinistaquillas","82",34.599
"180210","880.040","Moquegua, General Sánchez Cerro, distrito: Ubinas","345",43.726
"180211","110.737","Moquegua, General Sánchez Cerro, distrito: Yunga","225",53.957
"180301","292.982","Moquegua, Ilo, distrito: Ilo","1270",6.040
"180302","734.095","Moquegua, Ilo, distrito: El Algarrobal","109",7.703
"180303","332.140","Moquegua, Ilo, distrito: Pacocha","34",2.205
"230105","1434.356","Tacna, Tacna, distrito: Inclan","103",9.172
"230106","611.321","Tacna, Tacna, distrito: Pachia","249",30.627
"230107","1452.974","Tacna, Tacna, distrito: Palca","222",50.685
"230108","268.735","Tacna, Tacna, distrito: Pocollay","349",6.380
"230109","1134.701","Tacna, Tacna, distrito: Sama","226",13.680
"230110","187.314","Tacna, Tacna, distrito: Coronel Gregorio Albarracin Lanchipa","2469",6.665
"230201","1381.432","Tacna, Candarave, distrito: Candarave","336",33.974
"230202","176.381","Tacna, Candarave, distrito: Cairani","96",23.762
"230203","493.200","Tacna, Candarave, distrito: Camilaca","243",44.102
"230204","112.048","Tacna, Candarave, distrito: Curibaya","44",35.484
"230205","90.856","Tacna, Candarave, distrito: Huanuara","71",29.707
"230206","55.222","Tacna, Candarave, distrito: Quilahuani","104",35.616
"230401","880.156","Tacna, Tarata, distrito: Tarata","436",37.554
"230402","378.084","Tacna, Tarata, distrito: Héroes Albarracín","119",64.674
"230403","295.106","Tacna, Tarata, distrito: Estique","46",37.705
"230404","147.555","Tacna, Tarata, distrito: Estique-Pampa","23",28.395
"230405","233.009","Tacna, Tarata, distrito: Sitajara","56",29.630
"230406","359.145","Tacna, Tarata, distrito: Susapaya","132",50.000
"230407","106.724","Tacna, Tarata, distrito: Tarucachi","102",62.195
"230408","355.419","Tacna, Tarata, distrito: Ticaco","135",43.974
"230102","374.037","Tacna, Tacna, distrito: Alto de la Alianza","835",9.557
"230104","178.467","Tacna, Tacna, distrito: Ciudad Nueva","910",9.287
"040514","1540.259","Arequipa, Caylloma, distrito: San Antonio de Chuca","93",26.648
"040701","932.185","Arequipa, Islay, distrito: Mollendo","602",8.103
"040702","1549.841","Arequipa, Islay, distrito: Cocachacra","443",15.419
"040502","365.349","Arequipa, Caylloma, distrito: Achoma","89",23.797
"040105","86.112","Arequipa, Arequipa, distrito: Characato","404",9.782
"040106","230.253","Arequipa, Arequipa, distrito: Chiguata","239",22.676
"040108","695.538","Arequipa, Arequipa, distrito: La Joya","1426",12.026
"210502","1041.286","Puno, El Collao, distrito: Capazo","396",68.158
"210405","956.290","Puno, Chucuito, distrito: Pisacoma","1878",67.288
"210404","491.995","Puno, Chucuito, distrito: Kelluyo","1718",45.163
"210504","2694.171","Puno, El Collao, distrito: Santa Rosa","977",52.897
"210403","627.178","Puno, Chucuito, distrito: Huacullani","2124",59.313
"210402","174.560","Puno, Chucuito, distrito: Desaguadero","2484",41.608
"210505","844.414","Puno, El Collao, distrito: Conduriri","665",54.464
"210407","522.859","Puno, Chucuito, distrito: Zepita","3800",52.464
"211303","59.262","Puno, Yunguyo, distrito: Copani","779",39.423
"211304","23.711","Puno, Yunguyo, distrito: Cuturapi","195",35.519
"210406","400.941","Puno, Chucuito, distrito: Pomata","2260",43.237
"211301","174.721","Puno, Yunguyo, distrito: Yunguyo","3419",38.676
"211302","120.261","Puno, Yunguyo, distrito: Anapia","347",56.792
"211307","8.013","Puno, Yunguyo, distrito: Unicachi","271",47.295
"210401","772.292","Puno, Chucuito, distrito: Juli","2791",33.995
"211305","27.128","Puno, Yunguyo, distrito: Ollaraya","716",47.354
"211306","4.046","Puno, Yunguyo, distrito: Tinicachi","229",69.184
"210111","1637.527","Puno, Puno, distrito: Pichacani","1169",46.334
"210503","152.891","Puno, El Collao, distrito: Pilcuyo","2295",46.308
"210113","336.867","Puno, Puno, distrito: San Antonio","341",34.032
"210501","890.167","Puno, El Collao, distrito: Ilave","6285",35.836
"210102","1917.238","Puno, Puno, distrito: Acora","4781",46.612
"210112","244.472","Puno, Puno, distrito: Plateria","1370",42.639
"210106","115.261","Puno, Puno, distrito: Chucuito","1057",36.549
"210703","137.913","Puno, Lampa, distrito: Calapuja","121",20.826
"210701","660.655","Puno, Lampa, distrito: Lampa","1086",24.885
"210202","126.409","Puno, Azángaro, distrito: Achaya","364",32.327
"210903","403.083","Puno, Moho  , distrito: Huayrapata","499",49.066
"210607","196.930","Puno, Huancané, distrito: Taraco","1354",27.918
"210210","203.506","Puno, Azángaro, distrito: Saman","1018",29.871
"210205","117.808","Puno, Azángaro, distrito: Caminaca","344",30.714
"210808","803.746","Puno, Melgar, distrito: Santa Rosa","735",31.223
"210101","460.070","Puno, Puno, distrito: Puno","3273",7.941
"210114","488.848","Puno, Puno, distrito: Tiquillaca","346",47.011
"210109","410.022","Puno, Puno, distrito: Mañazo","448",21.886
"210110","173.667","Puno, Puno, distrito: Paucarcolla","654",39.303
"210115","194.606","Puno, Puno, distrito: Vilque","436",38.618
"210104","130.521","Puno, Puno, distrito: Atuncolla","770",46.498
"210709","1588.494","Puno, Lampa, distrito: Santa Lucia","490",19.391
"210103","13.843","Puno, Puno, distrito: Amantani","527",44.889
"211102","192.875","Puno, San Román, distrito: Cabana","536",27.016
"211103","1268.431","Puno, San Román, distrito: Cabanillas","387",21.311
"210108","128.617","Puno, Puno, distrito: Huata","452",36.334
"211104","277.383","Puno, San Román, distrito: Caracoto","743",29.368
"210107","99.567","Puno, Puno, distrito: Coata","1102",43.644
"210105","103.819","Puno, Puno, distrito: Capachica","1187",37.742
"210904","51.914","Puno, Moho  , distrito: Tilali","678",57.751
"210702","384.752","Puno, Lampa, distrito: Cabanilla","558",24.240
"211101","394.330","Puno, San Román, distrito: Juliaca","4501",6.628
"210902","67.365","Puno, Moho  , distrito: Conima","816",55.662
"210707","747.317","Puno, Lampa, distrito: Paratia","710",56.215
"210605","197.575","Puno, Huancané, distrito: Pusi","907",44.879
"210901","504.604","Puno, Moho  , distrito: Moho","3012",56.225
"210606","305.195","Puno, Huancané, distrito: Rosaspata","953",54.739
"210601","387.158","Puno, Huancané, distrito: Huancané","2251",29.657
"210704","133.191","Puno, Lampa, distrito: Nicasio","312",34.361
"210706","494.820","Puno, Lampa, distrito: Palca","411",50.429
"210608","508.126","Puno, Huancané, distrito: Vilque Chico","1767",46.820
"210710","161.059","Puno, Lampa, distrito: Vilavila","220",39.216
"210203","335.983","Puno, Azángaro, distrito: Arapa","642",25.670
"210206","151.931","Puno, Azángaro, distrito: Chupa","1193",45.396
"210214","318.665","Puno, Azángaro, distrito: Santiago de Pupuja","679",35.869
"210708","525.280","Puno, Lampa, distrito: Pucara","609",28.618
